position,channelId,channelTitle,videoId,publishedAt,publishedAtSQL,videoTitle,videoDescription,videoCategoryId,videoCategoryLabel,duration,durationSec,dimension,definition,caption,thumbnail_maxres,licensedContent,viewCount,likeCount,dislikeCount,favoriteCount,commentCount
274,UCNFqyNLJshdysCyj-xeegnA,Contextures Inc.,ZPBbWRtUZWk,2011-01-22T20:26:32Z,22/1/11 20:26,Excel INDEX Function Gets Value from Row and Column,"http://www.contextures.com/30excelfunctionsin30days30xl30d.html The INDEX function returns a value or reference, based on a row and column number. The INDEX function can: -- Find sales amount for selected month -- Get reference to specified row, column, area -- Create a dynamic range based on count -- Sort text in alphabetical order Watch this video to see how to use the Excel INDEX function, and combine it with other functions.",28,Science & Technology,PT5M25S,325,2d,sd,FALSE,,1,100370,49,22,0,3
275,UCNFqyNLJshdysCyj-xeegnA,Contextures Inc.,4WhXx0KLF3c,2011-01-20T02:35:45Z,20/1/11 2:35,Locate Text With Excel FIND Function,"http://www.contextures.com/30excelfunctionsin30days30xl30d.html The FIND function looks for a text string, within another text string. The FIND function is case sensitive and it can: -- Find start position of text in text string -- Find exact values from a list -- Find street name in address Watch this video to see how to use the Excel FIND function, and return a text string's starting position in another text string.",28,Science & Technology,PT2M54S,174,2d,sd,FALSE,,1,67603,30,33,0,1
276,UCNFqyNLJshdysCyj-xeegnA,Contextures Inc.,JUB0E5r_ERw,2011-01-18T03:49:06Z,18/1/11 3:49,Return Cell Value as Number with Excel N Function,"http://www.contextures.com/30excelfunctionsin30days30xl30d.html The N function returns a number for a value in Excel. The N function can be used to: -- Return number based on a cell's value -- Use N function alternatives -- Add a hidden note in a cell Watch this video to see how to use the Excel N function, and alternative functions.",28,Science & Technology,PT3M7S,187,2d,sd,FALSE,,1,21856,17,4,0,2
277,UCNFqyNLJshdysCyj-xeegnA,Contextures Inc.,2Jt9sVhhR7c,2011-01-16T23:23:53Z,16/1/11 23:23,Identify Cell Contents with Excel TYPE Function,"http://www.contextures.com/30excelfunctionsin30days30xl30d.html The TYPE function returns a number for a specific data type in Excel. The TYPE function can be used to: -- Identify cell value type by number -- Test for Number type before multiplying Watch this video to see how to use the Excel TYPE function, and return a number for a specific data type.",28,Science & Technology,PT1M59S,119,2d,sd,FALSE,,1,9435,16,3,0,2
278,UCNFqyNLJshdysCyj-xeegnA,Contextures Inc.,nydCUYe00cU,2011-01-16T02:39:13Z,16/1/11 2:39,Get Cell Address as With Excel ADDRESS Function,"http://www.contextures.com/30excelfunctionsin30days30xl30d.html The ADDRESS function returns a cell address as text, based on a row number and column number. The ADDRESS function can be used to: -- Get cell address from row and column number -- Find cell value from row and column number -- Return address of cell with highest value Watch this video to see how to use the Excel ADDRESS function, and combine it with other Excel functions.",28,Science & Technology,PT5M12S,312,2d,sd,FALSE,,1,69764,144,16,0,6
279,UCNFqyNLJshdysCyj-xeegnA,Contextures Inc.,5SB-TuuYbT0,2011-01-14T19:52:20Z,14/1/11 19:52,Find Item Position in List With Excel MATCH Function,"http://www.contextures.com/30excelfunctionsin30days30xl30d.html The MATCH function looks for a value in an array or array reference, and returns the position in the array. The MATCH function is not case sensitive and it can: -- Find position of item in unsorted list -- Combine with CHOOSE to get student grades -- Create flexible column choice with VLOOKUP -- Combine with INDEX for to show winner's name Watch this video to see how to use the Excel MATCH function, and return a value's position in an array. Download the Excel MATCH sample workbook from the Contextures blog: http://blog.contextures.com/archives/2011/01/10/30-excel-functions-in-30-days-09-vlookup/",28,Science & Technology,PT5M28S,328,2d,sd,FALSE,,1,12396,12,1,0,4
280,UCNFqyNLJshdysCyj-xeegnA,Contextures Inc.,ooQMVS-acCg,2011-01-12T20:50:47Z,12/1/11 20:50,Find Text in String With Excel SEARCH Function,"http://www.contextures.com/30excelfunctionsin30days30xl30d.html The SEARCH function looks for a text string, within another text string. The SEARCH function is not case sensitive and it can: -- Find a text string within another text string - not case sensitive -- Use wildcards in the search -- Specify a start number within search text Watch this video to see how to use the Excel SEARCH function, and return a text string's starting position in another text string.",28,Science & Technology,PT5M8S,308,2d,sd,FALSE,,1,115749,146,20,0,15
281,UCNFqyNLJshdysCyj-xeegnA,Contextures Inc.,vTX8RRKFouc,2011-01-12T02:48:10Z,12/1/11 2:48,Troubleshoot Excel Errors with ERROR.TYPE Function,"http://www.contextures.com/30excelfunctionsin30days30xl30d.html The ERROR.TYPE function returns a number for a specific error type in Excel. The ERROR.TYPE function can be used to: -- Identify error results in a cell -- Help users troubleshoot Excel errors Watch this video to see how to use the Excel ERROR.TYPE function, and return a number for a specific error.",28,Science & Technology,PT2M16S,136,2d,sd,FALSE,,1,5700,8,1,0,0
282,UCNFqyNLJshdysCyj-xeegnA,Contextures Inc.,Uokl8QC4IGo,2011-01-11T20:08:32Z,11/1/11 20:08,Get Last Number With Excel LOOKUP Function,"http://www.contextures.com/30excelfunctionsin30days30xl30d.html The LOOKUP function looks for a value in a vector or array, and returns a matching value. The LOOKUP function can: -- Find the last number in a column -- Find latest month with negative amount -- Convert student percentages to letter grades Watch this video to see how to use the Excel LOOKUP function, and return a value from any column in a table.",28,Science & Technology,PT3M43S,223,2d,sd,FALSE,,1,10477,13,5,0,7
283,UCNFqyNLJshdysCyj-xeegnA,Contextures Inc.,uHJQRq_x9rE,2011-01-10T16:39:01Z,10/1/11 16:39,Repeat Text with Excel REPT Function,"http://www.contextures.com/30excelfunctionsin30days30xl30d.html Use the REPT function in Excel to repeat text a specified number of times in a cell In some situations, use cell formatting instead, to quickly fill a cell with text, and have it adjust automatically if the cell width changes. You can use the REPT function to do the following: --Create an in-cell bar or dot chart --Track scores with a simple tally --Use it with VLOOKUP to find the last text item in a column Watch this video to see how to use the Excel REPT function, and combine it with other functions.",28,Science & Technology,PT6M9S,369,2d,sd,FALSE,,1,24612,19,6,0,1
284,UCNFqyNLJshdysCyj-xeegnA,Contextures Inc.,ZWu5MetIwlE,2011-01-09T02:51:01Z,9/1/11 2:51,Change Horizontal Data to Vertical - Excel TRANSPOSE Function,"http://www.contextures.com/30excelfunctionsin30days30xl30d.html Use the TRANSPOSE function in Excel to change vertical data to horizontal, or vice versa. If you don't need to keep links to the original data, use the Paste Special Transpose command instead. You can use the TRANSPOSE function to do the following: --Change data orientation from horizontal to vertical --Use it with other functions to total a range of cells Watch this video to see how to use the Excel TRANSPOSE function, and combine it with other functions. Instructor: Debra Dalgleish, Contextures Inc. Get Debra's weekly Excel tips: http://www.contextures.com/signup01 More Excel Tips and Tutorials: http://www.contextures.com/tiptech.html Subscribe to Contextures YouTube: https://www.youtube.com/user/contextures?sub_confirmation=1 #ContexturesExcelTips VIDEO TRANSCRIPT With the TRANSPOSE function in Excel, you can take data that's arranged horizontally and display it vertically or vice versa, and you keep the links to the original data. So if something changes here, it would also change in the display data with the TRANSPOSE function. To look at an example of how we can use it, we have four years of data and the units sold in each year. To transpose that, I would like to have the years down a column and the unit sales beside each year. I've got 4 columns by 2 rows. To transpose that, I'll select the opposite. I want 4 rows and 2 columns. With those cells selected, I type =TRANSPOSE, open bracket, and then the cells from the original data. Close the bracket and the TRANSPOSE function is array entered. So on the keyboard, press the Ctrl and shift keys, and then tap the Enter key. And if you look in the Formula Bar, you can see curly brackets have been added at the beginning and end of that formula to show that it's array entered. So there's the data that's gone from horizontal to vertical. You can do that with other functions though. The TRANSPOSE function is a bit limiting because you have to know, ahead of time, exactly the size of the original data and the size, select that size in the location where you're pasting it. If you use a function like INDEX instead. So here I've used INDEX, and I could just make that more flexible. I'm not sure how many years of data I'm going to have. Each formula's individually entered in a cell. It's not array entered, so it gives me a bit more flexibility. So that's an alternative to using TRANSPOSE is to, to use another function like INDEX. If you don't need to keep the links, you can also use Paste Special to change data from horizontal to vertical. If I selected these three cells, and on the Home tab, I'll copy them. Then I can select a cell where I'd like to start pasting those. I don't have to pick the range that's the exact size. I just select the starting cell and then from the Paste drop down, click Transpose and there's the transposed data, and the original is still there. They're not linked at all, but you have the data in a different layout. You can use TRANSPOSE in other formulas. This is a very long, complicated formula, but you can see TRANSPOSE is used in here. You can see curly brackets at the end and the beginning. So this is another array-entered formula, and it's looking at all these years of salaries and finding the best four consecutive years.",28,Science & Technology,PT3M22S,202,2d,sd,TRUE,,1,412855,541,89,0,64
285,UCNFqyNLJshdysCyj-xeegnA,Contextures Inc.,_aNyuFjRsuk,2011-01-08T03:22:30Z,8/1/11 3:22,Count Columns With Excel COLUMNS Function,"http://www.contextures.com/30excelfunctionsin30days30xl30d.html Use the COLUMNS function in Excel to count the number of columns in an array or reference. The COLUMNS function isn't too exciting or powerful, but does a good job at counting columns. You can use the COLUMNS function to do the following: --Count the number of columns in an Excel table --Use it with other functions to total a specific column Watch this video to see how to use the Excel COLUMNS function, and combine it with other functions.",28,Science & Technology,PT3M8S,188,2d,sd,FALSE,,1,34599,18,14,0,1
286,UCNFqyNLJshdysCyj-xeegnA,Contextures Inc.,C_XphQ9YBOg,2011-01-07T04:31:12Z,7/1/11 4:31,Get Excel Worksheet Name with CELL Function,"http://www.contextures.com/30excelfunctionsin30days30xl30d.html Use the CELL function in Excel to get details about the cell format, location and contents. The CELL function can show details such as column width, worksheet name and number format. Watch this video to see how to use the Excel CELL function, and get cell details.",28,Science & Technology,PT2M48S,168,2d,sd,FALSE,,1,41506,36,11,0,3
287,UCNFqyNLJshdysCyj-xeegnA,Contextures Inc.,vr3aVsyE0s8,2011-01-06T06:28:57Z,6/1/11 6:28,Get Table Data With Excel HLOOKUP Function,"http://www.contextures.com/30excelfunctionsin30days30xl30d.html The HLOOKUP function looks for a value in the first row of a table, and returns another value from the same column in that table. The HLOOKUP function can find exact matches in the lookup row, or the closest match, so it can: -- Find the sales total for a selected region -- Find the bank rate in effect a on selected date Watch this video to see how to use the Excel HLOOKUP function, and return a value from a table.",28,Science & Technology,PT3M39S,219,2d,sd,FALSE,,1,30634,24,0,0,2
288,UCNFqyNLJshdysCyj-xeegnA,Contextures Inc.,boyqJlLbD24,2011-01-04T01:40:36Z,4/1/11 1:40,Get Characters With Excel CHAR Function,"http://www.contextures.com/30excelfunctionsin30days30xl30d.html returns a character for a specific code number. For Windows, the returned character is from the ANSI character set, and for Macintosh, the character is from the Macintosh character set. . The CHAR function can be used to: -- Add a line break in a formula -- Find a specific letter in the alphabet -- List all the letters of the alphabet -- Create a reference table of character codes Watch this video to see how to use the Excel CHAR function, and return a character for a specific number.",28,Science & Technology,PT4M35S,275,2d,sd,FALSE,,1,18512,33,2,0,2
289,UCNFqyNLJshdysCyj-xeegnA,Contextures Inc.,q29nJKewxHk,2011-01-03T07:25:04Z,3/1/11 7:25,Get Character Number With Excel CODE Function,"http://www.contextures.com/30excelfunctionsin30days30xl30d.html returns a numeric code for the first character in a text string. For Windows, the returned code is from the ANSI character set, and for Macintosh, the code is from the Macintosh character set. . The CODE function can help unravel mysteries in your data, such as: -- What hidden character is at the end of imported text? -- How can I type a special symbol in a cell? Watch this video to see how to use the Excel CODE function, and return a numeric code.",28,Science & Technology,PT2M53S,173,2d,sd,FALSE,,1,31041,23,2,0,0
290,UCNFqyNLJshdysCyj-xeegnA,Contextures Inc.,K6MEG9k4G30,2011-01-01T01:50:08Z,1/1/11 1:50,Select Item in List With Excel CHOOSE Function,"http://www.contextures.com/30excelfunctionsin30days30xl30d.html Use the CHOOSE function in Excel to select a specific numbered item in a list. The CHOOSE function can help show which fiscal quarter a month is in, or show the total sales for a selected store number Watch this video to see how to use the Excel CHOOSE function, and select items in a list.",28,Science & Technology,PT5M10S,310,2d,sd,FALSE,,1,28956,45,9,0,0
291,UCNFqyNLJshdysCyj-xeegnA,Contextures Inc.,EMr2uRSRGzc,2010-12-31T06:07:54Z,31/12/10 6:07,Get Excel Version Number with INFO Function,"http://www.contextures.com/30excelfunctionsin30days30xl30d.html Use the INFO function in Excel to get details about the current operating environment. The INFO function can show details such as Excel version, recalculation mode and number of worksheets in all open workbooks. Watch this video to see how to use the Excel INFO function, and remove extra spaces.",28,Science & Technology,PT2M22S,142,2d,sd,FALSE,,1,5571,13,2,0,5
292,UCNFqyNLJshdysCyj-xeegnA,Contextures Inc.,#NAME?,2010-12-30T19:44:57Z,30/12/10 19:44,Remove Spaces With Excel TRIM Function,"http://www.contextures.com/30excelfunctionsin30days30xl30d.html Use the TRIM function in Excel to remove spaces in a text string. The TRIM function removes spaces at the start and end of the text string, and all but single spaces between words. However, the TRIM function cannot remove a non-breaking space that was copied from a website. Watch this video to see how to use the Excel TRIM function, and remove extra spaces.",28,Science & Technology,PT2M18S,138,2d,sd,TRUE,,1,42690,42,4,0,7
293,UCNFqyNLJshdysCyj-xeegnA,Contextures Inc.,l-1QbVlcjjI,2010-12-28T20:33:26Z,28/12/10 20:33,Count Areas With Excel AREAS Function,"http://www.contextures.com/30excelfunctionsin30days30xl30d.html Use the AREAS function in Excel to count the number of areas in a reference. An area is a range of contiguous cells or a single cell. The cells can be empty, or contain data -- that has no effect on the count. The AREAS function doesn't have many real-world uses, but it shows how the different reference operators (colon, comma, space) work. You can use the AREAS function to do the following: --Count the number of areas in a range --Count the number of intersections for multiple ranges --Calculate an area number for an INDEX function Watch this video to see how to use the Excel AREAS function, and the 3 reference operators.",28,Science & Technology,PT4M33S,273,2d,sd,FALSE,,1,16103,32,2,0,2
294,UCNFqyNLJshdysCyj-xeegnA,Contextures Inc.,lYtGzpwWNf0,2010-12-27T16:52:30Z,27/12/10 16:52,Compare Cells With Excel EXACT Function,"http://www.contextures.com/30excelfunctionsin30days30xl30d.html Use the EXACT function in Excel to compare text strings, including the upper and lower case of the characters. If the contents and case are identical, the EXACT function result is TRUE. If the cells are not identical, the result is FALSE. You can use EXACT function in Excel data validation, to control what users can enter in a cell. Use EXACT with a lookup table, to find exact matches for passwords or product codes. You can also pull the related values for the exact match, similar to using VLOOKUP. Or, use EXACT to count the occurrences of an item in a list, where the contents and case are identical. Watch this video to see how to use the Excel EXACT function.",28,Science & Technology,PT6M53S,413,2d,sd,FALSE,,1,34488,69,6,0,6
295,UCNFqyNLJshdysCyj-xeegnA,Contextures Inc.,kd4g8t81co0,2010-12-24T05:10:08Z,24/12/10 5:10,Colour a Row in Excel Based on One Cell's Value,"In Excel, follow these steps to check the value in one cell, and colour all other cells in that row, if the value is above a specified amount. Watch this video to see how to colour a row in a table, by using Excel's conditional formatting. A formula checks one cell in each row. To get the Excel workbook, go to my Contextures website: http://www.contextures.com/xlCondFormat02.html Instructor: Debra Dalgleish, Contextures Inc. Get Debra's weekly Excel tips: http://www.contextures.com/signup01 More Excel Tips and Tutorials: http://www.contextures.com/tiptech.html Subscribe to Contextures YouTube: https://www.youtube.com/user/contextures?sub_confirmation=1 #ContexturesExcelTips VIDEO TRANSCRIPT With Excel's conditional formatting, you can easily highlight a cell if it's over or under a certain value, or if it meets a value that you've set. But in some cases, instead of just a single cell, you might like to highlight a whole row in a table, if one of the cells in that row is over a certain number or under. In this case, we would like to highlight each row in this list if the number of units sold is greater than 75. So to do that, I'm going to select all of the rows, all of the columns in each row. So I've selected from A2 down to D10. On the Ribbon, on the Home tab, I'll click Conditional Formatting, and none of these preset rules will do exactly what I want. So I'm going down to New Rule, and in here I'll select a formula. So I'm going to use a formula to determine how to color each row. When I click that, there's a spot where I can put the formula. I want to, in each row, look at the value that's in column B. So I'll type = And we want, from every column, we want to look at column B. So we have to lock that cell. We don't want it to be relative, we want it to be absolute. So type a $ to lock that in. And then B. And we want, in this case, the active cell we can see is white, where the other cells are highlighted with blue. We can see that, in the name box, A2 is showing up. So that's the active cell, so the active row is 2. So I'm going to type 2 here. We're going to check what's in B2 and see if it's greater than 75. So that's our test. And if it is greater than 75, we want to format it. So I'll click Format and I'll choose a fill color, maybe a blue color and click OK, and click OK again. And now, any row where the number of units is greater than 75, all four cells in that row are colored blue.",28,Science & Technology,PT2M39S,159,2d,sd,TRUE,,1,382466,431,31,0,62
296,UCNFqyNLJshdysCyj-xeegnA,Contextures Inc.,BdG43GjIwRg,2010-12-24T05:07:08Z,24/12/10 5:07,Filter Excel Data to Different Worksheet,"See how to filter Excel data to different worksheet in the same workbook, by using an advanced filter. Get the sample file from my Contextures website:. http://www.contextures.com/xladvfilter01.html In Excel, follow these steps to use an advanced filter to copy data from a table on one sheet, onto anther sheet in the same workbook. Watch this video to see how to set up a criteria area with your filter rules. Then, choose an extract area, where you want the filtered data to go. In this example, the top orders are filtered to a different sheet. NOTE: If the data changes, you will have to run the Advanced Filter again to update the extracted data. The extracted data is a copy of the original data, and not linked to it. Instructor: Debra Dalgleish, Contextures Inc. Get Debra's weekly Excel tips: http://www.contextures.com/signup01 More Excel Tips and Tutorials: http://www.contextures.com/tiptech.html Subscribe to Contextures YouTube: https://www.youtube.com/user/contextures?sub_confirmation=1 VIDEO TRANSCRIPT In Excel, you can use an Advanced Filter to pull data from a table and put it somewhere else in the workbook, either on the same sheet or a different sheet. In this example, we have a list of orders and we would like to pull the orders with the highest totals and put them on a different sheet in the workbook. I would like to get the date and the customer for each of the high priced orders. Back on the Orders sheet, I've started a criteria area here. I'm using total, which is the column where the order amount is in the main table. That's the criteria heading, and below that I'm going to enter my criterion, which is greater than 1500. I only want orders where the total is greater than 1500. I'm not putting dollar signs in here. It's just the number that I wanted to check. We want to pull orders onto a different worksheet. In this case, we have to start on this destination worksheet, and I want to stay away from the cells near the heading. So, I'm just going to click a cell somewhere in an empty area of the worksheet. To start the filter on the ribbon, I'll go to the Data tab and click Advanced. In the Advanced Filter dialog, I'm going to select Copy to Another Location. The List range is my main table. So, I'll click here, then go to the Orders sheet and select the entire table, including the headings. That's entered as the list range. My Criteria range, I'll click in that cell. Go back to the Orders sheet where I created my criteria range and select the heading cell and the criteria cell below that. For CopyTo, this is where I want the data to end up. I'll click here and select my two heading cells on the TopOrders sheet and I'll click OK, and there are the 3 orders where the total is higher than 1500. If we look back, we can see 1, 2, 3 orders, and those have been copied automatically to the other worksheet using an Advanced Filter.",28,Science & Technology,PT2M35S,155,2d,sd,TRUE,https://i.ytimg.com/vi/BdG43GjIwRg/maxresdefault.jpg,1,477161,556,57,0,62
297,UCNFqyNLJshdysCyj-xeegnA,Contextures Inc.,yOAGd6j3BcA,2010-12-23T20:13:31Z,23/12/10 20:13,Create Drop Down List in Excel Worksheet Cell,"http://www.contextures.com/xlDataVal01.html In an Excel worksheet, you can create a drop down list in a cell, or group of cells. Instead of typing, people select from that drop down list, to prevent typing mistakes and invalid entries. Watch this video to see how to name a list, and then create drop down lists in the worksheet cells, based on that list. Instructor: Debra Dalgleish, Contextures Inc. Get Debra's weekly Excel tips: http://www.contextures.com/signup01 Subscribe to Contextures YouTube: https://www.youtube.com/user/contextures?sub_confirmation=1 Save Time with the Excel Data Entry Pop Up Kit: http://www.contextures.com/datavalidationmultiselectpremium.html",28,Science & Technology,PT2M14S,134,2d,sd,FALSE,,1,106446,193,4,0,36
298,UCNFqyNLJshdysCyj-xeegnA,Contextures Inc.,6UCJCB2vtHA,2010-12-19T01:26:38Z,19/12/10 1:26,Use Excel Scroll Bar to Change Worksheet - No Macros,"http://www.contextures.com/excelscrollbarchristmastree.html With a simple Excel scroll bar, and no macros, you can show different messages on a worksheet. This Excel scroll bar example also uses conditional formatting, to show and hide coloured cells on the worksheet. The Excel VLOOKUP function is used to show the correct message in a text box. Drag the scroll bar to show or hide the Christmas tree decorations and gifts. Use these techniques in your business workbooks too! Watch this video to see how to use an Excel scroll bar to change the worksheet appearance, without Excel VBA.",28,Science & Technology,PT1M32S,92,2d,sd,FALSE,,1,9065,18,0,0,2
299,UCNFqyNLJshdysCyj-xeegnA,Contextures Inc.,Yx95dbat9ok,2010-12-11T17:17:25Z,11/12/10 17:17,Create an Excel Function to Extract Hyperlink Address,"http://www.contextures.com/excelhyperlinkfunction.html If you copy a list of hyperlinks from a website into Excel, you might need to extract the URL or email address for each of those hyperlinks. There isn't a built-in function in Excel that will extract the hyperlink address, but you can create your own function in Excel VBA. Watch this video to see how to create your own function to extract the address from a hyperlink, in Excel VBA. For the basics on adding a code module to your workbook, see this video: http://www.youtube.com/watch?v=IBq92g7gGBE",17,Sports,PT2M11S,131,2d,sd,FALSE,,1,43920,72,12,0,26
