position,channelId,channelTitle,videoId,publishedAt,publishedAtSQL,videoTitle,videoDescription,videoCategoryId,videoCategoryLabel,duration,durationSec,dimension,definition,caption,thumbnail_maxres,licensedContent,viewCount,likeCount,dislikeCount,favoriteCount,commentCount
1,UCNFqyNLJshdysCyj-xeegnA,Contextures Inc.,d_5RQiWJDNs,2020-07-21T23:43:26Z,21/7/20 23:43,Show Matching Items in Excel List,"Pick a region from a drop down list, and see a list of employees from that region. There are no macros in this Excel workbook, just INDEX/MATCH and other Excel formulas. This video shows how to set up the Excel tables, and the drop down list. Then, see how to add the formulas, and learn how those formulas work. Download the free Excel workbook on this page: https://www.contextures.com/matchingitemsforselection.html Video Timeline: 00:00 Introduction 01:01 Create 2 Lists 01:26 Named Tables 02:08 Name the Tables 02:48 Named Ranges 03:41 Drop Down List 04:50 Employee Numbers 07:31 Number in Region 08:44 Matching Items List 09:29 Number Formula 11:48 Employee Name Formula 13:47 Get the Workbook Instructor: Debra Dalgleish, Contextures Inc. Get Debra's weekly Excel tips: http://www.contextures.com/signup01 More Excel Tips and Tutorials: http://www.contextures.com/tiptech.html Subscribe to Contextures YouTube: https://www.youtube.com/user/contextures?sub_confirmation=1 #ContexturesExcelTips",27,Education,PT14M9S,849,2d,hd,FALSE,https://i.ytimg.com/vi/d_5RQiWJDNs/maxresdefault.jpg,1,863,48,1,0,8
2,UCNFqyNLJshdysCyj-xeegnA,Contextures Inc.,rl4PvR7G_5k,2020-06-16T18:49:26Z,16/6/20 18:49,Connect Excel Slicers to Multiple Pivot Tables,"If you create two or more pivot tables from the same source data (pivot cache), you can connect them to the same Excel Slicers. That will make it easy to filter all the connected pivot tables at the same time. This short video shows the easy steps for creating the Slicers, based on one pivot table. Next, see how to connect another pivot table to the same Slicers. Download the free Excel workbook on this page: https://www.contextures.com/excelpivottableslicers.html Video Timeline: 00:00 Introduction 00:22 Two Pivot Tables 00:58 Add Slicers 02:55 Connect Another Pivot Table 04:29 Get More Information Instructor: Debra Dalgleish, Contextures Inc. Get Debra's weekly Excel tips: http://www.contextures.com/signup01 More Excel Tips and Tutorials: http://www.contextures.com/tiptech.html Subscribe to Contextures YouTube: https://www.youtube.com/user/contextures?sub_confirmation=1 #ContexturesExcelTips",27,Education,PT4M51S,291,2d,hd,FALSE,https://i.ytimg.com/vi/rl4PvR7G_5k/maxresdefault.jpg,1,1546,46,0,0,7
3,UCNFqyNLJshdysCyj-xeegnA,Contextures Inc.,IDXpoyjl11U,2020-05-19T20:39:34Z,19/5/20 20:39,Copy Excel Formulas with Table References,"If you create formulas with table references, and then try to copy those formulas to adjacent columns, you might run into problems. This video shows a SUMIFS formula that has a correct total. When the formula is dragged to the next column, the total there is incorrect. See two easy ways to prevent that problem, when copying Excel formulas with table references. Get the details on this page: https://www.contextures.com/xlFunctions01.html#tablerefs Video Timeline: 00:00 Introduction 00:46 SUBTOTAL Formula to Check Totals 01:19 SUMIFS Formula with Table References 01:42 Copy the Formula Down One Row 02:13 Copy Across 03:09 Copy With No Problems 03:45 Get More Information Instructor: Debra Dalgleish, Contextures Inc. Get Debra's weekly Excel tips: http://www.contextures.com/signup01 More Excel Tips and Tutorials: http://www.contextures.com/tiptech.html Subscribe to Contextures YouTube: https://www.youtube.com/user/contextures?sub_confirmation=1 #ContexturesExcelTips",27,Education,PT4M8S,248,2d,hd,FALSE,https://i.ytimg.com/vi/IDXpoyjl11U/maxresdefault.jpg,1,1136,64,0,0,11
4,UCNFqyNLJshdysCyj-xeegnA,Contextures Inc.,Cbs1DNW_wxo,2020-02-18T17:25:54Z,18/2/20 17:25,Excel Drop Down Lists from Dynamic Arrays,"Select a region name in one Excel drop down list, and then select an employee from that region, in the next drop down list. This example uses new Excel functions, UNIQUE, SORT, and FILTER, to create dynamic arrays for the lists used in the drop downs. To get the free workbook for this video, go to my Contextures website: https://www.contextures.com/exceldatavaldependdynamic.html Video Timeline: 0:00 Introduction 0:31 Create a Unique List of Regions 2:38 Make a Region Drop Down 3:30 Create an Employee List 5:50 Make an Employee Drop Down 7:35 Get the Workbook Instructor: Debra Dalgleish, Contextures Inc. Get Debra's weekly Excel tips: http://www.contextures.com/signup01 More Excel Tips and Tutorials: http://www.contextures.com/tiptech.html Subscribe to Contextures YouTube: https://www.youtube.com/user/contextures?sub_confirmation=1 #ContexturesExcelTips",27,Education,PT7M57S,477,2d,hd,FALSE,https://i.ytimg.com/vi/Cbs1DNW_wxo/maxresdefault.jpg,1,2465,77,2,0,9
5,UCNFqyNLJshdysCyj-xeegnA,Contextures Inc.,KxFEPYdcymU,2020-02-04T21:34:02Z,4/2/20 21:34,Excel Copy and Paste Problem for Multiple Selections,"You can run into problems if you try to copy multiple ranges, and paste them to a new location. --You might see an error, ""This action won't work on multiple selections"" --Or, Excel might paste values, instead of formulas. To get the free workbook for this video, go to my Contextures website: https://www.contextures.com/xlDataEntry01.html Video Timeline: 0:00 Introduction 0:15 Copy Error Message 0:42 Avoid the Error Message 1:54 Paste Problem 2:40 Copy 2 Ranges 3:23 Paste With Formulas 4:13 Get the Workbook Instructor: Debra Dalgleish, Contextures Inc. Get Debra's weekly Excel tips: http://www.contextures.com/signup01 More Excel Tips and Tutorials: http://www.contextures.com/tiptech.html Subscribe to Contextures YouTube: https://www.youtube.com/user/contextures?sub_confirmation=1 #ContexturesExcelTips",27,Education,PT4M35S,275,2d,hd,FALSE,https://i.ytimg.com/vi/KxFEPYdcymU/maxresdefault.jpg,1,10954,65,9,0,5
6,UCNFqyNLJshdysCyj-xeegnA,Contextures Inc.,qCD1iN5GsM4,2019-09-04T23:32:34Z,4/9/19 23:32,Excel AutoFilter for Date Range Two Ways,"In Excel, see how to AutoFilter for a Date Range in 2 different ways: 1. Use a Date filter, with the Between option 2. Add Conditional Formatting to the cells, and filter by font colour. Which AutoFilter method will you choose? To get the free workbook with the Date Range filter example, go to my Contextures website: https://www.contextures.com/xlautofilter01.html This video shows both ways to AutoFilter for a date range in Excel. Video Timeline: 0:00 Intro 0:17 Use the Date Filter 2:01 Another Way to Filter 2:42 Create a Formula 4:03 Add Conditional Formatting 6:21 Get the Workbook Instructor: Debra Dalgleish, Contextures Inc. Get Debra's weekly Excel tips: http://www.contextures.com/signup01 More Excel Tips and Tutorials: http://www.contextures.com/tiptech.html Subscribe to Contextures YouTube: https://www.youtube.com/user/contextures?sub_confirmation=1 #ContexturesExcelTips '----- VIDEO TRANSCRIPT I'm going to check whether each date is on or after this date, and on or before this date. We could do that on the worksheet with a formula, and we'll do it here first, and then use the same formula in conditional formatting. In this cell I'm going to type an equal sign. I want to check two things. So I'm going to use the AND function and an open bracket. The first thing I want to check is if this cell B4 is greater than or equal to this cell. B4 greater than, equal to, and the start date. Now it's gone in as a relative reference, but no matter which row I'm checking, I always want it to check this cell. I'm going to press the F4 key, to put dollar signs in there, and make that an absolute reference. Then I'll type a comma and the next thing I want to check is if B4 is less than or equal to the end date. B4 less than equal to. Click on the end date and again press F4, to lock that and make it an absolute reference to that cell. Close the bracket and press Enter. Now this one is not in that date range, but if I drag down, and we've got a few more dates here, going down to the beginning of April, we can see that these are all TRUE and they're from January 17th to February 14th. If I look at that count down here, we've got 8. We're going to use this same formula in the conditional formatting rule that we'll set up. So I've selected the first cell, I want to be in the first row. I'll highlight that in the formula bar, Ctrl+C to copy it. Then press Enter, to get out of the edit mode in that cell. I'm going to click the heading of the Date column, to select all the date cells. Then up on the Home tab, Conditional Formatting. New Rule. In here, I want to use a formula. We're going to use that formula that we just copied and I'll click in the format values, formula cell, and Ctrl+V to paste that formula. I'm going to click Format, and on the Font tab, I'm just going to make a subtle change to the color. That way, if we wanted to print this sheet, nobody would notice that there is a difference in some of the cells. So instead of Automatic, which right now is black, I'm going down to this last one, which is Black Text, 1 Lighter 5%. I'll click OK and we can see the formatting example here. Click OK and now we don't really see any difference here, but if I go to that drop down arrow, now there's a Filter by Color option. Filter by Font Color, and it shows in the filtered results, just the ones where we have the TRUE. And it's got the same 8 count that we had before. To clear that, I've got a shortcut up on my Quick AccessToolbar. Now all the records are showing again, We can clear out this list of formulas that we entered. Now if I want to look at from January 1st to February 15th. I can go back to my Filter by Color, and it now includes all of the dates in this new date range. without having to go in and change the settings in the filter Between that we did before. .",27,Education,PT6M46S,406,2d,hd,TRUE,https://i.ytimg.com/vi/qCD1iN5GsM4/maxresdefault.jpg,1,6507,82,2,0,9
7,UCNFqyNLJshdysCyj-xeegnA,Contextures Inc.,QqNRPBmPtqE,2019-08-17T17:23:34Z,17/8/19 17:23,How to Change Sheet Names in Excel Macro Code,"If you change sheet names in your workbook, you might need to change sheet names in Excel macro code too. This video shows 2 options for changing the macro code. 1. Change the sheet tab names in the code, with find and replace 2. Use sheet code names, instead of sheet tab names, for a better solution to the problem To get the free workbook, go to my Contextures website: https://www.contextures.com/exceldataentryupdateform.html This video shows both options to change sheet names in Excel macro code. Video Timeline: 00:00 Intro 0:59 View the Code 2:10 Two Options 2:58 Find and Replace 4:55 Use Code Names 7:26 Get the Workbook Instructor: Debra Dalgleish, Contextures Inc. Get Debra's weekly Excel tips: http://www.contextures.com/signup01 More Excel Tips and Tutorials: http://www.contextures.com/tiptech.html Subscribe to Contextures YouTube: https://www.youtube.com/user/contextures?sub_confirmation=1",27,Education,PT7M50S,470,2d,hd,FALSE,https://i.ytimg.com/vi/QqNRPBmPtqE/maxresdefault.jpg,1,4023,46,0,0,9
8,UCNFqyNLJshdysCyj-xeegnA,Contextures Inc.,U5Rk2fa29Zo,2019-08-13T18:33:12Z,13/8/19 18:33,Show or Hide Borders in Excel Weekly Planner,"See how to show or hide borders in this free Excel weekly planner template. Select options on the Setup sheet, and conditional formatting changes the related cell formatting on the weekly planner print out page. Get the free weekly planner template on my Contextures website: https://www.contextures.com/excelweeklyplannertemplate.html Video Timeline: 0:00 Intro 0:17 Change the Setup Options 2:08 Day Section Lines 3:53 To Do List Lines 7:20 Get the Weekly Planner Instructor: Debra Dalgleish, Contextures Inc. Get Debra's weekly Excel tips: http://www.contextures.com/signup01 More Excel Tips and Tutorials: http://www.contextures.com/tiptech.html Subscribe to Contextures YouTube: https://www.youtube.com/user/contextures?sub_confirmation=1",27,Education,PT7M36S,456,2d,hd,FALSE,https://i.ytimg.com/vi/U5Rk2fa29Zo/maxresdefault.jpg,1,1083,33,2,0,5
9,UCNFqyNLJshdysCyj-xeegnA,Contextures Inc.,Mqow3hp5yr0,2019-07-18T23:21:53Z,18/7/19 23:21,How to Move or Remove Groups on Excel Ribbon Tabs,"See how to move or remove groups on Excel Ribbon tabs, instead of leaving them in their default position. Make your favourite commands easy to reach, by rearranging the Ribbon groups. Find more Excel Ribbon and QAT tips my Contextures website: Customize Quick Access Toolbar https://www.contextures.com/excel-quick-access-toolbar-customize.html Save Your Excel Ribbon Customizations https://contexturesblog.com/archives/2017/06/29/save-your-excel-ribbon-customizations/ In this video, you'll see how to move groups in an Excel Ribbon tab, and how to remove some groups. Then, if you need those commands again, see how to restore a group to the Excel Ribbon. Video Timeline: 00:00 Intro 0:17 Excel Ribbon Changes 1:25 Move a Group 2:52 Remove a Group 3:42 Restore a Group 4:23 More Excel Tips Instructor: Debra Dalgleish, Contextures Inc. Get Debra's weekly Excel tips: http://www.contextures.com/signup01 More Excel Tips and Tutorials: http://www.contextures.com/tiptech.html Subscribe to Contextures YouTube: https://www.youtube.com/user/contextures?sub_confirmation=1",27,Education,PT4M35S,275,2d,hd,FALSE,https://i.ytimg.com/vi/Mqow3hp5yr0/maxresdefault.jpg,1,1471,28,2,0,2
10,UCNFqyNLJshdysCyj-xeegnA,Contextures Inc.,lLeuj58mzh4,2019-06-04T19:56:34Z,4/6/19 19:56,Pivot Table Drop Down List Shows Old Items,"If you remove items from a pivot table's source data, you might see that Pivot Table drop down list shows old items, even after you refresh the pivot table. To get the free workbook, go to my Contextures website: https://www.contextures.com/xlPivot04.html In this video, you'll see how to remove those old items from a pivot table, with a change to the pivot table settings. And, if you're using Excel for Office 365, or Excel 2019, you can change the pivot table default settings. Then, when you create new pivot tables, they'll automatically have the settings that you prefer. Video Timeline: 00:00 Intro 1:37 Change a Setting 2:57 Default Setting 4:21 Get the Sample File Instructor: Debra Dalgleish, Contextures Inc. Get Debra's weekly Excel tips: http://www.contextures.com/signup01 More Excel Tips and Tutorials: http://www.contextures.com/tiptech.html Subscribe to Contextures YouTube: https://www.youtube.com/user/contextures?sub_confirmation=1",27,Education,PT4M35S,275,2d,hd,FALSE,https://i.ytimg.com/vi/lLeuj58mzh4/maxresdefault.jpg,1,5824,59,1,0,8
11,UCNFqyNLJshdysCyj-xeegnA,Contextures Inc.,rL0SunZCrlk,2019-05-23T23:47:59Z,23/5/19 23:47,Excel Golf Tee Off Times and Player Schedule,"Use this Excel golf tee off times workbook, to enter player names and tee off times for your tournament. Then, select 4 players for each tee off time, and click a button to automatically add the names to your schedule. To get the free workbook, go to my Contextures website: https://www.contextures.com/excelgolfteeofftimes.html This video shows how to use the workbook to assign players to golf tee off times. A drop down list of times, and macro buttons, make it easy to use. Video Timeline: 00:00 Intro 1:07 Add Player Names 1:51 Add Tee Off Times 2:28 Assign Tee Off Times 4:30 How It Works 5:54 Player List Formulas 6:30 Macro Buttons 6:56 Tee Off Time Formulas 7:19 Admin Time Formulas 8:04 Admin Macro Formulas 8:19 Summary Formulas 8:57 Get the Sample File Instructor: Debra Dalgleish, Contextures Inc. Get Debra's weekly Excel tips: http://www.contextures.com/signup01 More Excel Tips and Tutorials: http://www.contextures.com/tiptech.html Subscribe to Contextures YouTube: https://www.youtube.com/user/contextures?sub_confirmation=1 #ContexturesExcelTips",27,Education,PT9M11S,551,2d,hd,FALSE,https://i.ytimg.com/vi/rL0SunZCrlk/maxresdefault.jpg,1,1116,35,2,0,10
12,UCNFqyNLJshdysCyj-xeegnA,Contextures Inc.,9rwp3X-veqE,2019-05-08T20:24:34Z,8/5/19 20:24,Add Month Sheets Automatically in Excel With This Macro,"Get the ""Add Month Sheets Automatically in Excel"" workbook from the Excel Worksheet Macros page on my website: https://www.contextures.com/excelworksheetvba.html See how the macro will add month sheets automatically to your Excel file every month, based on another sheet in the file (the Master sheet). There are two macros in the completed workbook. One macro macro runs automatically when the workbook opens. It runs the second macro, which has the steps for adding the new sheet This video shows how to set up your Master sheet and save your workbook so it can store macros. Then you'll see how to copy the code from my website, and paste it into your own workbook. Next, see how to add the code that runs automatically when the file opens. Finally, close and re-open the workbook, to test the macros. If the current month's sheet doesn't exist yet, the macro will add it automatically for you. Video Timeline: 00:00 Intro 00:22 The Master Sheet 01:06 Master Sheet Settings 02:07 Add the Macro 05:55 Test the Macro 06:14 Add Event Code 07:43 Test the Event Code 08:08 Get the Sample File Instructor: Debra Dalgleish, Contextures Inc. Get Debra's weekly Excel tips: http://www.contextures.com/signup01 More Excel Tips and Tutorials: http://www.contextures.com/tiptech.html Subscribe to Contextures YouTube: https://www.youtube.com/user/contextures?sub_confirmation=1",27,Education,PT8M23S,503,2d,hd,FALSE,https://i.ytimg.com/vi/9rwp3X-veqE/maxresdefault.jpg,1,17910,115,12,0,17
13,UCNFqyNLJshdysCyj-xeegnA,Contextures Inc.,OpHxGPgodo4,2019-04-08T20:13:30Z,8/4/19 20:13,Contextures UserForm Builder Quick Demo,"Watch this short demo of the UserForm Builder add-in from Contextures. This is part of the UserForms for Data Entry kit. With just a few simple steps, you can create a customized UserForm for data entry, based on a table in your workbook. The UserForm Builder add-in has 4 steps: -- Make a Quick Backup -- Prepare Your Workbook -- Build and Customize the Field List -- Build the UserForm To learn more about the UserForms for Data Entry kit from Contextures, go to this page: https://www.contextures.com/exceluserformsfordataentry.html Instructor: Debra Dalgleish, Contextures Inc. Get Debra's weekly Excel tips: http://www.contextures.com/signup01 More Excel Tips and Tutorials: http://www.contextures.com/tiptech.html Subscribe to Contextures YouTube: https://www.youtube.com/user/contextures?sub_confirmation=1",27,Education,PT1M32S,92,2d,hd,FALSE,,1,2802,33,0,0,2
14,UCNFqyNLJshdysCyj-xeegnA,Contextures Inc.,r_vQmKbDl1w,2019-02-19T00:12:58Z,19/2/19 0:12,Fix Excel Pivot Table Refresh Errors,"Get the sample workbook, with the troubleshooting macro, from the Excel Pivot Table List Macros page on my website: https://www.contextures.com/excelpivottablelistinfo.html When you refresh a pivot table, or use the Refresh All command, error messages might appear. For example, this error warns about field names: ""The PivotTable field name is not valid. To create a PivotTable report, you must use data that is organized as a list with labeled columns. If you are changing the name of a PivotTable field, you must type a new name for the field."" And this error warns that pivot tables cannot overlap other pivot tables. ""A PivotTable report cannot overlap another PivotTable report."" See how to use the Pivot Table List Details macro in my free workbook, to find potential problems with your workbook's pivot tables. Then, fix the source data headings, or rearrange the pivot table, to prevent the error messages. Instructor: Debra Dalgleish, Contextures Inc. Get Debra's weekly Excel tips: http://www.contextures.com/signup01 More Excel Tips and Tutorials: http://www.contextures.com/tiptech.html Subscribe to Contextures YouTube: https://www.youtube.com/user/contextures?sub_confirmation=1",27,Education,PT5M50S,350,2d,hd,FALSE,,1,35509,98,11,0,10
15,UCNFqyNLJshdysCyj-xeegnA,Contextures Inc.,_7-FmikOX5M,2019-02-10T21:29:02Z,10/2/19 21:29,Excel Drop Down from Filtered List,"Get the sample workbook from my Contextures website: https://www.contextures.com/exceldropdownfilteredlist.html See how to make an Excel drop down list show only the visible items from a filtered list, in this step-by-step video. First, create a named range with employee names. Next, use data validation, to show a drop down list with all the employee names. Then, use a SUBTOTAL formula to number the list of employees. When you filter the list, to hide the rows marked with an X, the numbers show a count for the visible rows only. Create a new list, and use INDEX and MATCH, to find the names from the filtered list, to match each number in the new list. Create a dynamic named range for the new list, and change the drop downs, to use the new name. Video Timeline: 00:00 Intro 00:50 Name the Employee List 01:46 Filter the List 02:24 Number the List 04:37 Create a New List 07:33 Create a Dynamic List 09:38 Change the Drop Down 10:25 Get the Sample File Instructor: Debra Dalgleish, Contextures Inc. Get Debra's weekly Excel tips: http://www.contextures.com/signup01 More Excel Tips and Tutorials: http://www.contextures.com/tiptech.html Subscribe to Contextures YouTube: https://www.youtube.com/user/contextures?sub_confirmation=1",27,Education,PT10M38S,638,2d,hd,FALSE,,1,6102,61,0,0,9
16,UCNFqyNLJshdysCyj-xeegnA,Contextures Inc.,UlEKICFLNaQ,2019-02-05T22:06:33Z,5/2/19 22:06,How to Make an Excel Order Form,"Get the sample workbook from the Excel Order Form page on my website: https://www.contextures.com/xlOrderForm01.html See how to make an Excel Order form in this step-by-step video. Make a list of products, and a list of customers, then format the lists as named tables. On the Order Form, make product drop down lists, and add a VLOOKUP formula to find the price for the selected product. Enter a quantity, and add a formula to calculate the row total. At the bottom of the order form, calculate the grand total. Then, at the top of the form, make a Customer drop down. Below that, add VLOOKUP formulas to find the customer street, city, province and postal code. Video Timeline: 00:00 Intro 01:00 3 Sheets 02:26 Excel Tables 03:27 Named Ranges 05:34 Start the Order Form 06:21 Add the Headings 06:58 Product Drop Downs 07:43 Price Lookup 08:59 Add VLOOKUP 10:09 Row Total 11:26 Grand Total 12:06 Add Formatting 13:01 Customer Drop Down 13:49 Customer Lookup 15:15 Combined Lookup 17:44 Final Formatting 18:34 Get the Sample File Instructor: Debra Dalgleish, Contextures Inc. Get Debra's weekly Excel tips: http://www.contextures.com/signup01 More Excel Tips and Tutorials: http://www.contextures.com/tiptech.html Subscribe to Contextures YouTube: https://www.youtube.com/user/contextures?sub_confirmation=1",27,Education,PT18M48S,1128,2d,hd,FALSE,,1,33388,253,4,0,32
17,UCNFqyNLJshdysCyj-xeegnA,Contextures Inc.,HSr8JgI5ZVQ,2019-01-25T22:04:07Z,25/1/19 22:04,Excel Pivot Table Calculated Items and Calculated Fields,"Get the sample workbook from the Pivot Table Calculated Items and Calculated Fields page on my website: https://www.contextures.com/calculatedfieldcalculateditem.html You can add two types of custom formulas to an Excel pivot table - Calculated Items and Calculated Fields Watch this video to see the difference between Pivot Table Calculated Items and Calculated Fields. Also, see an example of how to add each type of formula, then create a list of the formulas in the pivot table. Video Timeline: 0:00 Intro 0:30 Pivot Table Formulas 1:04 Calculated Item 2:50 Calculated Field 4:06 List Formulas 5:02 Get the Sample File Instructor: Debra Dalgleish, Contextures Inc. Get Debra's weekly Excel tips: http://www.contextures.com/signup01 More Excel Tips and Tutorials: http://www.contextures.com/tiptech.html Subscribe to Contextures YouTube: https://www.youtube.com/user/contextures?sub_confirmation=1",27,Education,PT5M15S,315,2d,hd,FALSE,,1,37528,190,5,0,16
18,UCNFqyNLJshdysCyj-xeegnA,Contextures Inc.,#NAME?,2019-01-20T20:15:29Z,20/1/19 20:15,Show Values Row in Excel Pivot Table Headings,"Watch this video to see how to show values row in Excel Pivot Table headings, and why the command sometimes doesn't change anything. Get the sample workbook for this video from the Pivot Table Options page on my website: https://www.contextures.com/excelpivottableoptions.html Some pivot tables do not have a Values Row, and sometimes the Values Row cannot be hidden. This video shows the pivot table layout that you need, to create a Values Row. It also shows when the Values Row can be hidden, and when it can't be hidden. To learn about the Pivot Power Premium (PPP) Excel addin from Contextures, go to this page: https://www.contextures.com/xlPivotPremAddIn.html Instructor: Debra Dalgleish, Contextures Inc. Get Debra's weekly Excel tips: http://www.contextures.com/signup01 More Excel Tips and Tutorials: http://www.contextures.com/tiptech.html Subscribe to Contextures YouTube: https://www.youtube.com/user/contextures?sub_confirmation=1",27,Education,PT3M37S,217,2d,hd,FALSE,https://i.ytimg.com/vi/-kPfAtQc59Y/maxresdefault.jpg,1,5105,29,0,0,2
