position,channelId,channelTitle,videoId,publishedAt,publishedAtSQL,videoTitle,videoDescription,videoCategoryId,videoCategoryLabel,duration,durationSec,dimension,definition,caption,thumbnail_maxres,licensedContent,viewCount,likeCount,dislikeCount,favoriteCount,commentCount
151,UCNFqyNLJshdysCyj-xeegnA,Contextures Inc.,CO5LKkRi44s,2013-05-11T14:57:23Z,11/5/13 14:57,Quickly Clear Data Entry Cells in Excel,"http://www.contextures.com/xlDataEntry01.html Visit this page for more Excel data entry tips. In Excel, you can use a built-in command to quickly select all the cells with data typed into them, and ignore the cells with formulas. Then, after you select the data cells, use the keyboard or a Ribbon command to clear the cells.",28,Science & Technology,PT48S,48,2d,hd,FALSE,https://i.ytimg.com/vi/CO5LKkRi44s/maxresdefault.jpg,1,5496,18,2,0,3
152,UCNFqyNLJshdysCyj-xeegnA,Contextures Inc.,HjrtTs-jMlU,2013-05-08T17:25:23Z,8/5/13 17:25,Get Mileage from Excel Lookup Table,"http://www.contextures.com/excelfiles.html#FN0026 Visit this page to download the sample file. Set up a mileage table in Excel, and then use the INDEX and MATCH functions to find distance between two selected cities. A drop down list of cities makes it easy to select a starting city and destination city. Conditional formatting highlights the selected mileage in lookup table, so you can verify the result.",28,Science & Technology,PT4M5S,245,2d,hd,FALSE,https://i.ytimg.com/vi/HjrtTs-jMlU/maxresdefault.jpg,1,37608,111,1,0,14
153,UCNFqyNLJshdysCyj-xeegnA,Contextures Inc.,CMPen4MoHe4,2013-05-07T18:47:19Z,7/5/13 18:47,Quickly Move an Excel Pivot Table to New Sheet,"http://www.contextures.com/excelpivottableselect.html#move Visit this page for the written instructions and more pivot table tips. After you create a pivot table, you might need to move it. This is easy if the pivot table is small, but can be difficult for a large pivot table. Fortunately, there is a command on the Excel Ribbon, that will make this task easy. Watch this short video to see the steps.",28,Science & Technology,PT1M7S,67,2d,hd,FALSE,https://i.ytimg.com/vi/CMPen4MoHe4/maxresdefault.jpg,1,13779,22,0,0,0
154,UCNFqyNLJshdysCyj-xeegnA,Contextures Inc.,p4lHzYxOgt4,2013-05-06T23:10:42Z,6/5/13 23:10,Calculate Annual Expenses in Excel,"http://www.contextures.com/excelannualcostcalculator.html Visit this page to download the sample file and for the written instructions. Small recurring expenses can add up to a large amount over a year, and you can use Excel formulas to calculate the annual totals. Create a list of time units, such as Daily, Weekly, Monthly, and the number of days that each occurs per year. Then, select a time unit, and a formula will find the number of days for that time. Other formulas calculate the annual quantity, and the total annual cost.",28,Science & Technology,PT5M28S,328,2d,hd,FALSE,https://i.ytimg.com/vi/p4lHzYxOgt4/maxresdefault.jpg,1,16694,18,8,0,3
155,UCNFqyNLJshdysCyj-xeegnA,Contextures Inc.,TOKpBbGCyUs,2013-05-06T23:10:16Z,6/5/13 23:10,Calculate Annual Costs and Savings with Excel Template,"http://www.contextures.com/excelannualcostcalculator.html Visit this page to download the sample file and for the written instructions. Small recurring expenses can add up to a large amount over a year, and you can use this Excel template to see the annual totals. Enter your current expenses in Scenario A, and enter your potential cost reductions in Scenario B. Formulas calculate the annual totals for both scenarios and show your the item differences, and the total savings.",28,Science & Technology,PT3M17S,197,2d,sd,FALSE,,1,25189,39,8,0,2
156,UCNFqyNLJshdysCyj-xeegnA,Contextures Inc.,34MFlb3w6F4,2013-05-04T15:24:21Z,4/5/13 15:24,Enter Date and Time in Excel,"http://www.contextures.com/xlDataEntry01.html Visit this page for more Excel data entry tips. In Excel, you can use formulas to enter the time and date, and those cells will automatically update. Or, use a keyboard shortcut to enter the time and date, and those cells will not change automatically.",28,Science & Technology,PT1M6S,66,2d,sd,FALSE,,1,39762,157,8,0,12
157,UCNFqyNLJshdysCyj-xeegnA,Contextures Inc.,jAHkGIFhKbA,2013-05-04T00:13:22Z,4/5/13 0:13,How to Show Totals in an Excel Table,"http://www.contextures.com/xlExcelTable01.html Visit this page for the sample file and written instructions. When you are working with lists in Excel, use the built-in Table feature, to make it easier to work with the data. Use the built-in Total Row function, to quickly add totals to one or more of the columns. Choose from 11 functions, such as Sum, Average, and Count. The Total will automatically update if rows are added to the table, without any changes to the referenced cells. Watch this short video to see the steps.",28,Science & Technology,PT3M32S,212,2d,hd,FALSE,https://i.ytimg.com/vi/jAHkGIFhKbA/maxresdefault.jpg,1,1432,11,0,0,0
158,UCNFqyNLJshdysCyj-xeegnA,Contextures Inc.,OsnuFXh_BWk,2013-04-29T19:16:09Z,29/4/13 19:16,Excel Mouse Shortcuts to Insert or Delete a Block of Cells,"http://blog.contextures.com/archives/2008/10/03/insert-or-delete-cells-with-autofill/ Visit this page for details. In Excel, you can use mouse commands or mouse shortcuts, to insert and delete blocks of cells. If you use this technique, data in other columns on the worksheet is not affected, because a whole row is not inserted. The first step is to select cells as a starting point, and then use the command or shortcut to insert or delete cells. Watch this short video, to see the steps.",28,Science & Technology,PT2M,120,2d,hd,FALSE,https://i.ytimg.com/vi/OsnuFXh_BWk/maxresdefault.jpg,1,6012,29,1,0,9
159,UCNFqyNLJshdysCyj-xeegnA,Contextures Inc.,oHLU5oZYfGI,2013-04-24T19:58:54Z,24/4/13 19:58,How to Close All Files in Excel 2013,"http://www.contextures.com/xlfaqApp.html#closeall Visit this page for details and for more Excel tips. In Excel 2013, each file opens in a separate window. Unlike previous versions, there is no Exit button or command, to close all the files, without clicking each window individually. To add this feature, you can move the Close All and Exit commands to the Quick Access Toolbar. Watch this short video, to see the steps.",28,Science & Technology,PT2M51S,171,2d,hd,FALSE,https://i.ytimg.com/vi/oHLU5oZYfGI/maxresdefault.jpg,1,6537,27,2,0,5
160,UCNFqyNLJshdysCyj-xeegnA,Contextures Inc.,4evkRxT5gOQ,2013-04-21T18:37:12Z,21/4/13 18:37,Fix Problems With Adding Slicers in Excel 2010,"http://www.contextures.com/excelpivottableslicers.html Visit this page for written instructions, and more Slicer videos. Slicers were introduced in Excel 2010, and they make it easy to change multiple pivot tables with a single click. To make older pivot tables work with Slicers, you'll need to update the files to the newer Excel formats -- xlsx, xlsb or xlsm. Occasionally a pivot table isn't recognized by the Slicers, even after updating. You can create a new pivot table, or try to repair the old one. Watch this video to see how to update the files, connect to Slicers, and repair a pivot table so it works with the Slicers.",28,Science & Technology,PT4M52S,292,2d,hd,FALSE,https://i.ytimg.com/vi/4evkRxT5gOQ/maxresdefault.jpg,1,33327,70,7,0,14
161,UCNFqyNLJshdysCyj-xeegnA,Contextures Inc.,AZMWPbs0i8g,2013-04-17T00:18:49Z,17/4/13 0:18,How to Highlight Pivot Table Cells With Conditional Formatting,"http://www.contextures.com/excelpivottableconditionalformat.html Visit this page for the sample file and written instructions. With Excel's conditional formatting, you can highlight cells in a pivot table, based on specific rules. In this example, we'll highlight the values that are above average. Problems can occur if you update the pivot table after you add the conditional formatting. New data might not be included, so your results will be incorrect. Change a conditional formatting setting, to ensure that all the applicable cells are formatted. Watch this video to see the steps.",28,Science & Technology,PT3M36S,216,2d,hd,FALSE,https://i.ytimg.com/vi/AZMWPbs0i8g/maxresdefault.jpg,1,40833,60,9,0,7
162,UCNFqyNLJshdysCyj-xeegnA,Contextures Inc.,ts1WpptfWSY,2013-04-13T23:54:52Z,13/4/13 23:54,How to Show a Running Total on Excel Worksheet,"http://www.contextures.com/xlFunctions01.html#running Visit this page for the written instructions. To see the running total in each row of an Excel table, you can use the SUM function. The total should include all the amounts from the first cell down to the current row. To lock the starting position for the SUM function, you can use an absolute reference to the starting row. Then, leave the ending position as a relative reference, so it will adjust automatically, when you copy the formula down the column. Instructor: Debra Dalgleish, Contextures Inc. Get Debra's weekly Excel tips: http://www.contextures.com/signup01 More Excel Tips and Tutorials: http://www.contextures.com/tiptech.html Subscribe to Contextures YouTube: https://www.youtube.com/user/contextures?sub_confirmation=1",28,Science & Technology,PT2M38S,158,2d,sd,TRUE,,1,181088,436,38,0,50
163,UCNFqyNLJshdysCyj-xeegnA,Contextures Inc.,c3stuzB-xw4,2013-04-10T21:33:29Z,10/4/13 21:33,Highlight Duplicate Rows with Excel Conditional Formatting,"http://www.contextures.com/xlCondFormat03.html Visit this page for the sample file and written instructions. With Excel's conditional formatting, you can highlight cells based on specific rules. In this example, we'll highlight the duplicate rows in a table. The first step is to use the CONCATENATE function to combine all the data into one cell in each row. Then, a conditional formatting rule is set, to color the rows that are duplicate records. Watch this video to see the steps.",28,Science & Technology,PT5M,300,2d,hd,FALSE,https://i.ytimg.com/vi/c3stuzB-xw4/maxresdefault.jpg,1,64526,208,15,0,32
164,UCNFqyNLJshdysCyj-xeegnA,Contextures Inc.,URfAkq0_dj0,2013-04-09T23:08:53Z,9/4/13 23:08,Multiple Grand Totals in Excel Pivot Table,"http://www.contextures.com/xlPivot13.html Visit this page for the written instructions, and to download a sample file. In an Excel pivot table, you can show subtotals, to summarize the values by Sum, Count, and other functions. By changing a setting, you can show more than one subtotal for each item. This option is not available for grand totals, but with a workaround, you can show multiple lines for a grand total, such as Sum, Average, and Max Watch this short video to see the steps",28,Science & Technology,PT3M35S,215,2d,hd,FALSE,https://i.ytimg.com/vi/URfAkq0_dj0/maxresdefault.jpg,1,78903,124,12,0,15
165,UCNFqyNLJshdysCyj-xeegnA,Contextures Inc.,AM7iUCYSUrw,2013-04-05T20:41:26Z,5/4/13 20:41,How to Create an Excel Table From a Data List,"http://www.contextures.com/xlExcelTable01.html Visit this page for the written instructions. When you are working with lists in Excel, use the built-in Table feature, to enable sort and filter commands, and other powerful features. First, make sure that your data is set up correctly, and then turn the list into a formatted table, with a couple of clicks. In the table, you can easily sort and filter the data, and change the formatting. Name the table, so it's easy to work with later. Watch this short video to see the steps.",28,Science & Technology,PT2M59S,179,2d,sd,FALSE,,1,151142,166,34,0,15
166,UCNFqyNLJshdysCyj-xeegnA,Contextures Inc.,ShtV-CUbXnI,2013-04-01T19:37:32Z,1/4/13 19:37,Create Excel Pivot Chart With Keyboard Shortcuts,"http://www.contextures.com/excelpivotchartsourcedata.html Visit this page for the written instructions. To quickly create a chart from a pivot table, you can use keyboard shortcuts. Either create a chart on a new sheet, or embed the chart on the same sheet as the pivot table. Watch this video to see the steps.",28,Science & Technology,PT1M4S,64,2d,sd,FALSE,,1,6857,6,1,0,0
167,UCNFqyNLJshdysCyj-xeegnA,Contextures Inc.,X1PTSGSjzsQ,2013-03-29T02:03:38Z,29/3/13 2:03,How to Create a Drop Down List With Symbols in Excel,"http://www.contextures.com/xlDataVal08.html#symbols Visit this page for written instructions, and to download the sample file. To make data entry easier, create a drop down list in an Excel cell. This works well with a list of words, but the list doesn't show symbols if you create the list in a font such as Wingdings. To create a list with symbols, you can type a code in the list, using the number keypad. This video shows you the steps for creating a drop down list, to show a selection of symbols.",28,Science & Technology,PT2M56S,176,2d,sd,FALSE,,1,48158,71,4,0,12
168,UCNFqyNLJshdysCyj-xeegnA,Contextures Inc.,gpQEq6tY0CA,2013-03-27T19:58:31Z,27/3/13 19:58,Quickly Divide Numbers in Excel Without Formulas,"http://www.contextures.com/xlDataEntry04.html Visit this page for written instructions, and to see more Excel data entry tips. In Excel, you can quickly add, subtract, multiply or divide, without using formulas. Just type a number on the worksheet, copy the cell, and use the Paste Special options.",28,Science & Technology,PT1M33S,93,2d,sd,FALSE,,1,139795,410,37,0,50
169,UCNFqyNLJshdysCyj-xeegnA,Contextures Inc.,AjHv2LkqyPM,2013-03-26T00:26:29Z,26/3/13 0:26,Show RSS Feed Items in Excel Worksheet,"http://www.contextures.com/excelrssfeeds.html Visit this page for written instructions, and to download the sample file. In Excel, you can create a list of items from an RSS feed, and show it on a worksheet. Follow your favorite blogs and websites, by clicking the links on the sheet",28,Science & Technology,PT4M59S,299,2d,sd,FALSE,,1,17621,81,1,0,7
170,UCNFqyNLJshdysCyj-xeegnA,Contextures Inc.,oBoF8tcOxD0,2013-03-23T19:47:43Z,23/3/13 19:47,Go Back to Previous Locations in Excel,"http://www.contextures.com/xlDataEntry01.html#locations Visit this page for written instructions, and to see more Excel data entry tips. In Excel, you can store up to 4 temporary locations, and go back to those cells quickly. In this video you will see the steps for storing a location and going back to one of the stored cells.",28,Science & Technology,PT1M41S,101,2d,sd,FALSE,,1,10978,24,3,0,0
171,UCNFqyNLJshdysCyj-xeegnA,Contextures Inc.,Be-sCy4nINo,2013-03-23T19:44:41Z,23/3/13 19:44,Quickly Copy and Rename Excel Worksheets,"http://www.contextures.com/excelworksheettips.html Visit this page for written instructions, and to see more Excel worksheet tips. In Excel, you can quickly move or copy an existing worksheet. Then, change the default name, by typing over it.",28,Science & Technology,PT54S,54,2d,sd,FALSE,,1,8349,15,2,0,1
172,UCNFqyNLJshdysCyj-xeegnA,Contextures Inc.,J-09_0AFwxw,2013-03-10T21:47:27Z,10/3/13 21:47,Hide and Show the Excel Ribbon,"http://www.contextures.com/xlfaqApp.html#hideribbon Visit this page for written instructions, and to see more Excel tips. In this video you'll see how to show or hide the commands on the Excel Ribbon. When you hide the commands, only the Ribbon tabs are visible, so you'll have more room on the worksheet.",28,Science & Technology,PT33S,33,2d,sd,FALSE,,1,6934,13,2,0,5
173,UCNFqyNLJshdysCyj-xeegnA,Contextures Inc.,eJslb49T0Bk,2013-03-06T18:24:52Z,6/3/13 18:24,Excel UserForm With Dependent Combo Boxes,"http://www.contextures.com/exceluserformdependentcomboboxes.html Visit this page for written instructions, and to download the sample file. In an Excel UserForm, you can add combo boxes to make data entry easier. In this example, there is a dependent combo box -- Part ID. The items shown in that combo box depend on what was selected in the Part Type combo box. To see how it works, please watch this short video tutorial.",28,Science & Technology,PT2M53S,173,2d,sd,FALSE,,1,167475,283,41,0,18
174,UCNFqyNLJshdysCyj-xeegnA,Contextures Inc.,mCI7Cs3fK7o,2013-02-26T19:34:38Z,26/2/13 19:34,How to Sum for a Specific Date Range in Excel,"In Excel, you can use the SUM function to calculate a simple total for a range of cells. If you want a total based on conditions, such as dates between a specific start date and end date, you can use the SUMIFS function. The SUMIFS function will show a total based on one or more criteria. Watch this short video to see the steps, and then verify that the total is correct. Visit my Contextures website to download the sample file, and to see more ways to SUM in Excel. http://www.contextures.com/xlFunctions01.html Instructor: Debra Dalgleish, Contextures Inc. Get Debra's weekly Excel tips: http://www.contextures.com/signup01 More Excel Tips and Tutorials: http://www.contextures.com/tiptech.html Subscribe to Contextures YouTube: https://www.youtube.com/user/contextures?sub_confirmation=1 VIDEO TRANSCRIPT One of the most common things you do in Excel is get a total of something. So here we have a column where we've sold items on certain dates and we can see how many units we sold each day. We have a total at the bottom, and that just uses the SUM function. If you want to put some conditions on the total, instead of using SUM, you could use a SUMIFS function. This is available in Excel 2007 and later versions. In this cell I'd like to see the total for a specific date range. I've put a starting date here and an ending date. In this cell I'm going to put in a SUMIFS formula, and it will look at the dates and then only total the units that are between the start and end date. To start the formula, I'll click in this cell, type an equal sign and the SUMIFS function, and open bracket. The first thing we have to put in is the sum range, so which cells do we want to add up if we meet the criteria? We want to add these units sold. Put that in, and put in a comma. The next thing is the criteria range. Which cells do we want to check to see if they meet the criteria that we've set. And that's the date cells. I'll select those. Type a comma. The next thing is the first criteria. We want it to be based on this start date. We want any numbers that are for a date on or after this start date. I'm going to put the operator in, and the operator will be greater than or equal to, and I have to put that inside quotes. Double quote, greater than, equal to, double quote. I'm going to join that to a cell reference. I'll put in an ampersand and then click on the start cell, so it's going to look for any items where the date is on or after that start date. Then we're going to have to put in our end date. For the criteria range 2, again, we want it to check those dates, type a comma. The second criteria is this end date. We want things that are on or before that. Again, the operator will go in double quotes, and this will be less than, equal to, double quote, and we'll join with the ampersand. Click on the end date, and close the bracket. Press Enter. We can see that there were 494 units sold in this date range. To verify that quickly, we can manually select the dates in that date range. The first one within that date range is January 9th going down to February 4th. When I look in the status bar, the sum is 494, which matches our total. So with SUMIFS you can use multiple criteria to get a total. For more Excel tips and tutorials and to download the sample file from this video, please visit my Contextures website at www.contextures.com",28,Science & Technology,PT2M58S,178,2d,sd,TRUE,,1,293546,1093,42,0,142
175,UCNFqyNLJshdysCyj-xeegnA,Contextures Inc.,XLoz9qm66RY,2013-02-20T00:30:28Z,20/2/13 0:30,Group Numbers by Tens in Excel Pivot Table,"http://www.contextures.com/xlPivot07.html Visit this page for written instructions, and to download the sample file. In an Excel pivot table, you can list the pivot items individually, or group them, for a concise summary. For example, instead of listing each number, from 1 to 100, group them by tens. The headings will show the grouped items, such as 1-10, 11-20, and so on.",28,Science & Technology,PT2M3S,123,2d,sd,FALSE,,1,16331,23,3,0,2
176,UCNFqyNLJshdysCyj-xeegnA,Contextures Inc.,0Ayw-8DpqxI,2013-02-17T22:36:00Z,17/2/13 22:36,Get List of Excel Pivot Table Formulas,"http://www.contextures.com/excel-pivot-table-calculated-field.html Visit this page for written instructions, and to download the sample file. In an Excel pivot table, you can create your own formulas, by using calculated fields and calculated items. To see a list of all the calculated fields and calculated items that are in a pivot table, use a built-in pivot table command -- List Formulas. The report also shows the Solve Order for the formulas, if two or more formulas affect the same cell.",28,Science & Technology,PT2M26S,146,2d,sd,FALSE,,1,11659,12,2,0,0
177,UCNFqyNLJshdysCyj-xeegnA,Contextures Inc.,dRPYvAtf9ZM,2013-01-29T20:53:08Z,29/1/13 20:53,Get Formula Text with Excel 2013 FORMULATEXT Function,"http://www.contextures.com/excelformulatextfunction.html Visit this page for written instructions, and to download the sample file. One of the new functions in Excel 2013 is the FORMULATEXT function. It returns a text string that shows the formula in a worksheet cell. Its result is the same text that is displayed in the formula bar if you click on a cell that contains a formula. In this video you'll see how to create a FORMULATEXT formula, and a few examples of how it can be used.",28,Science & Technology,PT4M34S,274,2d,sd,FALSE,,1,15742,24,1,0,7
178,UCNFqyNLJshdysCyj-xeegnA,Contextures Inc.,ZTt2FFyj2Fo,2013-01-17T20:24:46Z,17/1/13 20:24,Add Custom Ribbon Tab to Excel Workbook,"http://www.contextures.com/excelribbonaddcustomtab.html Visit this page for written instructions, and to download the sample file. In this video you'll see how to add a custom Ribbon tab that appears when a specific workbook opens, with buttons that run macros from that workbook. See how to set the custom tab labels and icons, and change your macros so they run from a click on the Ribbon. Create and test the Ribbon code, using the Custom UI Editor, a free tool.",28,Science & Technology,PT8M54S,534,2d,sd,FALSE,,1,65290,124,6,0,30
179,UCNFqyNLJshdysCyj-xeegnA,Contextures Inc.,NEWyGAPkP3Q,2013-01-12T20:27:50Z,12/1/13 20:27,Excel Ribbon Custom Tab Introduction,"http://www.contextures.com/excelribbongettingstarted.html Visit this page for written instructions, and to download the sample file. In addition to the default Excel Ribbon tabs, you can add your own tabs and buttons. In this video you'll see an Excel file that creates a custom Ribbon tab when it opens, with buttons that run simple Excel macros. We can view the Ribbon code, and make a minor change to it, and test the result, using the Custom UI Editor, a free tool. In Excel, you will see how to make a small change to each macro, so it will run when the corresponding Ribbon button is clicked.",28,Science & Technology,PT6M,360,2d,sd,FALSE,,1,21367,92,2,0,12
180,UCNFqyNLJshdysCyj-xeegnA,Contextures Inc.,3f8l7dptl7c,2013-01-09T22:19:38Z,9/1/13 22:19,Show Unmatched Amounts with Excel Advanced Filter,"http://www.contextures.com/xladvfilter02.html Visit this page for written instructions, and to download the sample file. You can use the Excel AutoFilter for quick and easy filters on a list or table. For complex filters, such as finding records where one amount does not match another, you can use Excel's Advanced Filter. In this video you'll see how to set up a small criteria range, and enter a formula to check for unmatched amounts. Then, run the Advanced Filter to see the results.",28,Science & Technology,PT3M3S,183,2d,sd,FALSE,,1,8780,24,0,0,5
181,UCNFqyNLJshdysCyj-xeegnA,Contextures Inc.,Y9Ssd7b3OMs,2013-01-06T19:54:27Z,6/1/13 19:54,Use GetPivotData Function to Pull Values from Pivot Table,"http://www.contextures.com/xlPivot06.html Visit this page for written instructions, and to download the sample file. With the GetPivotData formula, you can pull values from a pivot table, based on criteria. For example, what is the total quantity sold in Boston? If you have dates in the Row Labels area, you might see errors, instead of the correct result. This video shows you a few ways to work with dates in the GetPivotData formula.",28,Science & Technology,PT3M30S,210,2d,sd,FALSE,,1,106002,152,21,0,20
182,UCNFqyNLJshdysCyj-xeegnA,Contextures Inc.,OF2Afb_fjK4,2012-12-21T21:52:19Z,21/12/12 21:52,Manually Move Excel Pivot Table Labels,"http://www.contextures.com/excelpivottablemovelabels.html Visit this page for written instructions. When you add fields to the row labels area in a pivot table, the items are automatically sorted, alphabetically. You can manually change the order of the items in the list, by dragging them to a new position. Or, use the commands in the right-click menu to move an item, or type its name in a different location. Watch this short video tutorial to see how to make these changes to the pivot table labels.",28,Science & Technology,PT1M58S,118,2d,sd,FALSE,,1,103758,197,7,0,31
183,UCNFqyNLJshdysCyj-xeegnA,Contextures Inc.,kjR0DiLZ4P4,2012-12-16T21:47:04Z,16/12/12 21:47,Change Pivot Table Sum of Headings and Blank Labels,"http://www.pivot-table.com/2009/07/27/rename-a-pivot-table-data-field/ Visit this page for written instructions and a macro. When you add fields to the value area in a pivot table, custom names are automatically created, such as Sum of Quantity. Excel will not allow you to remove the ""Sum of"" in the label, and just leave the field name. However, you can include a space character, to work around this problem. Also, if cells are blank in the source data, the pivot table might show (blank) in the row labels. You cannot delete those labels, but you can use a space character to replace them. Watch this short video tutorial to see how to make these changes to the pivot table headings and labels.",28,Science & Technology,PT2M44S,164,2d,sd,FALSE,,1,46756,73,23,0,6
