position,channelId,channelTitle,videoId,publishedAt,publishedAtSQL,videoTitle,videoDescription,videoCategoryId,videoCategoryLabel,duration,durationSec,dimension,definition,caption,thumbnail_maxres,licensedContent,viewCount,likeCount,dislikeCount,favoriteCount,commentCount
72,UCNFqyNLJshdysCyj-xeegnA,Contextures Inc.,EXv4X3T7TU4,2014-11-02T19:42:35Z,2/11/14 19:42,Create Copy of Excel File Without Save As: Quick Tip,"http://blog.contextures.com/archives/2014/10/30/new-workbook-based-on-old-one/ Visit this page for details Instead of creating an Excel file from scratch, you can save time by basing the new workbook on an existing file. Open the old file, then use the Save As command, to create a copy. However, it is easy to forget that step, and you end up making unwanted changes to the original file. To be safe, use one of the tips in this video, to open a copy of the original, and keep it safe from changes. Watch this video to see the steps for creating a copy of the original file, without using the Save As command. 0:00 The danger of Save As 0:30 New From Existing - Excel 2010 0:47 Copy Recent File - Excel 2010 1:09 Copy Recent File - Excel 2013 1:30 Summary 1:38 More Excel Tutorials",28,Science & Technology,PT1M48S,108,2d,hd,FALSE,https://i.ytimg.com/vi/EXv4X3T7TU4/maxresdefault.jpg,1,7369,36,0,0,2
73,UCNFqyNLJshdysCyj-xeegnA,Contextures Inc.,0b0HHA3ZrVs,2014-10-18T19:41:59Z,18/10/14 19:41,Show Running Total in Excel Pivot Table,"http://www.contextures.com/xlPivot14.html Visit this page to download the sample file. With a running total in a pivot table, you can see how amounts accumulate over a period of time, or through another field, such as products, or customers. Watch this video to see the steps for creating a pivot table, then changing the values to show a running total. 0:00 Introduction 0:11 The source data 0:22 Create the pivot table 1:01 Add fields to pivot table 1:25 Group the dates 1:49 Move the date field 2:12 Change to a running total 2:42 Select a base field 3:14 Change the base field 3:54 Remove the Grand Total 4:15 Download the sample file",28,Science & Technology,PT4M28S,268,2d,hd,FALSE,https://i.ytimg.com/vi/0b0HHA3ZrVs/maxresdefault.jpg,1,32803,89,5,0,7
74,UCNFqyNLJshdysCyj-xeegnA,Contextures Inc.,xR3wA7TTPG4,2014-09-22T17:02:46Z,22/9/14 17:02,Add Your Own Icon to an Excel Custom Ribbon Tab,"http://www.contextures.com/excelribbonaddcustomtab.html Visit this page for written instructions, and to download the sample file. In this video you'll see how to add a new button on a custom Ribbon tab, with a custom icon that you created in a drawing program. This Custom tab appears when a specific workbook opens, and the buttons run macros from that workbook. NOTE: For instructions on creating the Custom tab, watch the previous video: Add Custom Ribbon Tab to Excel Workbook https://www.youtube.com/watch?v=ZTt2FFyj2Fo See how to add a new button with your own icon, and use it to run a macro in the workbook. To modify the Ribbon code, you can download the Custom UI Editor, a free tool, from this link: http://openxmldeveloper.org/blog/b/openxmldeveloper/archive/2006/05/26/customuieditor.aspx",28,Science & Technology,PT4M8S,248,2d,hd,FALSE,https://i.ytimg.com/vi/xR3wA7TTPG4/maxresdefault.jpg,1,37821,143,6,0,15
75,UCNFqyNLJshdysCyj-xeegnA,Contextures Inc.,iHO7A7vnzq0,2014-09-20T22:43:49Z,20/9/14 22:43,Get Totals from Specific Pivot Table With GetPivotData,"http://www.contextures.com/xlPivot06.html Visit this page to download the sample file. If you have multiple copies of a pivot table in a workbook, on different sheets, you can use GETPIVOTDATA to pull an amount from a specific pivot table. Start with a simple formula, created automatically by Excel, when you link to a pivot table value. Then, change the formula, and use the INDIRECT function, to change the referenced cell, when a different region is selected from a drop down list. No macros are required; only formulas and pivot tables are used. Watch this video to see the steps for getting the total from a specific pivot table, with GETPIVOTDATA and INDIRECT.",28,Science & Technology,PT4M17S,257,2d,hd,FALSE,https://i.ytimg.com/vi/iHO7A7vnzq0/maxresdefault.jpg,1,7984,35,0,0,6
76,UCNFqyNLJshdysCyj-xeegnA,Contextures Inc.,Qn26m6b14xE,2014-08-27T23:25:36Z,27/8/14 23:25,Color Excel Data Entry Cells With Conditional Formatting,"http://www.contextures.com/excelfiles.html#CondFormat Visit this page to download the sample file -- CF0006 - Show Selected Color. On a data entry sheet, select a number of options from a drop down list. That number of options show up in the data entry area. Then, select a color for each item, from another drop down list. In the cell to the right, the selected color is shown. Watch this video to see the steps for creating this worksheet, with conditional formatting and data validation. 0:00 Demo of technique 0:27 How to set up the file 0:38 Created named ranges 1:05 See range names in Name Box list 1:22 Create drop down list of numbers 1:54 Format the cell 2:05 Create drop down lists of colors 2:48 Type list of numbers 3:04 Planning the formatting 3:36 Format the number cells 3:41 Add conditional formatting to number cells 4:12 Type the conditional formatting formula 5:30 Add conditional formatting to color cells 5:54 Type the conditional formatting formula 6:35 Select formatting options 7:09 Add conditional formatting to Sample cells 7:49 Select formatting options for Red 8:07 Select formatting options for Yellow 8:38 Select formatting options for Blue 8:59 Test the worksheet 9:22 Summary 9:34 Download the sample file",28,Science & Technology,PT9M47S,587,2d,hd,TRUE,https://i.ytimg.com/vi/Qn26m6b14xE/maxresdefault.jpg,1,85810,160,11,0,12
77,UCNFqyNLJshdysCyj-xeegnA,Contextures Inc.,sDqs-vdujJI,2014-08-14T15:14:19Z,14/8/14 15:14,Remove Sum Of in Pivot Table Headings,"http://www.contextures.com/xlPivot02.html#Rename Visit this page to download the sample file. When you add fields to the Values area, they are renamed. For example, 'Units' becomes 'Sum of Units'. Instead of using these default names, you can change the field names to something shorter, or more descriptive, such as Units Sold. However, the new name can't be the same as the original field name. For example, if the original field name is Quantity, you can't change 'Sum of Quantity' to 'Quantity'. To avoid an error message, you can type the original field name, and add a space character at the end, e.g. 'Quantity ' or at the beginning -- ' Quantity', as shown in this video. Watch this video to see the steps for renaming a single value field heading, or multiple headings. 0:00 Introduction 0:25 Change the heading 0:38 Error message 0:49 View Field Settings 1:11 Change the Custom Name 1:29 Change Quantity heading 1:46 Make columns narrower 2:07 Change multiple headings 2:44 Download the sample file",28,Science & Technology,PT2M55S,175,2d,hd,FALSE,https://i.ytimg.com/vi/sDqs-vdujJI/maxresdefault.jpg,1,29743,74,8,0,14
78,UCNFqyNLJshdysCyj-xeegnA,Contextures Inc.,aCjGl35dT-U,2014-08-13T19:19:34Z,13/8/14 19:19,Create Random Text with CHOOSE in Excel,"http://www.contextures.com/excelfiles.html#FN0035 Visit this page to download the sample file. To enter random numbers on an Excel worksheet, you can use the RANDBETWEEN function. Set a bottom and top number, and a random number from that range is returned. The RANDBETWEEN function can only return numbers, but you can use it with the CHOOSE function, to return random text. In this example, CHOOSE and RANDBETWEEN work together in a formula, to return a random region name (East, West or Central) in one column, and a random gender (Male or Female), in another column. Watch this video to see the steps for using RANDBETWEEN on its own, and combined with CHOOSE. For more examples of the CHOOSE function, visit this page on my Contextures blog: http://blog.contextures.com/archives/2011/01/06/30-excel-functions-in-30-days-05-choose/ 0:00 Introduction 0:18 Score column needs random numbers 0:23 Start the RANDBETWEEN formula 0:50 Copy RANDBETWEEN formula down 0:59 Region and Gender columns need random text 1:09 Use RANDBETWEEN with CHOOSE 1:34 Add RANDBETWEEN formula for Index number 1:57 Add text items as values for CHOOSE function 2:27 Complete the formula, and copy it down 2:44 Start the Region formula 3:01 Add RANDBETWEEN formula for Index number 3:17 Add cell references as values for CHOOSE function 3:48 Complete the formula, and copy it down 4:02 Paste the random formulas as values 4:32 Download the sample file",28,Science & Technology,PT4M44S,284,2d,hd,FALSE,https://i.ytimg.com/vi/aCjGl35dT-U/maxresdefault.jpg,1,18888,110,8,0,8
79,UCNFqyNLJshdysCyj-xeegnA,Contextures Inc.,5sfY-DS2eSA,2014-07-21T18:02:50Z,21/7/14 18:02,Speed Up Excel Files With FastExcel Add-In,"http://www.contextures.com/fastexcelv3review.html Visit this page for FastExcel details and links. If a large, complex Excel file is very slow in calculating, it can be difficult to find and fix all the major trouble spots. Instead of manually digging through the file, taking hours to check all the sheets and formulas, use the FastExcel add-in to find the worst trouble areas. Just click a button, and a profile is created for the workbook, listing each sheet, sorted by calculation time. Then, focus on the worst sheets, and click a button to locate the trouble areas on those sheets. FastExcel gives you advice for fixing slow formulas, and has other tools to help speed things up. This video shows you how to quickly analyze a workbook, and drill down into the worst areas.",28,Science & Technology,PT2M12S,132,2d,hd,FALSE,https://i.ytimg.com/vi/5sfY-DS2eSA/maxresdefault.jpg,1,6838,,,0,
80,UCNFqyNLJshdysCyj-xeegnA,Contextures Inc.,Lxnka8ug4ck,2014-07-11T19:09:52Z,11/7/14 19:09,Set Minimum Row Height With REPT Function,"http://www.contextures.com/excelfilesalexj.html#FN0001 Visit this page to download the sample file. To set a minimum row height in an Excel table, use the REPT and CHAR functions to add line breaks in a cell. The column with this formula can be hidden, after you set it up. Also, you can adjust the number of times that the line break is repeated, and change the font size in the column, for fine-tuning the row height. With this formula, the row height will not go below the set size, even if you AutoFit all the rows. This technique is also useful with pictures, to ensure that all the rows are the same height. Then, if the table is sorted, each picture will display correctly, and not overlap other rows. 0:00 Introduction 0:46 Add new spacing column 1:05 Create REPT and CHAR formula 2:00 Adjust the Font Size 2:29 Table with pictures 2:46 Problem sorting with pictures 3:23 Create REPT and CHAR formula 3:48 Adjust the number of repeats 4:07 Pictures stay in rows when sorted 4:31 Download the sample file Watch this video to see how to use the REPT and CHAR functions to set the minimum row height in an Excel table.",28,Science & Technology,PT4M43S,283,2d,hd,FALSE,https://i.ytimg.com/vi/Lxnka8ug4ck/maxresdefault.jpg,1,4004,31,0,0,9
81,UCNFqyNLJshdysCyj-xeegnA,Contextures Inc.,iUFFrIlHMlo,2014-06-28T16:19:43Z,28/6/14 16:19,Calculate Ratio with Excel Formulas,"http://www.contextures.com/excelformulasratio.html Visit this page to download the sample file. To calculate a ratio between 2 numbers in Excel, you can use the GCD function (Greatest Common Divisor) or use the TEXT and SUBSTITUTE functions. In the first example, to calculate the ratio, the width will be divided by the GCD and the height will be divided by the GCD. A colon will be placed between those two numbers. In the second example, o calculate the ratio, the formula will divide the width by the height, and format the result as a fraction. Then, the slash will be replaced with a colon, to create the ratio. 0:16 Ratio introduction 1:20 GCD formula 4:03 TEXT and SUBSTITUTE formula Watch this video to see how to use these formulas to calculate the ratios in Excel. ",28,Science & Technology,PT8M44S,524,2d,hd,FALSE,https://i.ytimg.com/vi/iUFFrIlHMlo/maxresdefault.jpg,1,121944,280,28,0,29
82,UCNFqyNLJshdysCyj-xeegnA,Contextures Inc.,TuUFXEziejU,2014-06-24T19:12:03Z,24/6/14 19:12,Hide Zeros for Pivot Table Calculated Item,"http://www.contextures.com/excelpivottablecalculateditem.htm Visit this page to download the sample file. If you create a calculated item, extra items might appear in the pivot table, such as each city being listed under each region, with zero amounts in some rows. To hide these zero items, use a Values filter. For example, in this video, the City field will have zero value rows idden, by using a Value filter. There are 3 types of filters available in a pivot table -- Values, Labels and Manual. If you want to apply more than one type of filter, change a setting in the pivot table options, to allow that. Watch this video to see how to create a calculated item, hide the zero value rows, and allow multiple filter types. ",28,Science & Technology,PT4M40S,280,2d,hd,FALSE,https://i.ytimg.com/vi/TuUFXEziejU/maxresdefault.jpg,1,38220,128,9,0,16
83,UCNFqyNLJshdysCyj-xeegnA,Contextures Inc.,1h9iqz_By4I,2014-06-16T15:52:58Z,16/6/14 15:52,Add Number to Multiple Cells in Excel,"http://www.contextures.com/exceladdnumbertocells.html Visit this page to download the sample file. To increase the amounts in a range of cells -- adding the same amount to each cell -- you can use the Paste Special command, or a macro. For example, select a group of cells that contain dates, and increase each date by one week, by adding 7 to each cell. You can do this manually, by using the Paste Special command. If you need to add amounts frequently, use the macros from my sample file. Macro 1 adds a set number to the selected cells. In the macro, you can change that number. Macro 2 asks you to enter a number, then adds that number to the selected cells. In the code, you can change the default number that appears in the input box. Watch this video to see how to use the Paste Special command, and see how to modify the macro code, to change the numbers. ",28,Science & Technology,PT5M4S,304,2d,hd,FALSE,https://i.ytimg.com/vi/1h9iqz_By4I/maxresdefault.jpg,1,70061,207,14,0,35
84,UCNFqyNLJshdysCyj-xeegnA,Contextures Inc.,CpXWslv-e8c,2014-05-28T19:17:57Z,28/5/14 19:17,Auditing Excel Formulas - Quick Tips,"http://www.contextures.com/excelformulasaudit.html Visit this page to download the sample file. When troubleshooting formulas in Excel, you can use keyboard shortcuts and Ribbon commands to help with auditing the formulas. For example, press Ctrl + ` to see the formulas on the worksheet, instead of the formula results. Then, look down a column, to see if the calculations in all the rows look the same. There is also a Show Formulas command on the Ribbon's Formulas tab, that lets you turn this formula display on or off. You can also trace the precedent and dependent cells for a formula, to see which cells are affected by a formula, and which cells it affects. Or, use a shortcut to go to those precedent or dependent cells. Watch this video to see how to use these auditing features for formula troubleshooting. ",28,Science & Technology,PT3M59S,239,2d,hd,FALSE,https://i.ytimg.com/vi/CpXWslv-e8c/maxresdefault.jpg,1,5336,28,0,0,6
85,UCNFqyNLJshdysCyj-xeegnA,Contextures Inc.,tTmKc9aQ1lg,2014-05-20T17:54:33Z,20/5/14 17:54,SHEET and SHEETS Functions in Excel 2013,"http://www.contextures.com/excel-functions-sheet-sheets.html Visit this page to download the sample file. There are new functions in Excel 2013 that let you calculate the sheet number or the number of sheets in a workbook. You can use these functions to help with troubleshooting, and to discover if any sheets are hidden. The SHEET Function returns the sheet number of the active sheet, or the sheet number of the cell reference. The SHEETS function returns the number of sheets in a workbook, or the number of sheets in a 3D reference. Watch this video to see how to use these new functions in Excel 2013. ",28,Science & Technology,PT7M31S,451,2d,hd,FALSE,https://i.ytimg.com/vi/tTmKc9aQ1lg/maxresdefault.jpg,1,13741,26,0,0,8
86,UCNFqyNLJshdysCyj-xeegnA,Contextures Inc.,9QeJxSIADM4,2014-05-17T20:41:37Z,17/5/14 20:41,Group by Weeks in Excel Pivot Table,"http://www.contextures.com/xlPivot07.html Visit this page to download the sample file. When you show totals by date in a pivot table, you can list each date, or group the dates. For example, show a total for each year, or for each month. You can also create your own periods for grouping the dates. In this example, we'll group the dates into 4-week periods, to match the periods in the company's sales calendar. Then, set a starting date for the grouping, so that the periods start on your preferred day of the week Watch this video to see how to group the date field, and set the starting date. ",28,Science & Technology,PT2M48S,168,2d,hd,FALSE,https://i.ytimg.com/vi/9QeJxSIADM4/maxresdefault.jpg,1,25325,72,7,0,5
87,UCNFqyNLJshdysCyj-xeegnA,Contextures Inc.,aXTYcHS3MQs,2014-05-11T19:26:43Z,11/5/14 19:26,Compare Years in Excel Pivot Chart,"Watch this video to see how to see how to compare years in an Excel pivot table. At first, the line chart is bumpy, and shows the data for each day. To fix that, group the date field by months and years. Then, in the pivot chart layout, move the Year field to the column area, to create a separate line for each year. To get the sample file, go to this page on my Contextures website: https://www.contextures.com/excelpivotchartcompareyears.html Instructor: Debra Dalgleish, Contextures Inc. Get Debra's weekly Excel tips: http://www.contextures.com/signup01 More Excel Tips and Tutorials: http://www.contextures.com/tiptech.html Subscribe to Contextures YouTube: https://www.youtube.com/user/contextures?sub_confirmation=1 #ContexturesExcelTips VIDEO TRANSCRIPT In this workbook, we have service data that shows the date of each work order. and we'd like to create a summary, to show the number of work orders each month, comparing 2013 and 2014. So we'll see how we can set up a pivot table to summarize the data and then a pivot chart that shows the years. Here's a sheet with all the raw data. We've got it set up as an Excel table. Each work order has a number and we can see the request date and the date the work was done. First step will be to create a pivot table from this data, to summarize things. Click anywhere in this table, and on the Insert tab, I'll click Pivot Table. This list is a formatted Excel table, a named table, so we can see that it's picked up the name automatically. And so if we add new records, this will expand to include those. And I'd like this chart on an existing worksheet. I'll click in here, click this box. I would like it on ServiceChart1, cell A3. Close that, click.OK. So here's the empty pivot table, and I'm going to put in the work date, and then I'll put the work order into the values and it will show up as a count. So now we have everything summarized by date and I'm going to create a chart to see how it looks now. So go back to the Insert tab. I'll click Pivot Chart, and it's suggesting a column chart, but I would like a line, and I'd like this type of line and I'll click OK. And it's put in a very bumpy line chart for me. So it's charting each day, and I would like it by month and year. So I'm going to have to group the dates. Right now, all the dates are listed individually, so I'll right click on a date and Group. I'd like them grouped by years and months, so I'll select both of those, click OK, and now the chart looks much better. It's showing a single line, and we can see the months across the bottom, 2013 followed by 2014. We'd like to compare year to year though, so I need to create a single line for each year. And to do that, I'm going over to the pivot table field list and I can see Years and Work Date, here in the rows. And to get two separate lines, I'm going to drag Years up into columns, and when I let go, it creates a line for each year. So that's the layout we want. You can do a couple of other things, to make this a little easier to read, and more appealing to look at. So here where it says Count of Work Order, if I go to the pivot table and type Work Orders, and I press Enter, that shows up in the pivot chart as well. And if I don't want this button at the bottom, I can right click on it and hide the Axis field buttons.",28,Science & Technology,PT3M27S,207,2d,hd,TRUE,https://i.ytimg.com/vi/aXTYcHS3MQs/maxresdefault.jpg,1,79636,246,9,0,24
88,UCNFqyNLJshdysCyj-xeegnA,Contextures Inc.,ILsgu9efV98,2014-05-05T17:19:38Z,5/5/14 17:19,Better Format for Pivot Table Headings,"http://www.contextures.com/excel-pivot-table-format.html Visit this page for more pivot table formatting tips. When you create a pivot table, Excel applies a default pivot table style. If there are two or more fields in the Row Labels area, you might see dividing lines, below the item headings. These lines can make it difficult to see which group the headings are connected to. To make the pivot table easier to read, you can add blank rows, or create a new pivot table style, with lines above the headings Watch this video to see how to see how to add the blank rows, or create a new style.",28,Science & Technology,PT3M58S,238,2d,hd,FALSE,https://i.ytimg.com/vi/ILsgu9efV98/maxresdefault.jpg,1,22364,86,2,0,21
89,UCNFqyNLJshdysCyj-xeegnA,Contextures Inc.,O3anZZzExfo,2014-05-04T20:25:29Z,4/5/14 20:25,Save Excel Settings in Custom Views,"http://www.contextures.com/excelfiles.html#FL0026 Visit this page to download the sample file. To save time when printing reports, you can save filter and print setting in Custom Views. NOTE: Custom Views are not available if the workbook contains a named Excel Table. Use filters and formulas to show the name of the selected Custom View, on the main worksheet. Watch this video to see the steps for setting up the Custom Views, switching between them, and creating the formulas to show the name.",28,Science & Technology,PT6M18S,378,2d,hd,FALSE,https://i.ytimg.com/vi/O3anZZzExfo/maxresdefault.jpg,1,2828,29,0,0,13
90,UCNFqyNLJshdysCyj-xeegnA,Contextures Inc.,Ygu0ZNysWTg,2014-04-26T23:32:18Z,26/4/14 23:32,Hide Drop Down Arrows in Pivot Table Headings,"http://www.contextures.com/xlPivot12.html Visit this page for the sample file and code. After you set up a pivot table, you might like to prevent people from selecting items in one or more of the heading drop downs. You can change a pivot table setting, to hide all of the headings and arrows. This is quick and easy, but might not be the ideal solution. Instead, you can use a bit of programming, to hide one or more of the drop down arrows in the headings. This gives you better control over what is hidden. There is sample code on my website, that you can use. Watch this video to see how to see how to change the setting, and how to copy the macro code, and use it in your workbook.",28,Science & Technology,PT5M4S,304,2d,hd,FALSE,https://i.ytimg.com/vi/Ygu0ZNysWTg/maxresdefault.jpg,1,23098,63,2,0,11
91,UCNFqyNLJshdysCyj-xeegnA,Contextures Inc.,FUXQwP3jaUo,2014-04-25T21:03:31Z,25/4/14 21:03,Use Shortcut to Paste in Excel Filtered List,"http://www.contextures.com/xlautofilter02.html#filterpaste Visit this page to download the sample file. Tip from Khushnood Viccaji, who can be contacted at Elance: https://www.elance.com/s/kviccaji/ This video shows the problems that you can have when you try to copy and paste data into a filtered list. In my previous video, I showed a couple of workarounds, to help you avoid the problem. Use those workarounds, if you are pasting data from another location. However, if you are copying and pasting data from one column to another, within the filtered list, you can use a shortcut command. Watch this video to see how you can use a keyboard shortcut, or a menu command, if you are copying and pasting across a row.",28,Science & Technology,PT2M27S,147,2d,hd,FALSE,https://i.ytimg.com/vi/FUXQwP3jaUo/maxresdefault.jpg,1,116654,544,31,0,104
92,UCNFqyNLJshdysCyj-xeegnA,Contextures Inc.,F0pUKDQZ9RI,2014-04-22T20:20:37Z,22/4/14 20:20,Problem Pasting in Excel Filtered List,"http://www.contextures.com/xlautofilter02.html#filterpaste Visit this page to download the sample file. This video shows the problems that you can have when you try to copy and paste data into a filtered list. Watch this video to see why the problem occurs, and a couple of workarounds, to help you avoid the problem.",28,Science & Technology,PT4M40S,280,2d,hd,FALSE,https://i.ytimg.com/vi/F0pUKDQZ9RI/maxresdefault.jpg,1,189966,432,180,0,63
93,UCNFqyNLJshdysCyj-xeegnA,Contextures Inc.,tObpJm6mcHc,2014-04-22T17:44:51Z,22/4/14 17:44,Hide Errors in Excel Pivot Table,"http://www.pivot-table.com/2009/09/14/hide-error-values-in-pivot-table/ Visit this page for written instructions. When there are errors in the pivot table source data, you might see errors in the pivot table Values area. If possible, fix the errors in the data, so they don't show up in the pivot table If you can't fix the source data, it's possible to hide the errors in the pivot table. In the pivot table options, you can change a setting, to hide those errors -- replace them with a space character, or other text. Note: This setting only affects cells in the Values area of the pivot table. If error values appear in the Row Labels, Column Labels, or Report Filter area, they won't be replaced. Watch this video to see how to see how to change the setting, and also see how to hide zeros on the worksheet.",28,Science & Technology,PT2M39S,159,2d,hd,FALSE,https://i.ytimg.com/vi/tObpJm6mcHc/maxresdefault.jpg,1,2443,12,0,0,3
