position,channelId,channelTitle,videoId,publishedAt,publishedAtSQL,videoTitle,videoDescription,videoCategoryId,videoCategoryLabel,duration,durationSec,dimension,definition,caption,thumbnail_maxres,licensedContent,viewCount,likeCount,dislikeCount,favoriteCount,commentCount
42,UCq6XkhO5SZ66N04IcPbqNcw,Keith Galli,iPwN3BPBpwo,2017-09-26T15:42:26Z,26/9/17 15:42,Calculating Pre-Flop Poker Probabilities,In this video I go through the math behind knowing if you have the highest card pre flop in texas hold em poker. This video goes hand in hand with the poker pre flop strategy video that is also on my channel. Let me know if you have any questions about what I did! Link to original video: https://www.youtube.com/watch?v=VV2hOVlMN-0,27,Education,PT10M2S,602,2d,hd,FALSE,https://i.ytimg.com/vi/iPwN3BPBpwo/maxresdefault.jpg,1,11713,101,11,0,13
43,UCq6XkhO5SZ66N04IcPbqNcw,Keith Galli,VV2hOVlMN-0,2017-09-26T15:41:31Z,26/9/17 15:41,"Pre-Flop Probabilities, Tips, & Tricks - How to win at Poker",In this video I walk through some probabilities that are useful to know before the flop occurs in Texas Hold 'Em Poker. I also get a little bit into tips on how to play based on these probabilities. This is the first video in a series that I will be updating very soon. Also I will be posting calculations for the probabilities used in this video in the near future. Link to calculating the probabilities: https://www.youtube.com/watch?v=iPwN3BPBpwo&t=25s,27,Education,PT12M24S,744,2d,hd,FALSE,https://i.ytimg.com/vi/VV2hOVlMN-0/maxresdefault.jpg,1,5082,64,9,0,14
44,UCq6XkhO5SZ66N04IcPbqNcw,Keith Galli,qFFBmfUah5k,2017-07-26T06:08:03Z,26/7/17 6:08,How to Play Ugolki (Corners),"Another new board game to learn. This one can easily be played with a checkers board or an othello board. The game Ugolki is popular in Russia and the word means ""corners"" in English.",27,Education,PT5M59S,359,2d,hd,FALSE,https://i.ytimg.com/vi/qFFBmfUah5k/maxresdefault.jpg,1,654,15,0,0,8
45,UCq6XkhO5SZ66N04IcPbqNcw,Keith Galli,A8v9H1C7uOQ,2017-07-16T06:03:12Z,16/7/17 6:03,How to win at Scrabble almost every time!,"First Board Game Strategy video I have made in a while. These tips and tricks should help you beat your beginner through intermediate opponents! The content in this video can also be easily applied to other word games such as ""words with friends"". I love getting feedback on my videos so if there is anything in particular you loved or hated, let me know! I want to improve. Follow me on social media! Instagram: http://bit.ly/2hU8W7U Twitter: http://bit.ly/2ilMPrV",27,Education,PT9M28S,568,2d,hd,FALSE,https://i.ytimg.com/vi/A8v9H1C7uOQ/maxresdefault.jpg,1,59568,760,48,0,100
46,UCq6XkhO5SZ66N04IcPbqNcw,Keith Galli,MJXOZCly8nM,2017-07-07T06:49:56Z,7/7/17 6:49,Dynamic Programming Example - Fibonacci,In this video I walk you through a simple solution to solve for the nth fibonacci number using dynamic programming. Instagram: http://bit.ly/2hU8W7U Twitter: http://bit.ly/2ilMPrV,27,Education,PT5M47S,347,2d,hd,FALSE,https://i.ytimg.com/vi/MJXOZCly8nM/maxresdefault.jpg,1,2622,43,1,0,4
47,UCq6XkhO5SZ66N04IcPbqNcw,Keith Galli,09AAT29uaGE,2017-06-21T17:34:45Z,21/6/17 17:34,How to Play Konane (Hawaiian Checkers),"Learn how to play a new game! In this video I go through a tutorial on how to play the ancient hawaiian game ""Konane"". This is a fun strategy game that is very easy to learn how to play. You can play with an othello board for convenience. Also add a timer to make the game more competitive. **Note! Double jumps must be made in the same direction. You cannot jump one rock horizontally and then on the same move jump another rock vertically Instagram: http://bit.ly/2hU8W7U Twitter: http://bit.ly/2ilMPrV",27,Education,PT4M5S,245,2d,hd,FALSE,https://i.ytimg.com/vi/09AAT29uaGE/maxresdefault.jpg,1,4615,44,1,0,10
48,UCq6XkhO5SZ66N04IcPbqNcw,Keith Galli,cDdSVCcugxg,2017-02-13T05:19:59Z,13/2/17 5:19,Solving Recurrences Example - Fibonacci (Recursion-Tree Method),In this video I solve for the runtime to calculate the nth fibonacci number using the recursion tree method. Note in this way of computing I did not use the memoization technique to improve the runtime.,27,Education,PT4M35S,275,2d,hd,FALSE,https://i.ytimg.com/vi/cDdSVCcugxg/maxresdefault.jpg,1,16478,89,28,0,5
49,UCq6XkhO5SZ66N04IcPbqNcw,Keith Galli,gvfWeX8GCS8,2017-02-13T05:05:13Z,13/2/17 5:05,Solving Recurrences Example - Merge Sort (Master Method),In this video I use the master method to solve for the asymptotic runtime of Merge Sort.,27,Education,PT3M26S,206,2d,hd,FALSE,https://i.ytimg.com/vi/gvfWeX8GCS8/maxresdefault.jpg,1,3204,22,9,0,2
50,UCq6XkhO5SZ66N04IcPbqNcw,Keith Galli,oD9lyzbaFuU,2017-02-13T04:50:05Z,13/2/17 4:50,Solving Recurrences Example - Binary Search (Master Method),In this video I solve for the runtime of binary search using the master method.,27,Education,PT3M24S,204,2d,hd,FALSE,https://i.ytimg.com/vi/oD9lyzbaFuU/maxresdefault.jpg,1,13529,70,10,0,10
51,UCq6XkhO5SZ66N04IcPbqNcw,Keith Galli,9pKMUQ8lHjc,2017-02-13T04:18:33Z,13/2/17 4:18,Master Method to Solve Recurrences - Overview,"In this video I give an overview on how to solve recurrences using the master method. The master method provides a great way to solve a lot of recurrences. However, if your recurrence does not meet any of the 3 cases you will have to use other means to calculate your runtime such as the recursion-tree or substituion method. In future videos I'll give examples of all 3 methods in practice. The rules are summarized on Wikipedia: https://en.wikipedia.org/wiki/Master_theorem",27,Education,PT6M28S,388,2d,hd,FALSE,https://i.ytimg.com/vi/9pKMUQ8lHjc/maxresdefault.jpg,1,8353,57,8,0,5
52,UCq6XkhO5SZ66N04IcPbqNcw,Keith Galli,l0iXqhqfDPo,2017-02-10T05:54:26Z,10/2/17 5:54,Recurrence Equations Overview (Computer Science/Algorithms),"This is my first video of a series of computer science recurrence videos that I will be posting. This video provides a brief introduction of what a recurrence is. Future videos will explain methods to solve recurrences (Master Method, Recursion-Tree, Induction, etc...) as well as provide examples where recurrences are actually solved. If you have any computer science/algorithm topic you need help with and need a better explanation of, please email me at ""KeithGLearning@gmail.com"" Keith",27,Education,PT6M11S,371,2d,hd,FALSE,https://i.ytimg.com/vi/l0iXqhqfDPo/maxresdefault.jpg,1,8774,103,5,0,8
53,UCq6XkhO5SZ66N04IcPbqNcw,Keith Galli,5xooMXyleXM,2017-02-03T18:33:00Z,3/2/17 18:33,Please Approve My Pull Request!,Forward this friendly reminder to your coworkers and software engineering friends to approve your pull requests! Thanks to Big Man Tyrone for the Video!,27,Education,PT24S,24,2d,hd,FALSE,https://i.ytimg.com/vi/5xooMXyleXM/maxresdefault.jpg,1,2758,81,1,0,7
54,UCq6XkhO5SZ66N04IcPbqNcw,Keith Galli,o3Si2CuAtWE,2017-01-23T06:51:06Z,23/1/17 6:51,Bubble Sort Explained & Pseudocode,"In this video I explain another popular basic sorting algorithm, bubble sort. If you have future video requests send me an email at ""KeithGLearning@gmail.com"". Also I appreciate any feedback I can get so please leave a comment, or give me a thumbs up on this video! Keith",27,Education,PT11M39S,699,2d,hd,FALSE,https://i.ytimg.com/vi/o3Si2CuAtWE/maxresdefault.jpg,1,3811,23,7,0,2
55,UCq6XkhO5SZ66N04IcPbqNcw,Keith Galli,m7R05s0zsAI,2017-01-22T19:22:49Z,22/1/17 19:22,Insertion Sort Explained & Pseudocode,"In this video I go through the basic sorting algorithm, insertion sort. If you have any suggestions for future videos, please email me at KeithGLearning@gmail.com. Also I appreciate any feedback I can get so if you liked this video or think that I could do better, please leave me a comment below. Keith.",27,Education,PT11M21S,681,2d,hd,FALSE,https://i.ytimg.com/vi/m7R05s0zsAI/maxresdefault.jpg,1,4848,48,5,0,10
56,UCq6XkhO5SZ66N04IcPbqNcw,Keith Galli,5O6f1GTLLeQ,2017-01-17T06:39:43Z,17/1/17 6:39,Simple explanation of Asymptotic Notation!,"In this video I give a brief introduction on Asymptotic Notation in Computer Science (Algorithms). I appreciate any feedback that I can get so if you liked this video, or think it could be improved upon, please let me know. In addition if you have difficult concepts you want explained simply, shoot me an email at keithglearning@gmail.com and I will make you a video within 48 hours.",27,Education,PT9M47S,587,2d,hd,FALSE,https://i.ytimg.com/vi/5O6f1GTLLeQ/maxresdefault.jpg,1,32410,246,29,0,15
57,UCq6XkhO5SZ66N04IcPbqNcw,Keith Galli,m0h6XzKfulM,2017-01-14T20:43:23Z,14/1/17 20:43,Simplest way to remember Complementary vs Supplementary Angles!,"Quick video on a trick to remember the difference between complementary and supplementary angles. If you have concepts you don't understand or that you want explained, email me at ""keithglearning@gmail.com"" and I will respond within 48 hours. Any feed",27,Education,PT3M20S,200,2d,hd,FALSE,https://i.ytimg.com/vi/m0h6XzKfulM/maxresdefault.jpg,1,9613,75,14,0,13
58,UCq6XkhO5SZ66N04IcPbqNcw,Keith Galli,jMpbYpaKtao,2017-01-02T20:51:35Z,2/1/17 20:51,How to win at Battleship almost every time!,"In this video, I walk you through the best way to guess your opponents ships in the game of Battleship. I set up most of these slides for a presentation I gave at MIT on the topic. I love feedback so let me know what I should make future videos on! The link to the research paper I mentioned in the video is: http://www.datagenetics.com/blog/december32011/ Follow me on social media! Instagram: http://bit.ly/2hU8W7U Twitter: http://bit.ly/2ilMPrV",27,Education,PT7M53S,473,2d,hd,FALSE,,1,253696,1797,211,0,176
59,UCq6XkhO5SZ66N04IcPbqNcw,Keith Galli,sJgLi32jMo0,2017-01-02T19:14:52Z,2/1/17 19:14,How to win at Othello almost every time!,"This video gives you strategy tips for how to consistently win at Othello. I walk through myself playing a game and give you information on what I am thinking at every point. If you want me to analyze another specific board game, let me know. In addition check out my other videos on game theory. ***Note: I found that these strategies work well against casual players. For more advanced players some of the comments on edge play do not work in competitive matches. If you want to play competitively I recommend you google the book ""Brian Rose Othello A min to learn, a lifetime to master"". Credit to youtube user vecspace for making this suggestion.",27,Education,PT8M59S,539,2d,hd,FALSE,https://i.ytimg.com/vi/sJgLi32jMo0/maxresdefault.jpg,1,124037,581,344,0,110
60,UCq6XkhO5SZ66N04IcPbqNcw,Keith Galli,3R1Cx6uGjMw,2016-12-27T21:12:20Z,27/12/16 21:12,How to win at Connect 4 almost every time!,"In this video, I walk through some of the best techniques to consistently win connect 4. Hope you find it helpful! If you liked this video, please check out my other videos and comment with suggestions I should make for future videos. :). Follow me on social media! Instagram | https://www.instagram.com/keithgalli/ Twitter | https://twitter.com/keithgalli",22,People & Blogs,PT6M10S,370,2d,hd,FALSE,https://i.ytimg.com/vi/3R1Cx6uGjMw/maxresdefault.jpg,1,523481,3789,345,0,400