position,channelId,channelTitle,videoId,publishedAt,publishedAtSQL,videoTitle,videoDescription,videoCategoryId,videoCategoryLabel,duration,durationSec,dimension,definition,caption,thumbnail_maxres,licensedContent,viewCount,likeCount,dislikeCount,favoriteCount,commentCount
9,UCq6XkhO5SZ66N04IcPbqNcw,Keith Galli,eMOA1pPVUc4,2020-01-14T02:01:20Z,14/1/20 2:01,Solving real world data science tasks with Python Pandas!,"In this video we use Python Pandas & Python Matplotlib to analyze and answer business questions about 12 months worth of sales data. The data contains hundreds of thousands of electronics store purchases broken down by month, product type, cost, purchase address, etc. Setup! Github source code & data: https://github.com/KeithGalli/Pandas-Data-Science-Tasks Installing Jupyter Notebook: https://jupyter.readthedocs.io/en/latest/install.html Installing Pandas library: https://pandas.pydata.org/pandas-docs/stable/install.html Check out the first video I did on Pandas: https://youtu.be/vmEHCJofslg Check out the videos I did on Matplotlib: https://youtu.be/DAQNHzOcO5A https://youtu.be/0P7QnIQDBJY Detailed video description! (timeline can be found in comments) We start by cleaning our data. Tasks during this section include: - Drop NaN values from DataFrame - Removing rows based on a condition - Change the type of columns (to_numeric, to_datetime, astype) Once we have cleaned up our data a bit, we move the data exploration section. In this section we explore 5 high level business questions related to our data: - What was the best month for sales? How much was earned that month? - What city sold the most product? - What time should we display advertisemens to maximize the likelihood of customer’s buying product? - What products are most often sold together? - What product sold the most? Why do you think it sold the most? To answer these questions we walk through many different pandas & matplotlib methods. They include: - Concatenating multiple csvs together to create a new DataFrame (pd.concat) - Adding columns - Parsing cells as strings to make new columns (.str) - Using the .apply() method - Using groupby to perform aggregate analysis - Plotting bar charts and lines graphs to visualize our results - Labeling our graphs If you enjoy this video, make sure to leave it a like and subscribe to not miss any future similar tutorials :). --------------------------------------------- Follow me on social media! Instagram | https://www.instagram.com/keithgalli/ Twitter | https://twitter.com/keithgalli --------------------------------------------- Video Timeline! 0:00 - Intro 1:22 - Downloading the Data 2:57 - Getting started with the code (Jupyter Notebook) Task #1: Merging 12 csvs into a single dataframe (3:35) 4:25 - Read single CSV file 5:44 - List all files in a directory 7:06 - Concatenating files 11:00 - Reading in Updated dataframe Task #2: Add a Month column (12:48) 14:12 - Parse string in Pandas cell (.str) Cleaning our data! 17:31 - Drop NaN values from df 21:25 - Remove rows based on condition Task #3: Add a sales column (24:58) 25:58 - Another way to convert a column to numeric (ints & floats) Question #1: What was the best month for sales? (29:20) 30:35 - Visualizing our results with bar chart in matplotlib Question #2: What city sold the most product? (34:17) 35:32 - Add a city column 36:10 - Using the .apply() method (super useful!!) 40:35 - Why do we use the lambda x ? 40:57 - Dropping a column 46:45 - Answering the question (using groupby) 47:34 - Plotting our results Question #3: What time should we display advertisements to maximize the likelihood of purchases? (52:13) 53:16 - Using to_datetime() method 56:01 - Creating hour & minute columns 58:17 - Matplotlib line graph to plot our results 1:00:15 - Interpreting our results Question #4: What products are most often sold together? (1:02:17) 1:03:31 - Finding duplicate values in our DataFrame 1:05:43 - Use transform() method to join values from two rows into a single row 1:08:00 - Dropping rows with duplicate values 1:09:39 - Counting pairs of products (itertools, collections) Question #5: What product sold the most? Why do you think it did? (1:14:04) 1:15:28 - Graphing data 1:18:41 - Overlaying a second Y-axis on existing chart 1:23:41 - Interpreting our results",27,Education,PT1H26M7S,1567,2d,hd,FALSE,,1,264805,10277,82,0,660
10,UCq6XkhO5SZ66N04IcPbqNcw,Keith Galli,VUYPWxTe4Nw,2019-12-17T01:30:01Z,17/12/19 1:30,Programming More Trees in Python! (Recursion & Artwork),"In this video, we code up some more tree animations using python to support the #TeamTrees movement! Link to donate: https://teamtrees.org/ We start off showing how you can use recursion to make basic tree like structures. We then build on that and use more sophisticated recursive logic to make the trees look pretty realistic. Next we go through how you can draw paintings in Python. This method works by sampling points in a photograph and drawing brush strokes of the same color in the generated image. It ultimately outputs some pretty cool stuff :). Check out the first video I made for team trees! https://youtu.be/WG42fyCMsD0 Check out Kyle on Instagram for all the awesome nature pictures! https://www.instagram.com/k_rowejo/ Thanks for watching everyone! Thanks @Mark Rober & @MrBeast for all your efforts towards organizing this movement!! :) ~~~~~~~~~~~~~~~~~~~~~~~~ Source code (recursive example): https://github.com/KeithGalli/TeamTrees I haven’t made the source code for the paintings public yet. Think I’ll post it here sometime in the next couple weeks. Feel free to bug me in the comments in case I forget. ~~~~~~~~~~~~~~~~~~~~~~~~ Follow me on Twitter: https://twitter.com/keithgalli Follow me on Instagram: https://www.instagram.com/keithgalli/",27,Education,PT9M28S,568,2d,hd,FALSE,https://i.ytimg.com/vi/VUYPWxTe4Nw/maxresdefault.jpg,1,12900,163,4,0,32
11,UCq6XkhO5SZ66N04IcPbqNcw,Keith Galli,WG42fyCMsD0,2019-12-12T01:30:02Z,12/12/19 1:30,Programming Trees in Python! (with the turtle graphics library),"Link to donate: https://teamtrees.org/ Source code: https://github.com/KeithGalli/TeamTrees In this video, we code up some cool tree animations using the python turtle library to support the #TeamTrees movement! :) We start off with some basics defining a few different functions to build up to a draw_tree function. Then we look at how you can clean up that base code using a Tree Class. Finally, we take our simple tree and replicate it many times to create some cool artwork. I'm going to post a part 2 in a couple days where I walk through using recursion to draw some more trees. Watch Part 2!! https://youtu.be/VUYPWxTe4Nw Python Turtle Graphics Library Tutorial: https://youtu.be/pxKu2pQ7ILo Turtle graphics documentation: https://docs.python.org/3.3/library/turtle.html?highlight=turtle Thanks for watching everyone! Thanks @Mark Rober & @MrBeast for all your efforts towards organizing this movement!! :) Follow me on Twitter: https://twitter.com/keithgalli Follow me on Instagram: https://www.instagram.com/keithgalli/ ~~~~~~~~~~~~~~~~~~~~~~~~~~~~~~~~~~~~~~~~~ While I was working on this video, I stumbled into some other Coding YouTubers who made cool videos for TeamTrees. If you're looking for similar content, check out! @The Coding Train: https://www.youtube.com/playlist?list=PLRqwX-V7Uu6bxNsa_3SfCPyF9Md9XvXhR @John Fish: https://youtu.be/SNdtMjkRVrU",27,Education,PT12M51S,771,2d,hd,FALSE,https://i.ytimg.com/vi/WG42fyCMsD0/maxresdefault.jpg,1,5867,181,6,0,18
12,UCq6XkhO5SZ66N04IcPbqNcw,Keith Galli,XNP2mUlGVOk,2019-11-19T20:00:01Z,19/11/19 20:00,How to Prepare for a Programming Interview! (Tips & Tricks),"In this video we walk through some of my tips for having success in a programming interview. We start with some high level details on how programming interviews work. Next we dive into my favorite places to find practice problems. After this we start talking about some specific tips you can do during an interview to improve your likelihood of receiving an offer. We end the video talking about what you should wear on interview day (men + women). I'll post some interview practice problem walkthroughs soon! If you have any questions, let me know in the comments! Also make sure to SUBSCRIBE if you haven't already :). Socials: Instagram: @KeithGalli Twitter: @KeithGalli Thank you guys for watching, I appreciate all the support recently!! ~~~~~~~~~~~~~~~~~~~~~~~~~~~~~~~~~ Links to sites mentioned Cracking the Coding Interview Book: https://amzn.to/2Qu6edA Leetcode: https://leetcode.com/problemset/all/ HackerRank: https://www.hackerrank.com/dashboard Places to read cool things: https://reddit.com/r/Python/ https://reddit.com/r/Programming/ https://reddit.com/r/MachineLearning https://medium.com https://news.ycombinator.com",27,Education,PT17M21S,1041,2d,hd,FALSE,https://i.ytimg.com/vi/XNP2mUlGVOk/maxresdefault.jpg,1,2724,160,1,0,40
13,UCq6XkhO5SZ66N04IcPbqNcw,Keith Galli,M9Itm95JzL0,2019-09-30T23:25:19Z,30/9/19 23:25,"Real-World Python Machine Learning Tutorial w/ Scikit Learn (sklearn basics, NLP, classifiers, etc)","In this video we walk through a real world python machine learning project using the sci-kit learn library. In it we work our way to building a model that automatically classifies text as either having a positive or negative sentiment. We do this by using amazon reviews as our training data. Full video timeline in the comments! Link to Code & Data: https://github.com/keithgalli/sklearn Raw Data download: http://jmcauley.ucsd.edu/data/amazon/ Sci-kit learn documentation: https://scikit-learn.org/stable/documentation.html Make sure you have sci-kit learn downloaded! To do this either run ""pip install sklearn"" or use python through Anaconda. ~~~~~~~~~~~~~~~~~~~~~~~~~~~~~~ Follow me on social media! Instagram: https://www.instagram.com/keithgalli/ Twitter: https://twitter.com/keithgalli To get one of the cool shirts I was wearing: https://www.instagram.com/pagandvls/ ~~~~~~~~~~~~~~~~~~~~~~~~~~~~~~~~~ If you enjoy make sure to LIKE & SUBSCRIBE. Also let me know what I should do for future videos! ~~~~~~~~~~~~~~~~~~~~~~~~~~~~~~~~~ Video outline! 0:00 - What we will be doing! 3:40 - Sci-Kit Learn Overview 6:38 - How do we find training data? 9:33 - Download data 11:45 - Load our data into Jupyter Notebook 16:38 - Cleaning our code a bit (building data class) 20:13 - Using Enums 22:50 - Converting text to numerical vectors, bag of words (BOW) explanation 25:45 - Training/Test Split (make sure to ""pip install sklearn"" !) 33:45 - Bag of words in sklearn (CountVectorizer) 40:05 - fit_transform, fit, transform methods 42:05 - Model Selection (SVM, Decision Tree, Naive Bayes, Logistic Regression) & Classification 47:50 - predict method 53:35 - Analysis & Evaluation (using clf.score() method) 56:58 - F1 score 1:01:01 - Improving our model (evenly distributing positive & negative examples and loading in more data) 1:20:36 - Let's see our model in action! (qualitative testing) 1:22:24 - Tfidf Vectorizer 1:25:40 - GridSearchCv to automatically find the best parameters 1:31:30 - Further NLP improvement opportunities 1:32:50 - Saving our model (Pickle) and reloading it later 1:36:37 - Category Classifier 1:39:14 - Confusion Matrix",27,Education,PT1H40M49S,2449,2d,hd,FALSE,https://i.ytimg.com/vi/M9Itm95JzL0/maxresdefault.jpg,1,54302,1861,11,0,199
14,UCq6XkhO5SZ66N04IcPbqNcw,Keith Galli,GB9ByFAIAH4,2019-07-10T17:03:47Z,10/7/19 17:03,"Complete Python NumPy Tutorial (Creating Arrays, Indexing, Math, Statistics, Reshaping)","This video overviews the NumPy library. It provides background information on how NumPy works and how it compares to Python's Built-in lists. This video goes through how to write code with NumPy. It starts with the basics of creating arrays and then gets into more advanced stuff. A full video timeline can be found in the comments. Link to code used in video: https://github.com/KeithGalli/NumPy Feel free to watch at 1.5x to learn more quickly! If you enjoyed this video, please consider subscribing :). Let me know your feedback and what I should make a video on next. ~~~~~~~~~~~~~~~~~~~~~~~~~~~~~~~~~~~~~~~~~~ Videos of mine that use NumPy Creating Connect 4 Game: https://youtu.be/UYgyRArKDEs Plotting (with some use of NumPy): https://youtu.be/DAQNHzOcO5A ~~~~~~~~~~~~~~~~~~~~~~~~~~~~~~~~~~~~~~~~~~ Links with more information! NumPy vs Lists: https://jakevdp.github.io/blog/2014/05/09/why-python-is-slow/ Indexing: https://docs.scipy.org/doc/numpy-1.13.0/user/basics.indexing.html Array Creation Routines: https://docs.scipy.org/doc/numpy/reference/routines.array-creation.html Math Routines Docs: https://docs.scipy.org/doc/numpy/reference/routines.math.html Linear Algebra Docs: https://docs.scipy.org/doc/numpy/reference/routines.linalg.html ~~~~~~~~~~~~~~~~~~~~~~~~~~~~~~~~~~~~~~~~~~~ Video Timeline! 0:00 - Introduction 1:15 - What is NumPy 1:35 - NumPy vs Lists (speed, functionality) 9:17 - Applications of NumPy 11:08 - The Basics (creating arrays, shape, size, data type) 16:08 - Accessing/Changing Specific Elements, Rows, Columns, etc (slicing) 23:14 - Initializing Different Arrays (1s, 0s, full, random, etc...) 31:34 - Problem #1 (How do you initialize this array?) 33:42 - Be careful when copying variables! 35:45 - Basic Mathematics (arithmetic, trigonometry, etc.) 38:20 - Linear Algebra 42:19 - Statistics 43:57 - Reorganizing Arrays (reshape, vstack, hstack) 47:29 - Load data in from a file 50:20 - Advanced Indexing and Boolean Masking 55:59 - Problem #2 (How do you index these values?)",27,Education,PT58M41S,3521,2d,hd,FALSE,https://i.ytimg.com/vi/GB9ByFAIAH4/maxresdefault.jpg,1,276007,9040,88,0,354
15,UCq6XkhO5SZ66N04IcPbqNcw,Keith Galli,0P7QnIQDBJY,2019-06-06T16:55:03Z,6/6/19 16:55,"Python Plotting Tutorial w/ Matplotlib & Pandas (Line Graph, Histogram, Pie Chart, Box & Whiskers)","In this video, we go through several real-world examples of using the Matplotlib & Pandas libraries to visualize data from CSV files. This is a follow-up to my introductory matplotlib video (https://youtu.be/DAQNHzOcO5A). Timeline for what we cover can be found in the comments. We start by creating line graphs of global gas price data over time. We review how to add a title, x & y axis labels, and scale our graph. We review how to customize the style and size of our charts. Next, we look at the FIFA 19 player data to create a histogram, a couple pie charts, and a box and whisker plot. If you enjoy this video, make sure to LIKE and SUBSCRIBE :) :) If you have any questions or feedback, please let me know in the comments! --------------------------------------------- Follow me on social media! Instagram | https://www.instagram.com/keithgalli/ Twitter | https://twitter.com/keithgalli --------------------------------------------- Link to Source Code & Datasets! https://github.com/KeithGalli/matplotlib_tutorial Matplotlib Documentation: https://matplotlib.org/api/_as_gen/matplotlib.pyplot.html Matplotlib Fonts: http://jonathansoma.com/lede/data-studio/matplotlib/list-all-fonts-available-in-matplotlib-plus-samples/ Matplotlib Style Options: https://matplotlib.org/3.1.0/gallery/style_sheets/style_sheets_reference.html Kaggle Data Link: https://www.kaggle.com/karangadiya/fifa19 --------------------------------------------- Video timeline! 0:00 - Intro & Video Overview 2:22 - Load Necessary Libraries & Download Data 3:48 - Line Graph Example (Plotting Data from CSV file) 21:52 - Histogram Example (FIFA Overall Skill Distribution) 29:25 - Pie Chart #1 (Counting data in CSV) - Visualizing Soccer Foot Preferences 36:41 - Pie Chart #2 (More advance Pandas Example) - Weight Distribution of FIFA Players 47:49 - Box & Whisker Plot (Comparing FIFA teams to one another) 1:00:37 - Final Comments",27,Education,PT1H1M31S,91,2d,hd,FALSE,https://i.ytimg.com/vi/0P7QnIQDBJY/maxresdefault.jpg,1,72848,2265,13,0,137
16,UCq6XkhO5SZ66N04IcPbqNcw,Keith Galli,DAQNHzOcO5A,2019-06-01T16:38:49Z,1/6/19 16:38,"Intro to Data Visualization in Python with Matplotlib! (line graph, bar chart, title, labels, size)","Yay finally posting again. Hopefully this video will help you get comfortable working through the matplotlib library. I'm going to post a follow up video with real-world examples (combining pandas with matplotlib) and different types of plots next week. I originally was going to include that in this one, but I thought the video was getting a bit too long. In this video we walk through some of the basics of matplotlib. We start by making a simple line graph. We learn how to give the graph a title and label the x & y axis. We learn how to scale the graph by specifying the x & y tickmarks. After this, we restyle our line by passing in keyword arguments then do basically the same thing with a shorthand notation. We resize our graph and save it. Then we end with a simple bar chart. Source Code (includes code and data for next video as well): https://github.com/KeithGalli/matplotlib_tutorial/ Matplotlib Pyplot Documentation: https://matplotlib.org/api/_as_gen/matplotlib.pyplot.html Font List: http://jonathansoma.com/lede/data-studio/matplotlib/list-all-fonts-available-in-matplotlib-plus-samples/ Install libraries Needed for this video: Option 1: Open up a terminal window and type pip install matplotlib pip install numpy pip install pandas Option 2: Download anaconda which will contain all the packages we need. A video on how to do this is here: https://youtu.be/YJC6ldI3hWk Thanks for watching! Make sure to like and subscribe to not miss any future videos! Let me know if you have any questions. --------------------------------------------- Follow me on social media! Instagram | https://www.instagram.com/keithgalli/ Twitter | https://twitter.com/keithgalli -------------------------------------------- Video Timeline: 0:00 - Video overview (note real-world examples moved to next video) 1:43 - Setup 2:23 - Our first line graph! 4:50 - Add title and labels for x & y axis 7:13 - Change font type, size, etc. 9:02 - Change tick marks (scale graph) 11:20 - Add a legend 12:25 - Restyle our line (color, line style, markers, width) 15:53 - Shorthand notation to restyle lines 17:27 - List of line customization options 17:55 - Plot more complex lines 22:20 - Resize Graph 24:48 - Save Graph 26:00 - Annotating/Cleaning Code 27:00 - Bar Chart 31:25 - Final Comments",27,Education,PT32M33S,1953,2d,hd,FALSE,https://i.ytimg.com/vi/DAQNHzOcO5A/maxresdefault.jpg,1,57866,1964,12,0,95
17,UCq6XkhO5SZ66N04IcPbqNcw,Keith Galli,D8-snVfekto,2019-02-02T02:45:38Z,2/2/19 2:45,How to Program a GUI Application (with Python Tkinter)!,In this video we learn how to build an application with a graphical user interface (GUI). This is a great video to learn how to use the Tkinter library as well as be introduced to some very important Python skills. We start off by introducing the fundamentals of the Tkinter library. We then create a frame for a weather application. We then connect it to a weather API and then finally convert the application to an executable file. Source code: https://github.com/KeithGalli/GUI Follow me on social media! Instagram | https://www.instagram.com/keithgalli/ Twitter | https://twitter.com/keithgalli TKinter Documentation: https://www.tutorialspoint.com/python/python_gui_programming.htm Hope you enjoyed the video! Make sure to like and subscribe if you haven't already :) ~~~~~~~~~~~~~~~~~~~~~~~~~~~~ Some potentially useful videos... API overview (not my video): https://www.youtube.com/watch?v=7YcW25PHnAA Working with JSON in Python (not my video): https://www.youtube.com/watch?v=9N6a-VLBa2I Installing Python: https://youtu.be/RJL6Y761TNE Python Tutorial #1: https://youtu.be/XM0CtrJYM2A ~~~~~~~~~~~~~~~~~~~~~~~~~~~~ Video timeline! 0:00 - What we’re ultimately building 2:05 - Getting started 3:16 - The basics of every Tkinter App (Root) 4:44 - Add a button to the screen 6:20 - Passing in keyword arguments 10:07 - Using frames to organize widgets 11:53 - Setting custom colors 14:00 - pack() to place widgets 17:39 - grid() to place widgets 19:53 - place() to place widgets 25:49 - Setting the appearance of our final application 33:45 - Adding background image 36:00 - Implementing button/entry functionality 39:49 - Connecting to the Weather API 43:29 - Making a GET request 51:36 - Formatting our response 56:24 - Changing Font and Font Size 59:58 - How to add weather icons to the app 1:01:36 - Making our App an executable using PyInstaller,27,Education,PT1H5M14S,314,2d,hd,FALSE,https://i.ytimg.com/vi/D8-snVfekto/maxresdefault.jpg,1,543365,11435,198,0,693
18,UCq6XkhO5SZ66N04IcPbqNcw,Keith Galli,MMLtza3CZFM,2019-01-02T15:44:26Z,2/1/19 15:44,How to Program a Connect 4 AI (implementing the minimax algorithm),"In this video we take the connect 4 game that we built in the How to Program Connect 4 in Python series and add an expert level AI to it. We start out with a very simple implementation of just dropping a piece randomly and then progress to choosing a column based on score and then finally implementing the minimax algorithm with alpha beta pruning. Here is the link to the code we started with: https://github.com/KeithGalli/Connect4-Python To understand the theory behind this code, make sure to watch this video on how a board game AI works: https://youtu.be/y7AKtWGOPAE To understand alpha-beta pruning, check out this video: https://youtu.be/l-hh51ncgDI To build the game we started out with, watch these four videos: 1. https://youtu.be/UYgyRArKDEs 2. https://youtu.be/zD-Xuu_Jpe4 3. https://youtu.be/SDz3P_Ctm7U 4. https://youtu.be/krCKxcrHeN4 If you want to send me your finished AI, email me: kgmit18@gmail.com Follow me on social media too please :) https://www.instagram.com/keithgalli/ https://twitter.com/keithgalli/ Thanks for watching! Hope you all learning something SUBSCRIBE to not miss out on any future videos",27,Education,PT1H27M29S,1649,2d,hd,FALSE,https://i.ytimg.com/vi/MMLtza3CZFM/maxresdefault.jpg,1,38165,465,8,0,50
19,UCq6XkhO5SZ66N04IcPbqNcw,Keith Galli,tdf8WlPyS1M,2018-11-23T16:04:36Z,23/11/18 16:04,"Programming Rock, Paper, Scissors with no If Statements (Python)","Taking the rock, paper, scissors game we programmed in the last video and this time trying to do it with no if statements. I liked the idea of making this video because being able to think about problems in multiple different ways is an important python skill. Let me know if you have any questions, and I hope you enjoy :). Make sure to SUBSCRIBE to not miss any future videos. Link to first rock, paper, scissors video: https://youtu.be/8TCtYbt7ARI Source code: https://github.com/KeithGalli/rockpaperscissors Link to setup SublimeREPL: https://packagecontrol.io/packages/SublimeREPL ~~~~~~~~~~~~~~~~~~~~~~~~~ PYTHON TUTORIAL SERIES: Why Learn Python? +Setup: https://youtu.be/RJL6Y761TNE 1. Math & Variables: https://youtu.be/XM0CtrJYM2A 2. Conditional Statements (if, elif, else): https://youtu.be/vsVGPcfxEiA 3. Functions: https://youtu.be/5U95tRdYySA 4. Lists & Tuples: https://youtu.be/_zFI6ytHHdY 5. For Loops & While Loops: https://youtu.be/WPF5M_Ic6Fc Learn to Program a game: https://youtu.be/-8n91btt5d8",27,Education,PT20M33S,1233,2d,hd,FALSE,https://i.ytimg.com/vi/tdf8WlPyS1M/maxresdefault.jpg,1,4660,121,2,0,21
20,UCq6XkhO5SZ66N04IcPbqNcw,Keith Galli,8TCtYbt7ARI,2018-11-21T21:54:11Z,21/11/18 21:54,"How to program Rock, Paper, Scissors in Python!","Good exercise to get more comfortable with the python programming syntax. Let me know if you have any questions and I will post the follow up video (programming rock, paper, scissors with no if statements) in the next day or two. Hope you enjoy :) Make sure to SUBSCRIBE to not miss any future videos. Also please let me know what you would like to see me post in the future. Source Code: https://github.com/KeithGalli/rockpaperscissors Link to setup SublimeREPL: https://packagecontrol.io/packages/SublimeREPL ~~~~~~~~~~~~~~~~~~~~~~~~~~~~~~~~~~ PYTHON TUTORIAL SERIES: Why Learn Python? +Setup: https://youtu.be/RJL6Y761TNE 1. Math & Variables: https://youtu.be/XM0CtrJYM2A 2. Conditional Statements (if, elif, else): https://youtu.be/vsVGPcfxEiA 3. Functions: https://youtu.be/5U95tRdYySA 4. Lists & Tuples: https://youtu.be/_zFI6ytHHdY 5. For Loops & While Loops: https://youtu.be/WPF5M_Ic6Fc Learn to Program a game: https://youtu.be/-8n91btt5d8",27,Education,PT19M46S,1186,2d,hd,FALSE,https://i.ytimg.com/vi/8TCtYbt7ARI/maxresdefault.jpg,1,17803,224,9,0,38
