position,channelId,channelTitle,videoId,publishedAt,publishedAtSQL,videoTitle,videoDescription,videoCategoryId,videoCategoryLabel,duration,durationSec,dimension,definition,caption,thumbnail_maxres,licensedContent,viewCount,likeCount,dislikeCount,favoriteCount,commentCount
1,UCq6XkhO5SZ66N04IcPbqNcw,Keith Galli,LEO4igyXbLs,2020-08-15T15:08:06Z,15/8/20 15:08,"How to Make a High Quality Tutorial Video! (workflow, camera equipment, and software tools)","In this video we look at how to make high quality instructional content on youtube and other platforms. We specifically look at a workflow to plan out, record, and then edit picture-in-picture tutorial videos. In addition, we overview some camera equipment that you can use as well as the screen recording & video editing software tools that I recommend. Thank you to Kylie Ying for providing some useful input for this video! :) Check out her channel: https://youtube.com/c/ycubed My equipment: - Sony a6500 Camera: https://amzn.to/3ieDe42 - Sigma 16mm Lens: https://amzn.to/2PAEXEv - Rode Videomicro Microphone: https://amzn.to/31APkxJ - Andycine Camera Monitor: https://amzn.to/2DVxrSf - Snagit for screen recording - Adobe Premiere Pro for video editing - Adobe Photoshop for thumbnails Kylie’s equipment: - iPhone 6 - Phone microphone (I think this one https://amzn.to/3aoCAOI) - Quicktime for screen recording - iMovie for editing - Photopea for thumbnails Video Editing Software: - Adobe Premiere Pro: https://www.adobe.com/products/premiere.html | what I use - Hitfilm Express (free): https://fxhome.com/hitfilm-express - Davinci Resolve (free): https://www.blackmagicdesign.com/products/davinciresolve/ - iMovie Thumbnail/Banner Editing Software: - Adobe Photoshop: https://www.adobe.com/products/photoshop.html | what I use - Photopea (free, browser-based): https://www.photopea.com/ Microphone options (USB connectivity): - Blue Snowball: https://amzn.to/2QhrH8h - Rode NT-USB (more expensive): https://amzn.to/3ha2b0f Screen Recording Software: - Snagit ($50 USD, Windows/Mac): https://www.techsmith.com/screen-capture.html | what I use - OBS: Open Broadcaster Studios (free, Windows/Mac/Linux): https://obsproject.com/ - Flashback Express (free, Windows): https://www.flashbackrecorder.com/express - Quicktime (free, Mac): https://blog.hubspot.com/marketing/how-to-record-your-screen - Xbox Windows 10 App (free, Windows): https://blog.hubspot.com/marketing/how-to-record-your-screen General strategy to record video: 1. Write out an outline you will follow for your tutorial 2. Implement reference code for project 3. Record tutorial in ~10 minute segments 4. Sync video/screen recording, cut out pauses, fix volume, add effects 5. Make professional thumbnail 6. Give video descriptive title that includes keywords users are looking for 7. Upload! --------------------- Video timeline! 0:00 - Intro & Video Overview 0:49 - Start with an outline! 1:20 - Planning your tutorial 2:16 - Filming your tutorial (camera equipment, screen recording software) 5:32 - Editing your tutorial (video editing software options, workflow) 9:50 - Final touches to your video (thumbnail, description, general tips) 13:10 - Conclusion & Channel Update --------------------- Follow me on social media! Instagram | https://www.instagram.com/keithgalli/ Twitter | https://twitter.com/keithgalli",27,Education,PT14M55S,895,2d,hd,FALSE,https://i.ytimg.com/vi/LEO4igyXbLs/maxresdefault.jpg,1,1302,103,2,0,36
2,UCq6XkhO5SZ66N04IcPbqNcw,Keith Galli,GjKQ6V_ViQE,2020-07-11T17:06:23Z,11/7/20 17:06,"Comprehensive Python Beautiful Soup Web Scraping Tutorial! (find/find_all, css select, scrape table)","In this video we walk through web scraping in Python using the beautiful soup library. We start with a brief introduction to HTML & CSS and discuss what web scraping is. Next we start getting into the basics of the beautiful soup library. This includes how to load a webpage, the basic commands you need to know such as find & find_all, grabbing strings from an HTML elements, etc. The final section of this tutorial is a series of exercises where you can practice your skills. In this section we scrape a webpage for links, we learn how to scrape a table and load it into a pandas dataframe, and we see how you can scrape & download a web image. Hope you enjoy! I’m looking into making future videos on more complex things you can do with web scraping as well as other libraries that are helpful such as Selenium & ScraPy. Subscribe to not miss those. --------------------- Resources used in this video Simple webpage: https://keithgalli.github.io/web-scraping/example.html Example webpage: https://keithgalli.github.io/web-scraping/webpage.html Link to source code: https://github.com/KeithGalli/web-scraping Beautiful Soup Documentation: https://www.crummy.com/software/BeautifulSoup/bs4/doc/ CSS Selector Reference: https://www.w3schools.com/cssref/css_selectors.asp --------------------- Learn more about HTML/CSS @Traversy Media HTML Crash Course: https://youtu.be/UB1O30fR-EE @Traversy Media CSS Crash Course: https://youtu.be/yfoY53QXEnI Codecademy: https://www.codecademy.com/catalog/language/html-css --------------------- Video timeline! 0:00 - Intro & Video Overview 1:09 - What is web scraping? 3:51 - Introduction to HTML Using the beautiful soup library (5:29) 6:31 - Loading in a webpage (requests library) 8:21 - Starting to scrape 9:18 - find & find_all methods 16:00 - Finding specific text/strings in our HTML (regex) 18:38 - Select method (CSS path selections) 25:55 - Grabbing the string/text from an HTML element 28:17 - Getting a property of HTML element (href, src, id, class, etc) 29:41 - Code navigation (parents, children, siblings) Let’s practice our skills! (33:57) 35:53 - Exercise #1: Grab all social links on webpage in 3 different ways 42:09 - Exercise #2: Scrape an HTML table into a Pandas Dataframe 53:09 - Exercise #3: Grab all fun facts that contain the word “is” 57:59 - Exercise #4: Use beautiful soup to help download an image from a webpage 1:04:20 - Exercise #5: Solve the mystery challenge!!! --------------------- Follow me on social media! Instagram | https://www.instagram.com/keithgalli/ Twitter | https://twitter.com/keithgalli",27,Education,PT1H13M3S,783,2d,hd,FALSE,https://i.ytimg.com/vi/GjKQ6V_ViQE/maxresdefault.jpg,1,11037,736,4,0,152
3,UCq6XkhO5SZ66N04IcPbqNcw,Keith Galli,44U8jJxaNp8,2020-06-08T15:03:23Z,8/6/20 15:03,Real-World Python Neural Nets Tutorial (Image Classification w/ CNN) | Tensorflow & Keras,"In this video we walk through the process of training a convolutional neural net to classify images of rock, paper, & scissors. We do this using the Tensorflow & Keras libraries. This is a follow-up to the first video I posted on neural networks. Introduction to Neural Nets: https://youtu.be/aBIGJeHRZLQ Link to my code (github): https://github.com/KeithGalli/neural-nets Link to Google Colab file: https://colab.research.google.com/drive/1MiRP2fwgGg6zfEnLuOZ_6X7lmeePTFaR?usp=sharing --------------------- Resources! Learn more about CNNs Good written overview: https://towardsdatascience.com/a-comprehensive-guide-to-convolutional-neural-networks-the-eli5-way-3bd2b1164a53 Good video overview (@CodeEmporium ): https://youtu.be/m8pOnJxOcqY Illustrated Examples of CNNs: https://towardsdatascience.com/illustrated-10-cnn-architectures-95d78ace614d MNIST Example: https://keras.io/examples/mnist_cnn/ Learn more about TensorFlow datasets https://www.tensorflow.org/datasets/overview https://www.tensorflow.org/datasets/catalog/overview Learn more about Kerastuner Documentation: https://keras-team.github.io/keras-tuner/ @sentdex : https://youtu.be/vvC15l4CY1Q @Krish Naik : https://youtu.be/OzLAdpqm35E --------------------- Video Timeline! 0:00 Video Overview 0:33 Getting Started (Setup & Installation) 2:24 Finding datasets to use 6:02 Data Preparation 10:26 Additional Data Prep (Convert data to NumPy format) 15:22 Reshape Data & Normalize values between 0-1 19:39 Train our first network to classify images 25:06 Convolutional Neural Net (CNN) approach 28:48 Using GPU on Google Colab (speed up training) 31:22 Improving our CNN (reduce image size, max pooling, dropout, etc) 40:18 Using Kerastuner to automatically pick best hyperparameters 52:50 Save & Load our models 54:16 Plot NumPy arrays as images 57:38 Convert JPG/PNG images to NumPy 1:00:20 Final thoughts --------------------- Follow me on social media! Instagram | https://www.instagram.com/keithgalli/ Twitter | https://twitter.com/keithgalli",27,Education,PT1H1M14S,74,2d,hd,FALSE,https://i.ytimg.com/vi/44U8jJxaNp8/maxresdefault.jpg,1,5625,291,1,0,51
4,UCq6XkhO5SZ66N04IcPbqNcw,Keith Galli,aBIGJeHRZLQ,2020-05-10T13:00:06Z,10/5/20 13:00,Introduction to Neural Networks in Python (what you need to know) | Tensorflow/Keras,"Download Kite! https://kite.com/download/?utm_medium=referral&utm_source=youtube&utm_campaign=keithgalli&utm_content=introduction-to-neural-networks-in-python In this video we start by walking through some of the basics. We look at why we use neural networks and how they function. We do an overview of network architecture (input layer, hidden layers, output layer). We talk a bit about how you choose how many hidden layers and neurons to have. We also look at hyperparameters like batch size, learning rate, optimizers (adam), activation functions (relu, sigmoid, softmax), and dropout. We finish the first section of the video talking a little about the differences between keras, tensorflow, & pytorch. Next, we jump into some coding examples to classify data with neural nets. In this section we load in data, do some processing, build our network, fit our data to it, and then finally evaluate our model. The examples get more complex as we go along. Some setup instructions for the coding portion of the video are found below. To install Tensorflow, download Anaconda: https://docs.anaconda.com/anaconda/install/ Data & code used in tutorial: https://github.com/KeithGalli/neural-nets I’m going to post a follow up video to this soon where we walk through a real world example where we automatically classify images of hands for the game of rock, paper, scissors. Hopefully that should be up about 2 weeks from now. (EDIT: part 2 has been posted, link below) If you enjoyed this video, make sure to like & subscribe. Feel free to leave any questions in the comments section. Part 2! https://youtu.be/44U8jJxaNp8 --------------------- Follow me on social media! Instagram | https://www.instagram.com/keithgalli/ Twitter | https://twitter.com/keithgalli –––––––––––––––––––––––––––––– Finally by Loxbeats https://soundcloud.com/loxbeats Creative Commons — Attribution 3.0 Unported — CC BY 3.0 Free Download: http://bit.ly/FinallyLoxbeats Music promoted by Audio Library https://youtu.be/fGquX0Te1Yo –––––––––––––––––––––––––––––– Video timeline! 0:00 Video overview 1:34 Why use neural networks 3:08 How neural nets work (architecture basics) 6:11 Hyperparameter overview (batch size, optimizer, dropout, learning rate, epochs) 7:53 How do we choose layers, neurons, & other parameters? 9:08 Why do we need an activation function? 10:20 What activation function should I use? 11:25 Keras vs Tensorflow vs PyTorch 12:30 Coding starts (github & setup) 14:07 Writing our first neural network (linear example) 18:45 Selecting optimizer & loss function (model.compile) 23:45 Fitting training data to our model (model.fit) 27:31 Shuffle order of training data 30:12 Evaluate model on test data (model.evaluate) 32:00 Example #2: Classifying quadratic data 36:06 Example #3: Classifying 6 clusters of data (try on your own) 41:03 Using network to predict a single data point (model.predict) 43:27 Example #4: Classifying multiple labels at a time (BinaryCrossentropy loss) 55:19 Example #5: Classifying our complex data from start of video 59:00 Conclusion & Next steps of learning neural nets",27,Education,PT1H37S,37,2d,hd,FALSE,https://i.ytimg.com/vi/aBIGJeHRZLQ/maxresdefault.jpg,1,9893,492,3,0,104
5,UCq6XkhO5SZ66N04IcPbqNcw,Keith Galli,V5_waf_9_rU,2020-04-07T00:00:35Z,7/4/20 0:00,Python Data Science Project Ideas! (for all skill levels),"In this video, we walk through eight project ideas to help you build up your data science skills. All of the resources mentioned in the video can be found here in the description. Covid-19 Analysis (2:16): - Johns Hopkins Data: https://github.com/CSSEGISandData/COVID-19/tree/master/csse_covid_19_data/csse_covid_19_time_series - Code that I wrote: https://github.com/KeithGalli/Data-Science-Project-Ideas/blob/master/Covid/Covid%20Analysis.ipynb - Kaggle: https://www.kaggle.com/covid19 - @sentdex kaggle video: https://youtu.be/S6GVXk6kbcs - @3Blue1Brown simulations video: https://youtu.be/gxAaO2rsdIs Board Game AI (3:16): - Overview video: https://youtu.be/y7AKtWGOPAE - Implementing minimax algorithm in python: https://youtu.be/MMLtza3CZFM - Reinforcement learning (Snake) tutorial: https://towardsdatascience.com/how-to-teach-an-ai-to-play-games-deep-reinforcement-learning-28f9b920440a - AlphaZero chess tutorial: https://towardsdatascience.com/create-ai-for-your-own-board-game-from-scratch-alpha-zero-part-3-f22761372245 - @DeepMind AlphaGo Documentary: https://youtu.be/WXuK6gekU1Y Reddit, Data is Beautiful (4:50): - Thread url: https://www.reddit.com/r/dataisbeautiful/ - Population changes chart: https://www.reddit.com/r/dataisbeautiful/comments/fr8q34/change_in_population_by_county_between_2010_and/ - S&P 500 recoveries chart: https://www.reddit.com/r/dataisbeautiful/comments/frzlbt/sp_500_recovers_during_major_crashes_oc/ Text Sentiment Analysis Tool (6:48): - My full tutorial (machine learning w/ sklearn): https://youtu.be/M9Itm95JzL0 - Learn about Transformers: http://jalammar.github.io/illustrated-transformer/ - BERT Paper: https://arxiv.org/pdf/1810.04805.pdf - Spacy NLP Library: https://explosion.ai/blog/spacy-transformers - YouTube API: https://developers.google.com/youtube/v3/quickstart/python Sports Analysis (8:34): - My script to webscrape sports data: https://github.com/KeithGalli/Data-Science-Project-Ideas/blob/master/Sports/extract_data.py - Basketball reference site that I scraped: https://www.basketball-reference.com/leagues/NBA_2020_per_game.html Stock Trading Bot (10:12): - Alpaca Site: https://alpaca.markets/ - Alpaca Tutorials: https://alpaca.markets/docs/get-started-with-alpaca/tutorial-videos/ - Quantopian (to learn more & backtest your trading strategies): https://www.quantopian.com/tutorials/getting-started House Pricing Prediction (12:02): - Link to competition: https://www.kaggle.com/c/house-prices-advanced-regression-techniques Miscellaneous Kaggle Projects (13:06): - Kaggle Data: https://www.kaggle.com/datasets - Airbnb Data: https://www.kaggle.com/dgomonov/new-york-city-airbnb-open-data - My real world data science tutorial: https://youtu.be/eMOA1pPVUc4 Hope you guys enjoyed this video! If you have any questions about any of these projects let me know in the comments. Like & Subscribe if you haven't already :). Some skills you should hopefully take away from these projects: - Analysis with Python Pandas Library - Visualization with Python Matplotlib Library - AI/Machine Learning skills with scikit learn library - Regression Techniques - Exploratory Data Analysis --------------------------------------------- Follow me on social media! Instagram | https://www.instagram.com/keithgalli/ Twitter | https://twitter.com/keithgalli --------------------------------------------- ~ Intro Music ~ Track: Sunflower — Soyb [Audio Library Release] Music provided by Audio Library Plus Watch: https://youtu.be/dG1U3NuR9Pk Free Download / Stream: https://alplus.io/sunflower",27,Education,PT15M45S,945,2d,hd,FALSE,https://i.ytimg.com/vi/V5_waf_9_rU/maxresdefault.jpg,1,21661,984,6,0,85
6,UCq6XkhO5SZ66N04IcPbqNcw,Keith Galli,731LoaZCUjo,2020-03-22T18:55:18Z,22/3/20 18:55,Professional Code Refactor! (Cleaning Python Code & Rewriting it to use Classes),"In this video we take the code from my “How to Program a Game (in Python)” tutorial and refactor it to be of a more professional quality. To do this we abstract out similar parts of the code into their own classes & files. Once the new code is written, we go through some examples of how we can extend its functionality in fun ways. We make a couple more difficult levels of the game which is made very easy by the new code architecture. The final product is a lot more similar to code you would write as a full time software developer at a company like Google, Facebook, etc… As always I left a video timeline in the comments! If you enjoy this video please consider giving it a like & subscribe for future content :). If you have any questions let me know in the comments! Follow the homies! https://www.instagram.com/shaneboyer_/ https://www.instagram.com/_neos/ Source code for Game (original & refactored): https://github.com/KeithGalli/Basic-Python-Game Link to original How to Program a Game (in Python) Tutorial: https://youtu.be/-8n91btt5d8 Link to video on Classes & Object Oriented Programming: https://youtu.be/tmY6FEF8f1o Additional information on Getters & Setters: https://youtu.be/jCzT9XFZ5bw Some great resources if you want to write better/cleaner code! https://www.python.org/dev/peps/pep-0008/ https://amzn.to/2U90SWk --------------------- Follow me on social media! Instagram | https://www.instagram.com/keithgalli/ Twitter | https://twitter.com/keithgalli --------------------- Video Timeline! (& some additional resources) 0:00 Video overview & code setup 3:04 Creating a Player Class 10:43 Creating subclasses for our Enemy & HumanPlayer 11:26 Creating a Color class 14:35 Creating a screen class or all our game visuals 27:00 Creating a game class for all our game logic 32:54 Information on Getters & Setters in Python 38:09 Bringing it all together in our main.py file! 43:36 Testing our code & Debugging issues 47:20 if _name_ == ""__main__"" information 48:26 Creating more difficult game levels using our new class structure! 54:00 Fixing the ""cheat"" where you can go off the screen 55:44 Loading in custom images as the enemy blocks",27,Education,PT1H2M30S,150,2d,hd,FALSE,https://i.ytimg.com/vi/731LoaZCUjo/maxresdefault.jpg,1,6183,201,3,0,44
7,UCq6XkhO5SZ66N04IcPbqNcw,Keith Galli,tmY6FEF8f1o,2020-02-29T17:01:00Z,29/2/20 17:01,Everything you need to know about Classes in Python! (Object Oriented Programming Tutorial),"Download Kite! https://kite.com/download/?utm_medium=referral&utm_source=youtube&utm_campaign=keithgalli&utm_content=everything-you-need-to-know-about-classes-in-python In this video we overview the main things I think are pointing when you are starting to learn about classes & integrate them in your everyday code. In this video we cover: - why should we use object oriented programming (oop) ? - the basics of defining a class in python (__init__) - class methods - what the heck is ""self""? - Inheritance & Subclassing - Operator overriding A timeline is in the comments. If there are topics you felt like I left out, let me know in the comments! I'll potentially make a follow up video to this one. For an example of me structuring my code with classes, check out this machine learning video:https://youtu.be/M9Itm95JzL0 If you want to practice using classes, try rewriting the game we build in this video to use them:https://youtu.be/-8n91btt5d8 ^(I'll update the github repo for that video with my solution to this soon) Resources: Github code: https://github.com/KeithGalli/python-classes-tutorial Operator overloading: https://www.geeksforgeeks.org/operator-overloading-in-python/ --------------------- Follow me on social media! Instagram | https://www.instagram.com/keithgalli/ Twitter | https://twitter.com/keithgalli --------------------- Today’s merch! Creator: @ChilledCow Website: https://teespring.com/stores/chilledcow-shop --------------------- Video timeline! 0:00 - Introduction 1:34 - Why use classes? 2:27 - Defining our first class in Python 6:05 - Class methods 13:53 - Passing in default keyword arguments (size of our polygons) 20:18 - Inheritance & subclassing (using the super() method) 24:43 - Class method overriding 26:06 - Plotting points with classes 28:09 - Operator overloading",27,Education,PT33M48S,2028,2d,hd,FALSE,https://i.ytimg.com/vi/tmY6FEF8f1o/maxresdefault.jpg,1,23654,1023,16,0,98
8,UCq6XkhO5SZ66N04IcPbqNcw,Keith Galli,VJBY2eVtf7o,2020-02-01T04:37:11Z,1/2/20 4:37,"Generating Mock Data with Python! (NumPy, Pandas, & Datetime Libraries)","In this video we write a python script to automatically generate a sales dataset. To do this we use the NumPy, Pandas, Calendar, & Datetime libraries. This is ultimately the data that we used in my last video “Solving real world data science problems with python pandas”. Link to the last video: https://youtu.be/vmEHCJofslg Link to finished code on GitHub: https://github.com/KeithGalli/Pandas-Data-Science-Tasks/tree/master/Misc Useful resources! NumPy Tutorial: https://youtu.be/GB9ByFAIAH4 Pandas Tutorial: https://youtu.be/vmEHCJofslg Datetime library documentation: https://docs.python.org/3/library/datetime.html Detailed video description! We start by creating a simple dataframe and programmatically adding rows of product purchases to it. We use the random library to select these products. We make our data more realistic by utilizing normal distributions and geometric distributions in numpy to spread out the number of purchases we make and the quantity of each item purchased. We use the datetime library to allow us to generate thousands of different times for each purchase with the most common times peaking around 12pm and 8pm. We take a list of the most common US street addresses to help us randomly generate addresses for each purchases. Hope you guys enjoy! Make sure to subscribe if you haven’t already :) --------------------------------------------- Follow me on social media! Instagram | https://www.instagram.com/keithgalli/ Twitter | https://twitter.com/keithgalli --------------------------------------------- Today’s merch! Creator: @Chris Chann Website: https://unsatisfied.co/ --------------------------------------------- Video Timeline! 0:00 - Intro & Background Info 1:15 - What we're creating in this video! 2:03 - Start writing code (generating a simple dataframe & csv) 8:26 - Task: Making our data more realistic, selecting some products with higher probability than others 14:15 - Task: Generate 12 months worth of data in 12 csvs (calendar library, f-strings) 18:12 - Make some months have more purchases than others 19:28 - Normal distributions in NumPy 23:43 - Improving speed of our code (making testing easier) 26:41 - Task: Generate random addresses for our data 35:03 - Task: Generate order times for purchases (datetime library overview) 40:02 - Using timedelta objects to add & subtract time from dates 45:09 - Generate a realistic quantity ordered for each product (using numpy geometric distribution) 49:38 - Add multiple items being more likely to be sold together and cleaning code a bit",27,Education,PT1H26S,26,2d,hd,FALSE,https://i.ytimg.com/vi/VJBY2eVtf7o/maxresdefault.jpg,1,7663,325,1,0,45
