position,channelId,channelTitle,videoId,publishedAt,publishedAtSQL,videoTitle,videoDescription,videoCategoryId,videoCategoryLabel,duration,durationSec,dimension,definition,caption,thumbnail_maxres,licensedContent,viewCount,likeCount,dislikeCount,favoriteCount,commentCount
21,UCq6XkhO5SZ66N04IcPbqNcw,Keith Galli,vmEHCJofslg,2018-10-26T00:10:07Z,26/10/18 0:10,"Complete Python Pandas Data Science Tutorial! (Reading CSV/Excel files, Sorting, Filtering, Groupby)","Data used in this Tutorial: https://github.com/KeithGalli/pandas Python Pandas Documentation: http://pandas.pydata.org/pandas-docs/stable/ Let me know if you have any questions! In this video we walk through many of the fundamental concepts to use the Python Pandas Data Science Library. We start off by installing pandas and loading in an example csv. We then look at different ways to read the data. Read a column, rows, specific cell, etc. Also ways to read data based on conditioning. We then move into some more advanced ways to sort & filter data. We look at making conditional changes to our data. We also start doing aggregate stats using the groupby function. We finished the video talking about how you would work with a very large dataset (many gigabytes) I realized as I upload this video there are some additional things I want to talk about in a later video. The first thing that comes to mind immediately is using the apply() function on a dataframe to alter the data using a custom or lambda function. If you have questions on this or anything else before I get around to making a part 2, feel free to write me a note in the comments. If you enjoyed this video, be sure to throw it a like and make sure to subscribe to not miss any future videos! Thanks for watching friends! Happy coding! :) --------------------------------------------- Follow me on social media! Instagram | https://www.instagram.com/keithgalli/ Twitter | https://twitter.com/keithgalli --------------------------------------------- Link to original source of data from Kaggle: https://www.kaggle.com/abcsds/pokemon --------------------------------------------- Video Outline! 0:00 - Why Pandas? 1:46 - Installing Pandas 2:03 - Getting the data used in this video 3:50 - Loading the data into Pandas (CSVs, Excel, TXTs, etc.) 8:49 - Reading Data (Getting Rows, Columns, Cells, Headers, etc.) 13:10 - Iterate through each Row 14:11 - Getting rows based on a specific condition 15:47 - High Level description of your data (min, max, mean, std dev, etc.) 16:24 - Sorting Values (Alphabetically, Numerically) 18:19 - Making Changes to the DataFrame 18:56 - Adding a column 21:22 - Deleting a column 22:14 - Summing Multiple Columns to Create new Column. 24:14 - Rearranging columns 28:06 - Saving our Data (CSV, Excel, TXT, etc.) 31:47 - Filtering Data (based on multiple conditions) 35:40 - Reset Index 37:41 - Regex Filtering (filter based on textual patterns) 43:08 - Conditional Changes 47:57 - Aggregate Statistics using Groupby (Sum, Mean, Counting) 54:53 - Working with large amounts of data (setting chunksize)",27,Education,PT1H27S,27,2d,hd,FALSE,https://i.ytimg.com/vi/vmEHCJofslg/maxresdefault.jpg,1,707250,17168,148,0,880
22,UCq6XkhO5SZ66N04IcPbqNcw,Keith Galli,3hcNFc-bw38,2018-09-16T16:35:52Z,16/9/18 16:35,Thank you 1000+ Subscribers! :) + channel update,Just a quick thank you for getting me past 1k subscribers as well as an update about me and my channel. Enjoy!,27,Education,PT6M38S,398,2d,hd,FALSE,https://i.ytimg.com/vi/3hcNFc-bw38/maxresdefault.jpg,1,604,42,0,0,12
23,UCq6XkhO5SZ66N04IcPbqNcw,Keith Galli,#NAME?,2018-08-18T14:10:57Z,18/8/18 14:10,How to Program a Conversation with Alexa (Python & AWS Lambda) - Part 2,"The second part in developing Alexa skills in Python. In this video we go through intent slots, debugging, and storing session attributes. You should be able to create the conversation that I had at the start of part 1 after this video. At the end I briefly mention how to get it set up on your physical device and installing external libraries. Source Code: https://github.com/KeithGalli/Alexa-Python Part 1: https://www.youtube.com/watch?v=sj7NqS7yytw&t=18s To use external libraries in AWS Lambda: What you need to do to fix this issue is install the library locally and then upload it in a zip folder to AWS lambda with your actual python file. These links will probably be helpful: https://stackoverflow.com/questions/40538730/how-to-install-pymysql-on-aws-lambda?rq=1 https://stackoverflow.com/questions/38877058/how-do-i-add-python-libraries-to-an-aws-lambda-function-for-alexa Let me know if you have any questions! If you enjoyed, make sure to LIKE and SUBSCRIBE :).",27,Education,PT30M49S,1849,2d,hd,FALSE,https://i.ytimg.com/vi/-MOvJ3eklr0/maxresdefault.jpg,1,7836,183,1,0,46
24,UCq6XkhO5SZ66N04IcPbqNcw,Keith Galli,SvxTrjvPrSY,2018-08-06T15:35:36Z,6/8/18 15:35,How to win at Othello: Corner & Edge Strategies,"In this video we go through some tips & tricks on improving your othello game. The specific focus of this video is how you can better play on and around the corners and edges to gain positional advantages. If you enjoy this video, make sure to throw it a like and SUBSCRIBE to not miss out on any future videos. Let me know what video I should make next. Also to anyone who is wondering when I'm going to make some more programming videos, those are next on the list! As of now plan to release two programming videos next weekend. Enjoy friends and hope you're having a good day :) Link to Stanford Paper on Othello AIs that I got the colorful board diagram from: https://web.stanford.edu/class/cs221/2017/restricted/p-final/man4/final.pdf",27,Education,PT10M3S,603,2d,hd,FALSE,https://i.ytimg.com/vi/SvxTrjvPrSY/maxresdefault.jpg,1,24924,261,11,0,22
25,UCq6XkhO5SZ66N04IcPbqNcw,Keith Galli,y7AKtWGOPAE,2018-07-14T21:29:59Z,14/7/18 21:29,"How does a Board Game AI Work? (Connect 4, Othello, Chess, Checkers) - Minimax Algorithm Explained","In this video I build up the intuition for how an expert level board game AI works. We start with a very simple approach of making random moves and then progress to building board scoring heuristics and then finally to the minimax algorithm. I will try to make a video on how to actually program this type of AI in python within the next few weeks. Make sure to subscribe to not miss that! As a bit of background, the minimax algorithm was the same basic algorithm used in IBM Deep Blue that defeated Chess Grandmaster Gary Kasparov in 1997. Link to my first video on how to program Connect 4 in Python: https://www.youtube.com/watch?v=UYgyRArKDEs&t=68s Read more about the Minimax Algorithm: https://en.wikipedia.org/wiki/Minimax https://en.wikipedia.org/wiki/Alpha%E2%80%93beta_pruning https://en.wikipedia.org/wiki/Monte_Carlo_tree_search Link to Stanford Paper on Othello AIs that I got some diagrams from: https://web.stanford.edu/class/cs221/2017/restricted/p-final/man4/final.pdf Link to Medium Article on Programming a Chess AI: https://medium.freecodecamp.org/simple-chess-ai-step-by-step-1d55a9266977 Thank you guys for supporting my channel! Make sure to through this video a thumbs up and also subscribe! :) Leave me a comment on what my next video should be on!",27,Education,PT18M50S,1130,2d,hd,FALSE,https://i.ytimg.com/vi/y7AKtWGOPAE/maxresdefault.jpg,1,25364,627,9,0,23
26,UCq6XkhO5SZ66N04IcPbqNcw,Keith Galli,sj7NqS7yytw,2018-05-10T23:08:31Z,10/5/18 23:08,How to Program a Conversation with Alexa! (Python & AWS Lambda) - Part 1,In this video we will walk through getting Alexa to say whatever you want! We will use Python and AWS lambda. Specifically we will walk through setup and how the code is structured. We will program a custom welcome message and then using intents build a simple application that gives us compliments! Part 2 will focus on more complex back and forth interactions. It will cover the easiest way to debug your Alexa application. It will also cover session attributes and using intent slots. Part 2: https://youtu.be/-MOvJ3eklr0 Source Code: https://github.com/KeithGalli/Alexa-Python Alexa Skills Kit: https://developer.amazon.com/alexa-skills-kit AWS Lambda: https://aws.amazon.com/lambda/,27,Education,PT27M6S,1626,2d,hd,FALSE,https://i.ytimg.com/vi/sj7NqS7yytw/maxresdefault.jpg,1,35433,677,16,0,94
27,UCq6XkhO5SZ66N04IcPbqNcw,Keith Galli,-8n91btt5d8,2018-03-15T16:05:54Z,15/3/18 16:05,How to Program a Game! (in Python),"In this video we walk through building a simple game using the python programming language. This is a great exercise to apply your python skills in a fun way. We use the pygame library in this video. A video outline will be posted in the comment section. If you want to review any of the topics covered in this video, there are links below to all of my python tutorial videos. If you are curious about implementing additional features to this game, leave a comment down below! Make sure to SUBSCRIBE if you enjoyed this video, it encourages me to keep making them. Have fun with your games!!! :) Source code! https://github.com/KeithGalli/Basic-Python-Game --------------------------------------------- PYTHON TUTORIAL SERIES: Setup & Installation: https://youtu.be/RJL6Y761TNE 1. Math & Variables: https://youtu.be/XM0CtrJYM2A 2. Conditional Statements (if, elif, else): https://youtu.be/vsVGPcfxEiA 3. Functions: https://youtu.be/5U95tRdYySA 4. Lists & Tuples: https://youtu.be/_zFI6ytHHdY 5. For Loops & While Loops: https://youtu.be/WPF5M_Ic6Fc --------------------------------------------- Follow me on social media! Instagram | https://www.instagram.com/keithgalli/ Twitter | https://twitter.com/keithgalli 🙂",27,Education,PT1H10M7S,607,2d,hd,FALSE,https://i.ytimg.com/vi/-8n91btt5d8/maxresdefault.jpg,1,300579,5843,125,0,1060
28,UCq6XkhO5SZ66N04IcPbqNcw,Keith Galli,WPF5M_Ic6Fc,2018-03-14T21:45:42Z,14/3/18 21:45,For Loops & While Loops in Python - Beginner Python Tutorial #5 (with Exercises),"Fifth video in my python tutorial series. In this video we cover the two different types of loops, for & while loops. Loops allow you to repeatedly execute blocks of code. For loops work great for a set number of iterations as well as iterating through lists. While loops work well with booleans (true or false). If you have any questions, leave a comment down below! Feel free to watch on 1.25x or 1.5x speed. SUBSCRIBE if you enjoyed this video!! More tutorials to be uploaded real soon. ~~~~~~~~~~~~~~~~~~~~~~~~~~~~~~~~~~~~~~~ PYTHON TUTORIAL SERIES: Setup & Installation: https://youtu.be/RJL6Y761TNE 1. Math & Variables: https://youtu.be/XM0CtrJYM2A 2. Conditional Statements (if, elif, else): https://youtu.be/vsVGPcfxEiA 3. Functions: https://youtu.be/5U95tRdYySA 4. Lists & Tuples: https://youtu.be/_zFI6ytHHdY 5. For Loops & While Loops: https://youtu.be/WPF5M_Ic6Fc Learn to Program a game (mentioned at the start of this video): https://youtu.be/-8n91btt5d8",27,Education,PT31M25S,1885,2d,hd,FALSE,https://i.ytimg.com/vi/WPF5M_Ic6Fc/maxresdefault.jpg,1,12807,325,2,0,35
29,UCq6XkhO5SZ66N04IcPbqNcw,Keith Galli,_zFI6ytHHdY,2018-03-07T15:44:41Z,7/3/18 15:44,Lists & Tuples in Python - Beginner Python Tutorial #4,"In this video, we go over two data structures in python, lists and tuples. Lists are a mutable structure. This means that you can dynamically change the size and contents of the list. We have several different functions to do this. I cover in this video append, pop, remove, insert, and a few others. Tuples, on the other hand, are an immutable data type. This means that once you create a tuple object, that tuple object and those values inside do not change. When you make changes to a tuple you'll actually be creating a new tuple. Indexing works the same in lists and tuples. Leave a comment and let me know how python is going for you guys and girls! SUBSCRIBE to not miss any future tutorials Link to list/tuple documentation: https://docs.python.org/3/tutorial/datastructures.html if you have any questions about anything covered, leave a comment down below. ~~~~~~~~~~~~~~~~~~~~~~~~~~~~~~~~~~~~~~ PYTHON TUTORIAL SERIES: Why Learn Python? +Setup: https://youtu.be/RJL6Y761TNE 1. Math & Variables: https://youtu.be/XM0CtrJYM2A 2. Conditional Statements (if, elif, else): https://youtu.be/vsVGPcfxEiA 3. Functions: https://youtu.be/5U95tRdYySA 4. Lists & Tuples: https://youtu.be/_zFI6ytHHdY 5. For Loops & While Loops: https://youtu.be/WPF5M_Ic6Fc Learn to Program a game: https://youtu.be/-8n91btt5d8",27,Education,PT37M51S,2271,2d,hd,FALSE,https://i.ytimg.com/vi/_zFI6ytHHdY/maxresdefault.jpg,1,9199,394,2,0,92
30,UCq6XkhO5SZ66N04IcPbqNcw,Keith Galli,HWfUv9CPX50,2018-03-05T20:01:44Z,5/3/18 20:01,Winning at Connect 4 for an Hour Straight!,"In this video I play connect 4 for an hour and attempt to win every game. So much fun! If you have any questions about anything covered in this video, or you just want to roast me, let me know in the comments! Thanks for watching :) Let me know what I should make next! Trying to make more board game videos as well as programming videos as soon as possible. SUBSCRIBE for future videos! Help me get to 1,000 Link to site I was playing on: c4arena.com",20,Gaming,PT1H19S,19,2d,hd,FALSE,https://i.ytimg.com/vi/HWfUv9CPX50/maxresdefault.jpg,1,11622,241,14,0,57
31,UCq6XkhO5SZ66N04IcPbqNcw,Keith Galli,5U95tRdYySA,2018-03-03T15:12:54Z,3/3/18 15:12,Functions in Python - Beginner Python Tutorial #3 (with Exercises),"Third tutorial in my python programming series. In this video we first go over the challenge problem from last video on conditional statements. After that we go over the important concept of functions in programming. We practice writing functions over a variety of different exercises. If you want to learn quicker watch on 1.25x or 1.5x speed! If you have any questions, please leave a comment and I'll do my best to get back to you quickly :) Link to coding bat website where you can find exercises: http://www.codingbat.com/python Link to my code featured in this video: https://github.com/KeithGalli/Python-Tutorial-3 Thanks for watching! Make sure to SUBSCBRIBE to not miss any future videos. ~~~~~~~~~~~~~~~~~~~~~~~~~~~~~~~~~~~~~~ PYTHON TUTORIAL SERIES: Why Learn Python? +Setup: https://youtu.be/RJL6Y761TNE 1. Math & Variables: https://youtu.be/XM0CtrJYM2A 2. Conditional Statements (if, elif, else): https://youtu.be/vsVGPcfxEiA 3. Functions: https://youtu.be/5U95tRdYySA 4. Lists & Tuples: https://youtu.be/_zFI6ytHHdY 5. For Loops & While Loops: https://youtu.be/WPF5M_Ic6Fc Learn to Program a game: https://youtu.be/-8n91btt5d8",27,Education,PT27M1S,1621,2d,hd,FALSE,https://i.ytimg.com/vi/5U95tRdYySA/maxresdefault.jpg,1,14581,598,9,0,39
32,UCq6XkhO5SZ66N04IcPbqNcw,Keith Galli,vsVGPcfxEiA,2018-03-01T14:30:01Z,1/3/18 14:30,"Conditional Statements (if, elif, else) in Python - Beginner Python Tutorial #2","Second video in my python tutorial series. In this video we go over everything related to conditional statements in python. If you have any questions feel free to comment down below :) Python Command Cheat sheet: https://www.cheatography.com/paul-benn/cheat-sheets/python-3-beginner-s-reference/ Link to previous video: https://www.youtube.com/watch?v=XM0CtrJYM2A&t=108s Don't forget to SUBSCRIBE to not miss any future tutorials! ~~~~~~~~~~~~~~~~~~~~~~~~~~~~~~~~~~~~~~ Challenge problem I asked at the end of the video: Write a set of conditional statements to find whether or not a number is a “special” number Special numbers are defined as numbers less than 100 or greater than or equal to 300 that are perfectly divisible by 3, 7, or both # Print out “Divisble by both” if special number divisible by both 3 & 7 # Print out “Divisble by 3” if special number divisible by 3, but not 7 # Print out “Divisible by 7” if special number divisible by 7, but not 3 #Print out “Not a special number” otherwise ~~~~~~~~~~~~~~~~~~~~~~~~~~~~~~~~~~~~~~~~~ PYTHON TUTORIAL SERIES: Why Learn Python? +Setup: https://youtu.be/RJL6Y761TNE 1. Math & Variables: https://youtu.be/XM0CtrJYM2A 2. Conditional Statements (if, elif, else): https://youtu.be/vsVGPcfxEiA 3. Functions: https://youtu.be/5U95tRdYySA 4. Lists & Tuples: https://youtu.be/_zFI6ytHHdY 5. For Loops & While Loops: https://youtu.be/WPF5M_Ic6Fc Learn to Program a game: https://youtu.be/-8n91btt5d8",27,Education,PT31M41S,1901,2d,hd,FALSE,https://i.ytimg.com/vi/vsVGPcfxEiA/maxresdefault.jpg,1,16816,566,3,0,92
33,UCq6XkhO5SZ66N04IcPbqNcw,Keith Galli,pxKu2pQ7ILo,2018-02-16T19:23:50Z,16/2/18 19:23,Complete Python Turtle Graphics Overview! (From Beginner to Advanced),"In this video I walk through the Turtle Graphics library of Python. This is a perfect video for people just starting out programming to visualize their work. If you have any questions about this video, leave a comment down below! Feel free to watch on 1.25x or 1.5x speed to learn faster! Link to Turtle Documentation: https://docs.python.org/3.3/library/turtle.html Source Code for this video! https://github.com/KeithGalli/Turtle-Python First video in my Python Programming series: https://www.youtube.com/watch?v=XM0CtrJYM2A&t=511s I will be uploading tutorial videos weekly, so don't forget to SUBSCRIBE to not miss anything :) --------------------------------------------- Follow me on social media! Instagram | https://www.instagram.com/keithgalli/ Twitter | https://twitter.com/keithgalli 🙂",27,Education,PT39M29S,2369,2d,hd,FALSE,https://i.ytimg.com/vi/pxKu2pQ7ILo/maxresdefault.jpg,1,262111,4230,146,0,464
34,UCq6XkhO5SZ66N04IcPbqNcw,Keith Galli,XM0CtrJYM2A,2018-02-14T23:52:54Z,14/2/18 23:52,Math & Variables in Python - Beginner Python Tutorial #1,"First real tutorial in my python programming series. This is a perfect series for beginners of programming This covers how to do math in python as well as the concept of variables. Watch on 1.25x or 1.5x speed to learn faster! Python Turtle Tutorial Video: https://www.youtube.com/watch?v=pxKu2pQ7ILo&t=1439s ***Will post mentioned cheat sheet soon! I will be posting tutorial videos every week so make sure to SUBSCRIBE to not miss any of those. If you have any questions/problems feel free to leave a comment down below :) ~~~~~~~~~~~~~~~~~~~~~~~~~~~~~~~~~~~~~~ PYTHON TUTORIAL SERIES: Why Learn Python? +Setup/Installation: https://youtu.be/RJL6Y761TNE 1. Math & Variables: https://youtu.be/XM0CtrJYM2A 2. Conditional Statements (if, elif, else): https://youtu.be/vsVGPcfxEiA 3. Functions: https://youtu.be/5U95tRdYySA 4. Lists & Tuples: https://youtu.be/_zFI6ytHHdY 5. For Loops & While Loops: https://youtu.be/WPF5M_Ic6Fc Learn to Program a game: https://youtu.be/-8n91btt5d8",27,Education,PT18M27S,1107,2d,hd,FALSE,https://i.ytimg.com/vi/XM0CtrJYM2A/maxresdefault.jpg,1,26299,869,8,0,55
35,UCq6XkhO5SZ66N04IcPbqNcw,Keith Galli,RJL6Y761TNE,2018-02-14T04:30:37Z,14/2/18 4:30,"Why Should you Learn Python? - Simple Installation & Setup for Windows, Mac, & Linux!","Quick video on why you should learn to program in python followed by setup instructions for a python development environment using python 3 and sublime text 3. Video outline in comments. Watch on 1.25x or 1.5x speed to learn faster! Code Snippet for Sublime Text 3 (Mac, Linux): { ""cmd"": [""python3"", ""-i"", ""-u"", ""$file""], ""file_regex"": ""^[ ]File \""(...?)\"", line ([0-9]*)"", ""selector"": ""source.python"" } I will be posting tutorial videos every week so make sure to SUBSCRIBE to not miss any of those. If you have any questions leave a comment down below :) ~~~~~~~~~~~~~~~~~~~~~~~~~~~~~~~~~~~~~ PYTHON TUTORIAL SERIES: 1. Math & Variables: https://youtu.be/XM0CtrJYM2A 2. Conditional Statements (if, elif, else): https://youtu.be/vsVGPcfxEiA 3. Functions: https://youtu.be/5U95tRdYySA 4. Lists & Tuples: https://youtu.be/_zFI6ytHHdY 5. For Loops & While Loops: https://youtu.be/WPF5M_Ic6Fc Learn to Program a game: https://youtu.be/-8n91btt5d8",27,Education,PT10M1S,601,2d,hd,FALSE,https://i.ytimg.com/vi/RJL6Y761TNE/maxresdefault.jpg,1,36299,793,12,0,153
36,UCq6XkhO5SZ66N04IcPbqNcw,Keith Galli,YqqcNjQMX18,2017-12-22T21:46:59Z,22/12/17 21:46,The Best Strategy to Win at Connect 4! (Odd Even Strategy),"An overview of what I consider the best connect 4 strategy. It works by strategically positioning yourself to win on an odd row if you are the first player to make a move and an even row if you are the second player to go. If you have questions on this video, feel free to leave me a comment! Good luck beating all your friends in connect 4! :)",27,Education,PT6M1S,361,2d,hd,FALSE,https://i.ytimg.com/vi/YqqcNjQMX18/maxresdefault.jpg,1,115476,1399,63,0,119
37,UCq6XkhO5SZ66N04IcPbqNcw,Keith Galli,krCKxcrHeN4,2017-12-11T21:23:06Z,11/12/17 21:23,How to Program Connect 4 in Python! (part 4) - Game Animation & Additional Features,"In this video we finish up our connect 4 graphics and add a couple additional features. If you've enjoyed this series, please consider subscribing to my channel :). Also AI video is out! Link below Link to video on programming the AI: https://youtu.be/MMLtza3CZFM Link to video on how a connect 4 AI works: https://youtu.be/y7AKtWGOPAE Source code: https://github.com/KeithGalli/Connect4-Python Previous Video: https://www.youtube.com/watch?v=SDz3P_Ctm7U&t=56s Link to Pygame Documentation: https://www.pygame.org/docs/ ~~~~~~~~~~~~~~~~~~~~~~~~~~~~~~~~~~~~ PYTHON TUTORIAL SERIES: Why Learn Python? +Setup: https://youtu.be/RJL6Y761TNE 1. Math & Variables: https://youtu.be/XM0CtrJYM2A 2. Conditional Statements (if, elif, else): https://youtu.be/vsVGPcfxEiA 3. Functions: https://youtu.be/5U95tRdYySA 4. Lists & Tuples: https://youtu.be/_zFI6ytHHdY 5. For Loops & While Loops: https://youtu.be/WPF5M_Ic6Fc Learn to Program a game: https://youtu.be/-8n91btt5d8",27,Education,PT20M24S,1224,2d,hd,FALSE,https://i.ytimg.com/vi/krCKxcrHeN4/maxresdefault.jpg,1,12642,240,5,0,77
38,UCq6XkhO5SZ66N04IcPbqNcw,Keith Galli,SDz3P_Ctm7U,2017-12-07T20:52:40Z,7/12/17 20:52,How to Program Connect 4 in Python! (part 3) - Background Graphics,"In this video we actually start implementing the graphics in pygame for our connect 4 program. If you are curious about how to implement additional features, leave a comment! Next Video: https://youtu.be/krCKxcrHeN4 Previous Video: https://www.youtube.com/watch?v=zD-Xuu_Jpe4 Link to Pygame Documentation: https://www.pygame.org/docs/ Full Game Source Code: https://github.com/KeithGalli/Connect4-Python ~~~~~~~~~~~~~~~~~~~~~~~~~~~~~~~~~~~~~~~~~ PYTHON TUTORIAL SERIES: Why Learn Python? +Setup: https://youtu.be/RJL6Y761TNE 1. Math & Variables: https://youtu.be/XM0CtrJYM2A 2. Conditional Statements (if, elif, else): https://youtu.be/vsVGPcfxEiA 3. Functions: https://youtu.be/5U95tRdYySA 4. Lists & Tuples: https://youtu.be/_zFI6ytHHdY 5. For Loops & While Loops: https://youtu.be/WPF5M_Ic6Fc Learn to Program a game: https://youtu.be/-8n91btt5d8",27,Education,PT15M32S,932,2d,hd,FALSE,https://i.ytimg.com/vi/SDz3P_Ctm7U/maxresdefault.jpg,1,12818,116,1,0,19
39,UCq6XkhO5SZ66N04IcPbqNcw,Keith Galli,zD-Xuu_Jpe4,2017-12-06T18:47:47Z,6/12/17 18:47,How to Program Connect 4 in Python! (part 2) - Check for Winning Move,"In this video we finish the command line version of our connect four game. We implement a way to check for a four in a row and talk a little bit about good design practices. Next Video: https://youtu.be/SDz3P_Ctm7U Previous Video (First Part): https://www.youtube.com/watch?v=UYgyRArKDEs Full Game Source Code: https://github.com/KeithGalli/Connect4-Python ~~~~~~~~~~~~~~~~~~~~~~~~~~~~~~~~~~ PYTHON TUTORIAL SERIES: Why Learn Python? +Setup: https://youtu.be/RJL6Y761TNE 1. Math & Variables: https://youtu.be/XM0CtrJYM2A 2. Conditional Statements (if, elif, else): https://youtu.be/vsVGPcfxEiA 3. Functions: https://youtu.be/5U95tRdYySA 4. Lists & Tuples: https://youtu.be/_zFI6ytHHdY 5. For Loops & While Loops: https://youtu.be/WPF5M_Ic6Fc Learn to Program a game: https://youtu.be/-8n91btt5d8",27,Education,PT14M4S,844,2d,hd,FALSE,https://i.ytimg.com/vi/zD-Xuu_Jpe4/maxresdefault.jpg,1,19944,161,5,0,19
40,UCq6XkhO5SZ66N04IcPbqNcw,Keith Galli,UYgyRArKDEs,2017-12-06T06:03:34Z,6/12/17 6:03,How to Program Connect 4 in Python! (part 1) - Basic Structure & Game Loop,"This is the first part of a few part series on how to program connect 4 in python 3 and pygame. In this video I show you how to store the board state, and build a simple command line interface for dropping pieces. The next video will show you how to write a function to check for wins. Then after that the final video will build graphics for your game. Part 2: https://www.youtube.com/watch?v=zD-Xuu_Jpe4&t=325s Full Game Source Code: https://github.com/KeithGalli/Connect4-Python INSTALLATION LINKS: Link to setup Python 3 and Sublime text: https://www.youtube.com/watch?v=2nQNsrhaMpA Link to setup SublimeREPL: https://packagecontrol.io/packages/SublimeREPL ~~~~~~~~~~~~~~~~~~~~~~~~~~~~~~~~~~ PYTHON TUTORIAL SERIES: Why Learn Python? +Setup: https://youtu.be/RJL6Y761TNE 1. Math & Variables: https://youtu.be/XM0CtrJYM2A 2. Conditional Statements (if, elif, else): https://youtu.be/vsVGPcfxEiA 3. Functions: https://youtu.be/5U95tRdYySA 4. Lists & Tuples: https://youtu.be/_zFI6ytHHdY 5. For Loops & While Loops: https://youtu.be/WPF5M_Ic6Fc Learn to Program a game: https://youtu.be/-8n91btt5d8",27,Education,PT18M15S,1095,2d,hd,FALSE,https://i.ytimg.com/vi/UYgyRArKDEs/maxresdefault.jpg,1,60381,513,7,0,67
41,UCq6XkhO5SZ66N04IcPbqNcw,Keith Galli,XISUTn9EeoY,2017-10-16T18:46:13Z,16/10/17 18:46,Quickest Ways to Win at Connect 4!,"In this video I take you through two quick ways to win at connect 4 when you have the first move in the game! Please leave comments if you have feedback on this video or if you want to play a game against me :) If you haven't seen my original connect 4 strategy video, make sure you check it out: https://www.youtube.com/watch?v=3R1Cx6uGjMw&t=190s",27,Education,PT6M20S,380,2d,hd,FALSE,https://i.ytimg.com/vi/XISUTn9EeoY/maxresdefault.jpg,1,324466,2897,253,0,188
