position	channelId	channelTitle	videoId	publishedAt	publishedAtSQL	videoTitle	videoDescription	videoCategoryId	videoCategoryLabel	duration	durationSec	dimension	definition	caption	thumbnail_maxres	licensedContent	viewCount	likeCount	dislikeCount	favoriteCount	commentCount
55	UCJ4D3tL-iEWyJJDXJAsd9Mw	DataScience.LA	YmHyAHkjX_A	2014-08-11T17:20:52Z	2014-08-11 17:20:52	Max Kuhn Interviewed by DataScience.LA at useR	Data Scientist, Author ("Applied Predictive Modeling" with Kjell Johnson) and R caret package developer Max Kuhn sits down for an in-depth interview with Eduardo Arino de la Rubia. They discuss the art and science of Predictive Modeling in the real world, the multifaceted R caret package, the pluses and perils of programming in R and much more. All materials were filmed as part of useR! 2014 at UCLA, supervised by David L McArthur PhD MPH within the guidelines of UCLA Policy 863 Section D.	28	Science & Technology	PT25M16S	1516	2d	hd	false	https://i.ytimg.com/vi/YmHyAHkjX_A/maxresdefault.jpg		8399	118	1	0	1
56	UCJ4D3tL-iEWyJJDXJAsd9Mw	DataScience.LA	_hcpuRB5nGs	2014-08-07T17:40:12Z	2014-08-07 17:40:12	John Chambers - Invited Talks - useR! 2014 Conference	Creator of the "S" Programming Language and a core member of the R Programming Language project, John Chambers talks about R's past, present and future while discussing "Interfaces, Efficiency and Big Data".	28	Science & Technology	PT43M21S	2601	2d	sd	false	https://i.ytimg.com/vi/_hcpuRB5nGs/maxresdefault.jpg		3875	21	0	0	1
57	UCJ4D3tL-iEWyJJDXJAsd9Mw	DataScience.LA	JxwxefRAu70	2014-08-07T17:39:53Z	2014-08-07 17:39:53	Hadley Wickham Interviewed by DataScience.LA at useR	RStudio's Chief Scientist Hadley Wickman interviewed by DataScience.LA's Eduardo Arino de la Rubia. Enjoy and learn from a robust conversation about RStudio, dplyr, ggplot2, R programming / packages, and the future of R and data science. All materials were filmed as part of useR! 2014 at UCLA, supervised by David L McArthur PhD MPH within the guidelines of UCLA Policy 863 Section D.	28	Science & Technology	PT33M4S	1984	2d	hd	false	https://i.ytimg.com/vi/JxwxefRAu70/maxresdefault.jpg		17295	202	1	0	11
58	UCJ4D3tL-iEWyJJDXJAsd9Mw	DataScience.LA	XU5KNweaJEQ	2014-07-13T23:53:10Z	2014-07-13 23:53:10	What is Your Quest? Interviews at the useR Poster Sessions	Tim asks several poster presenters at the annual R conference the hard questions in life. Why do they use R? How does R aid their career goals? And lastly, trivial questions a king should always know... Abstracts of R packages discussed (in chronological order) -------------------------------- R. Scott Hacker's "Hansel" (Deducer plug-in for econometrics) http://user2014.stat.ucla.edu/abstracts/posters/134_Hacker.pdf Yasuto Nakano's "DDIR" (DDI environment for R data) http://user2014.stat.ucla.edu/abstracts/posters/127_Nakano.pdf Jo-Fai Chow's "CrimeMap" (interactive Javascript spatial mapping) http://user2014.stat.ucla.edu/abstracts/posters/24_Chow.pdf Tim Hesterberg's "Resample" (teaching tool for statistics) http://user2014.stat.ucla.edu/abstracts/posters/22_Hesterberg.pdf Jimmy Oh's "WeBIPP" (interactive tool for data-based graphics) http://user2014.stat.ucla.edu/abstracts/posters/63_Oh.pdf Ari Lamstein's "choroplethr" (datavis maps for spatial/census data) http://user2014.stat.ucla.edu/abstracts/posters/33_Lamstein.pdf Website: datascience.la Twitter @wwwDSLA Created/Edited by @timothy_phan	28	Science & Technology	PT3M39S	219	2d	hd	false	https://i.ytimg.com/vi/XU5KNweaJEQ/maxresdefault.jpg		225	5	0	0	0
59	UCJ4D3tL-iEWyJJDXJAsd9Mw	DataScience.LA	U4h5u8zOZGs	2014-06-17T07:53:07Z	2014-06-17 07:53:07	Data Science: Methods and Tools - by Szilard Pafka	Data Science: Methods and Tools by Szilard Pafka Big Data Camp LA June 2014	28	Science & Technology	PT35M55S	2155	2d	sd	false			4701	41	3	0	1
