position	channelId	channelTitle	videoId	publishedAt	publishedAtSQL	videoTitle	videoDescription	videoCategoryId	videoCategoryLabel	duration	durationSec	dimension	definition	caption	thumbnail_maxres	licensedContent	viewCount	likeCount	dislikeCount	favoriteCount	commentCount
159	UCh9nVJoWXmFb7sLApWGcLPQ	codebasics	iedmZlFxjfA	2017-12-06T02:26:50Z	2017-12-06 02:26:50	Matplotlib Tutorial 4 - Bar Chart	This matplotlib tutorial covers how to plot bar chart, set xticks, plot multiple variables in bar chart, barh to plot horizontal bar charts. Topics that are covered in this Video: 0:50 bar() function 2:12 xticks() function 7:08 barh()function Code link: https://github.com/codebasics/py/blob/master/matpltlib/4_bar_chart/4_bar_chart.ipynb Next Video: Matplotlib Tutorial 5 - Histograms: https://www.youtube.com/watch?v=r75BPh1uk38&list=PLeo1K3hjS3uu4Lr8_kro2AqaO6CFYgKOl&index=5 Populor Playlist: Data Science Full Course: https://www.youtube.com/playlist?list=PLeo1K3hjS3us_ELKYSj_Fth2tIEkdKXvV Data Science Project: https://www.youtube.com/watch?v=rdfbcdP75KI&list=PLeo1K3hjS3uu7clOTtwsp94PcHbzqpAdg Machine learning tutorials: https://www.youtube.com/watch?v=gmvvaobm7eQ&list=PLeo1K3hjS3uvCeTYTeyfe0-rN5r8zn9rw Pandas: https://www.youtube.com/watch?v=CmorAWRsCAw&list=PLeo1K3hjS3uuASpe-1LjfG5f14Bnozjwy matplotlib: https://www.youtube.com/watch?v=qqwf4Vuj8oM&list=PLeo1K3hjS3uu4Lr8_kro2AqaO6CFYgKOl Python: https://www.youtube.com/watch?v=eykoKxsYtow&list=PLeo1K3hjS3usILfyvQlvUBokXkHPSve6S Jupyter Notebook: https://www.youtube.com/watch?v=q_BzsPxwLOE&list=PLeo1K3hjS3uuZPwzACannnFSn9qHn8to8 Website: http://codebasicshub.com/ Facebook: https://www.facebook.com/codebasicshub Twitter: https://twitter.com/codebasicshub	27	Education	PT8M45S	525	2d	hd	false	https://i.ytimg.com/vi/iedmZlFxjfA/maxresdefault.jpg	1	46262	483	17	0	54
160	UCh9nVJoWXmFb7sLApWGcLPQ	codebasics	oETDriX9n1w	2017-12-03T17:50:11Z	2017-12-03 17:50:11	Matplotlib Tutorial 3 - Axes labels, Legend, Grid	This matplotlib tutorial covers how to show axes labels, legend and grid on a 2D plot. Topics that are covered in this Video: 1:50 Set axes lable in Matplotlib xlable(), ylable() and title() 2:25 Create Legend Code link: https://github.com/codebasics/py/blob/master/matpltlib/3_legends_grid_axes_labels/3_legends_grid_axes_labels.ipynb Populor Playlist: Data Science Full Course: https://www.youtube.com/playlist?list=PLeo1K3hjS3us_ELKYSj_Fth2tIEkdKXvV Data Science Project: https://www.youtube.com/watch?v=rdfbcdP75KI&list=PLeo1K3hjS3uu7clOTtwsp94PcHbzqpAdg Machine learning tutorials: https://www.youtube.com/watch?v=gmvvaobm7eQ&list=PLeo1K3hjS3uvCeTYTeyfe0-rN5r8zn9rw Pandas: https://www.youtube.com/watch?v=CmorAWRsCAw&list=PLeo1K3hjS3uuASpe-1LjfG5f14Bnozjwy matplotlib: https://www.youtube.com/watch?v=qqwf4Vuj8oM&list=PLeo1K3hjS3uu4Lr8_kro2AqaO6CFYgKOl Python: https://www.youtube.com/watch?v=eykoKxsYtow&list=PLeo1K3hjS3usILfyvQlvUBokXkHPSve6S Jupyter Notebook: https://www.youtube.com/watch?v=q_BzsPxwLOE&list=PLeo1K3hjS3uuZPwzACannnFSn9qHn8to8 Next Video: Matplotlib Tutorial 4 - Bar Chart: https://www.youtube.com/watch?v=iedmZlFxjfA&list=PLeo1K3hjS3uu4Lr8_kro2AqaO6CFYgKOl&index=4 Website: http://codebasicshub.com/ Facebook: https://www.facebook.com/codebasicshub Twitter: https://twitter.com/codebasicshub	27	Education	PT6M58S	418	2d	hd	false	https://i.ytimg.com/vi/oETDriX9n1w/maxresdefault.jpg	1	38225	359	14	0	34
161	UCh9nVJoWXmFb7sLApWGcLPQ	codebasics	zl5qPnqps8M	2017-12-03T15:00:52Z	2017-12-03 15:00:52	Matplotlib Tutorial 2 - format strings in plot function	This tutorial covers how you can use format string in plot function to control visual aspects of your plot such as color, marker, markersize, alpha etc. One can use keyword arguments to individually specify these properties if you dont like using format strings. Topics that are covered in this Video: 1:40 Documentation for plot function formate string 3:10 Individual arguments for plot 4:42 alpha property of plot API code link: https://github.com/codebasics/py/blob/master/matpltlib/2_format_strings/2_matplotlib_format_strings.ipynb Populor Playlist: Data Science Full Course: https://www.youtube.com/playlist?list=PLeo1K3hjS3us_ELKYSj_Fth2tIEkdKXvV Data Science Project: https://www.youtube.com/watch?v=rdfbcdP75KI&list=PLeo1K3hjS3uu7clOTtwsp94PcHbzqpAdg Machine learning tutorials: https://www.youtube.com/watch?v=gmvvaobm7eQ&list=PLeo1K3hjS3uvCeTYTeyfe0-rN5r8zn9rw Pandas: https://www.youtube.com/watch?v=CmorAWRsCAw&list=PLeo1K3hjS3uuASpe-1LjfG5f14Bnozjwy matplotlib: https://www.youtube.com/watch?v=qqwf4Vuj8oM&list=PLeo1K3hjS3uu4Lr8_kro2AqaO6CFYgKOl Python: https://www.youtube.com/watch?v=eykoKxsYtow&list=PLeo1K3hjS3usILfyvQlvUBokXkHPSve6S Jupyter Notebook: https://www.youtube.com/watch?v=q_BzsPxwLOE&list=PLeo1K3hjS3uuZPwzACannnFSn9qHn8to8 Next Video: Matplotlib Tutorial 3 - Axes labels, Legend, Grid: https://www.youtube.com/watch?v=oETDriX9n1w&list=PLeo1K3hjS3uu4Lr8_kro2AqaO6CFYgKOl&index=3 Website: http://codebasicshub.com/ Facebook: https://www.facebook.com/codebasicshub Twitter: https://twitter.com/codebasicshub	27	Education	PT6M18S	378	2d	hd	false	https://i.ytimg.com/vi/zl5qPnqps8M/maxresdefault.jpg	1	25352	270	2	0	27
162	UCh9nVJoWXmFb7sLApWGcLPQ	codebasics	qqwf4Vuj8oM	2017-12-02T23:46:18Z	2017-12-02 23:46:18	Matplotlib Tutorial 1 - Introduction and Installation	notebook used in this tutorial: https://github.com/codebasics/py/blob/master/matpltlib/1_intro/1_matplotlib_introduction.ipynb Matplotlib is a 2d plotting library used for data visualization in python. This tutorial will cover installation and basic line chart plot Topics that are covered in this Video: 0:06 What is Matplotlib? 0:45 Why we need data visualization? 1:45 Install Matplotlib 4:20 API for plot Next Video: Matplotlib Tutorial 2 - format strings in plot function: https://www.youtube.com/watch?v=zl5qPnqps8M&list=PLeo1K3hjS3uu4Lr8_kro2AqaO6CFYgKOl&index=2 Populor Playlist: Data Science Full Course: https://www.youtube.com/playlist?list=PLeo1K3hjS3us_ELKYSj_Fth2tIEkdKXvV Data Science Project: https://www.youtube.com/watch?v=rdfbcdP75KI&list=PLeo1K3hjS3uu7clOTtwsp94PcHbzqpAdg Machine learning tutorials: https://www.youtube.com/watch?v=gmvvaobm7eQ&list=PLeo1K3hjS3uvCeTYTeyfe0-rN5r8zn9rw Pandas: https://www.youtube.com/watch?v=CmorAWRsCAw&list=PLeo1K3hjS3uuASpe-1LjfG5f14Bnozjwy matplotlib: https://www.youtube.com/watch?v=qqwf4Vuj8oM&list=PLeo1K3hjS3uu4Lr8_kro2AqaO6CFYgKOl Python: https://www.youtube.com/watch?v=eykoKxsYtow&list=PLeo1K3hjS3usILfyvQlvUBokXkHPSve6S Jupyter Notebook: https://www.youtube.com/watch?v=q_BzsPxwLOE&list=PLeo1K3hjS3uuZPwzACannnFSn9qHn8to8 Website: http://codebasicshub.com/ Facebook: https://www.facebook.com/codebasicshub Twitter: https://twitter.com/codebasicshub	27	Education	PT6M59S	419	2d	hd	false	https://i.ytimg.com/vi/qqwf4Vuj8oM/maxresdefault.jpg		52415	425	3	0	38
163	UCh9nVJoWXmFb7sLApWGcLPQ	codebasics	XawR6CjAYV4	2017-12-02T16:01:57Z	2017-12-02 16:01:57	numpy tutorial: iterate numpy array using nditer	nditer can be used to iterate through numpy array in variety of ways. C style and F style iteration is possible using flags in nditer. You can also iterate two broadcastable arrays concurrently using nditer Topics that are covered in this Python Video: 0:41 Run for loop 1:16 Use flatten() function on for loop 1:41 numpy function nditer() function 3:34 supply flags on for loop 4:04 op_flag on for loop 6:09 iterate two arrays https://github.com/codebasics/py/blob/master/numpy/nditer.ipynb Website: http://codebasicshub.com/ Facebook: https://www.facebook.com/codebasicshub Twitter: https://twitter.com/codebasicshub	27	Education	PT8M32S	512	2d	hd	false	https://i.ytimg.com/vi/XawR6CjAYV4/maxresdefault.jpg	1	30925	489	7	0	39
164	UCh9nVJoWXmFb7sLApWGcLPQ	codebasics	0lsmdNLNorY	2017-09-03T02:37:05Z	2017-09-03 02:37:05	Pandas Time Series Analysis 6: Shifting and Lagging	Shifting and lagging is used to shift or lag the values in a time series back and forward in time. shift and tshift methods can be called on datadframe and timeseries both to either shift values or datetimes. Topics that are covered in this Python Pandas Video: 0:20 Use shift() function 7:03 Use tshift() function https://github.com/codebasics/py/blob/master/pandas/20_shift_lag/pandas_shift_lag.ipynb To download csv and code for all tutorials: go to https://github.com/codebasics/py, click on a green button to clone or download the entire repository and then go to relevant folder to get access to that specific file. Popular Playlist: Complete python course: https://www.youtube.com/playlist?list=PLeo1K3hjS3usILfyvQlvUBokXkHPSve6S Data science course: https://www.youtube.com/playlist?list=PLeo1K3hjS3us_ELKYSj_Fth2tIEkdKXvV Machine learning tutorials: https://www.youtube.com/playlist?list=PLeo1K3hjS3uvCeTYTeyfe0-rN5r8zn9rw Pandas tutorials: https://www.youtube.com/playlist?list=PLeo1K3hjS3uuASpe-1LjfG5f14Bnozjwy Git github tutorials: https://www.youtube.com/playlist?list=PLeo1K3hjS3usJuxZZUBdjAcilgfQHkRzW Matplotlib course: https://www.youtube.com/playlist?list=PLeo1K3hjS3uu4Lr8_kro2AqaO6CFYgKOl Data structures course: https://www.youtube.com/playlist?list=PLeo1K3hjS3uu_n_a__MI_KktGTLYopZ12 Website: http://codebasicshub.com/ Facebook: https://www.facebook.com/codebasicshub Twitter: https://twitter.com/codebasicshub	27	Education	PT7M51S	471	2d	hd	false	https://i.ytimg.com/vi/0lsmdNLNorY/maxresdefault.jpg	1	29702	357	6	0	30
165	UCh9nVJoWXmFb7sLApWGcLPQ	codebasics	9IW2GIJajLs	2017-08-27T13:51:16Z	2017-08-27 13:51:16	Pandas Time Series Analysis 6: Timezone Handling	Timezone handling is important while doing time series analysis. Pandas provides a way to create timezone aware datetimeIndex. Use tz_localize on dataframe or dataframe index to convert naive datetimes to timezone aware datetimes. You can also perform arithmetic between series having different time zones. Topics that are covered in this Python Pandas Video: 1:42 Time objects in python 1:57 Convert Naive timezone to time zone aware datetime using tz_localize() 4:00 Use tz_convert() function 7:04 How you can use timezone in date_range() function 8:30 Use dateutil time zone Code: https://github.com/codebasics/py/blob/master/pandas/19_ts_timezone/pandas_timezone_handling.ipynb To download csv and code for all tutorials: go to https://github.com/codebasics/py, click on a green button to clone or download the entire repository and then go to relevant folder to get access to that specific file. Next Video: Pandas Time Series Analysis 6: Shifting and Lagging: https://www.youtube.com/watch?v=0lsmdNLNorY&list=PLeo1K3hjS3uvMADnFjV1yg6E5nVU4kOob&index=7 Popular Playlist: Complete python course: https://www.youtube.com/playlist?list=PLeo1K3hjS3usILfyvQlvUBokXkHPSve6S Data science course: https://www.youtube.com/playlist?list=PLeo1K3hjS3us_ELKYSj_Fth2tIEkdKXvV Machine learning tutorials: https://www.youtube.com/playlist?list=PLeo1K3hjS3uvCeTYTeyfe0-rN5r8zn9rw Pandas tutorials: https://www.youtube.com/playlist?list=PLeo1K3hjS3uuASpe-1LjfG5f14Bnozjwy Git github tutorials: https://www.youtube.com/playlist?list=PLeo1K3hjS3usJuxZZUBdjAcilgfQHkRzW Matplotlib course: https://www.youtube.com/playlist?list=PLeo1K3hjS3uu4Lr8_kro2AqaO6CFYgKOl Data structures course: https://www.youtube.com/playlist?list=PLeo1K3hjS3uu_n_a__MI_KktGTLYopZ12 Website: http://codebasicshub.com/ Facebook: https://www.facebook.com/codebasicshub Twitter: https://twitter.com/codebasicshub	27	Education	PT13M5S	785	2d	hd	false	https://i.ytimg.com/vi/9IW2GIJajLs/maxresdefault.jpg	1	16693	159	3	0	11
166	UCh9nVJoWXmFb7sLApWGcLPQ	codebasics	3l9YOS4y24Y	2017-08-14T10:58:19Z	2017-08-14 10:58:19	Pandas Time Series Analysis 5: Period and PeriodIndex	This tutorial continues pandas time series analysis by introducing period and periodIndex. Periods are time duration used to represent many concepts in finance. Pandas provide rich support for period airthmetic. You can create quarterly, yearly, annual etc. periods and perform airthmetic on them. period_range can be used to create periodIndex between specified start and end. Topics that are covered in this Python Pandas Video: 0:04 What is time stamp? 0:30 What is time span? 1:09 Use period() function 2:45 Arithmetic operations on period objects 6:02 Create quarterly time period 8:28 Use asfreq() function 10:05 List of all frequency 10:38 Create periodindex 14:40 Convert periodindex to datetimeindex 15:12 Convert datetimeindex to periodindex 17:22 Use set_index() function 18:15 Convert index to periodindex using PeriodIndex() 18:59 Create new columns in dataframe Code used in this tutorial: https://github.com/codebasics/py/blob/master/pandas/18_ts_period/pandas_ts_period.ipynb To download csv and code for all tutorials: go to https://github.com/codebasics/py, click on a green button to clone or download the entire repository and then go to relevant folder to get access to that specific file. Next Video: Pandas Time Series Analysis 6: Timezone Handling: https://www.youtube.com/watch?v=9IW2GIJajLs&list=PLeo1K3hjS3uvMADnFjV1yg6E5nVU4kOob&index=6 Popular Playlist: Complete python course: https://www.youtube.com/playlist?list=PLeo1K3hjS3usILfyvQlvUBokXkHPSve6S Data science course: https://www.youtube.com/playlist?list=PLeo1K3hjS3us_ELKYSj_Fth2tIEkdKXvV Machine learning tutorials: https://www.youtube.com/playlist?list=PLeo1K3hjS3uvCeTYTeyfe0-rN5r8zn9rw Pandas tutorials: https://www.youtube.com/playlist?list=PLeo1K3hjS3uuASpe-1LjfG5f14Bnozjwy Git github tutorials: https://www.youtube.com/playlist?list=PLeo1K3hjS3usJuxZZUBdjAcilgfQHkRzW Matplotlib course: https://www.youtube.com/playlist?list=PLeo1K3hjS3uu4Lr8_kro2AqaO6CFYgKOl Data structures course: https://www.youtube.com/playlist?list=PLeo1K3hjS3uu_n_a__MI_KktGTLYopZ12 Website: http://codebasicshub.com/ Facebook: https://www.facebook.com/codebasicshub Twitter: https://twitter.com/codebasicshub	27	Education	PT21M38S	1298	2d	hd	false	https://i.ytimg.com/vi/3l9YOS4y24Y/maxresdefault.jpg	1	25118	258	2	0	33
167	UCh9nVJoWXmFb7sLApWGcLPQ	codebasics	igWjq3jtLYI	2017-08-01T10:17:33Z	2017-08-01 10:17:33	Pandas Time Series Analysis 4: to_datetime	Time series analysis is very important in financial data analysis space. Pandas has in built support of time series functionality that makes analyzing time serieses extremely easy and efficient. In this tutorial we will go over to_datetime function that can convert date time string into datetime object or DatetimeIndex. We will also see how to handle invalid datetime strings, different dateformats etc. Topics that are covered in this Python Pandas Video: 0:58 Use to_datetime() function 2:16 Handle europe dates in to_datetime() function 2:31 Use own custom format in to_datetime() function 3:32 Handle error and garbage strings in to_datetime() function 4:54 Handle epoch format in to_datetime() function Code: https://github.com/codebasics/py/blob/master/pandas/17_ts_to_date_time/pandas_ts_to_date_time.ipynb To download csv and code for all tutorials: go to https://github.com/codebasics/py, click on a green button to clone or download the entire repository and then go to relevant folder to get access to that specific file. Next Video: Pandas Time Series Analysis 5: Period and PeriodIndex: https://www.youtube.com/watch?v=3l9YOS4y24Y&list=PLeo1K3hjS3uvMADnFjV1yg6E5nVU4kOob&index=5 Popular Playlist: Complete python course: https://www.youtube.com/playlist?list=PLeo1K3hjS3usILfyvQlvUBokXkHPSve6S Data science course: https://www.youtube.com/playlist?list=PLeo1K3hjS3us_ELKYSj_Fth2tIEkdKXvV Machine learning tutorials: https://www.youtube.com/playlist?list=PLeo1K3hjS3uvCeTYTeyfe0-rN5r8zn9rw Pandas tutorials: https://www.youtube.com/playlist?list=PLeo1K3hjS3uuASpe-1LjfG5f14Bnozjwy Git github tutorials: https://www.youtube.com/playlist?list=PLeo1K3hjS3usJuxZZUBdjAcilgfQHkRzW Matplotlib course: https://www.youtube.com/playlist?list=PLeo1K3hjS3uu4Lr8_kro2AqaO6CFYgKOl Data structures course: https://www.youtube.com/playlist?list=PLeo1K3hjS3uu_n_a__MI_KktGTLYopZ12 Website: http://codebasicshub.com/ Facebook: https://www.facebook.com/codebasicshub Twitter: https://twitter.com/codebasicshub	27	Education	PT7M24S	444	2d	hd	false	https://i.ytimg.com/vi/igWjq3jtLYI/maxresdefault.jpg	1	30049	282	9	0	23
168	UCh9nVJoWXmFb7sLApWGcLPQ	codebasics	Fo0IMzfcnQE	2017-07-29T15:17:44Z	2017-07-29 15:17:44	Pandas Time Series Analysis 3: Holidays	Time series analysis is very important in financial data analysis space. Pandas has in built support of time series functionality that makes analyzing time serieses extremely easy and efficient. In this tutorial we will cover how to handle holidays in time series analysis. Using CustomBusinessDay and AbstractHolidayCalendar you can create custom holiday calendar. USFederalHolidayCalendar is ready made calendar available in pandas library that serves as an example for those who want to create their own custom calendar. Topics that are covered in this Python Pandas Video: 2:12 Import USFederalHolidayCalendar classes 4:00 How to create own custom calendar in pandas? 8:11 Use observance argument in custom calendar 10:10 Weekmask argument in CustomBusinessDay() Code used in this tutorial: https://github.com/codebasics/py/tree/master/pandas/16_ts_holidays To download csv and code for all tutorials: go to https://github.com/codebasics/py, click on a green button to clone or download the entire repository and then go to relevant folder to get access to that specific file. Next Video: Pandas Time Series Analysis 4: to_datetime: https://www.youtube.com/watch?v=igWjq3jtLYI&list=PLeo1K3hjS3uvMADnFjV1yg6E5nVU4kOob&index=4 Popular Playlist: Complete python course: https://www.youtube.com/playlist?list=PLeo1K3hjS3usILfyvQlvUBokXkHPSve6S Data science course: https://www.youtube.com/playlist?list=PLeo1K3hjS3us_ELKYSj_Fth2tIEkdKXvV Machine learning tutorials: https://www.youtube.com/playlist?list=PLeo1K3hjS3uvCeTYTeyfe0-rN5r8zn9rw Pandas tutorials: https://www.youtube.com/playlist?list=PLeo1K3hjS3uuASpe-1LjfG5f14Bnozjwy Git github tutorials: https://www.youtube.com/playlist?list=PLeo1K3hjS3usJuxZZUBdjAcilgfQHkRzW Matplotlib course: https://www.youtube.com/playlist?list=PLeo1K3hjS3uu4Lr8_kro2AqaO6CFYgKOl Data structures course: https://www.youtube.com/playlist?list=PLeo1K3hjS3uu_n_a__MI_KktGTLYopZ12 Website: http://codebasicshub.com/ Facebook: https://www.facebook.com/codebasicshub Twitter: https://twitter.com/codebasicshub	27	Education	PT14M24S	864	2d	hd	false	https://i.ytimg.com/vi/Fo0IMzfcnQE/maxresdefault.jpg	1	28300	325	0	0	39
169	UCh9nVJoWXmFb7sLApWGcLPQ	codebasics	A9c7hGXQ5A8	2017-07-22T14:00:12Z	2017-07-22 14:00:12	Pandas Time Series Analysis Part 2: date_range	Time series analysis is crucial in financial data analysis space. Pandas has in built support of time series functionality that makes analyzing time series extremely efficient. In this tutorial, we will see how date_range function allows to generate datetimeindex with specific start and end dates. It can also generate periods with different frequencies such as hourly,daily,monthly, weekly etc. We will then cover how asfreq function can be used to resample dataframe to a different frequency. Topics that are covered in this Python Pandas Video: 0:15 Download apple stock prices 2:09 Call date_range() function with arguments 3:24 Use set_index() function of dataframe 4:12 Plot a chart using matplotlib inline 4:56 How to get partial dataframe 5:36 Use asfreq() function 8:03 List of frequencies in date_range() function 10:36 Use randint() function Code used in this tutorial: https://github.com/codebasics/py/tree/master/pandas/15_ts_date_range To download csv and code for all tutorials: go to https://github.com/codebasics/py, click on a green button to clone or download the entire repository and then go to relevant folder to get access to that specific file. Next Video: Pandas Time Series Analysis 3: Holidays: https://www.youtube.com/watch?v=Fo0IMzfcnQE&list=PLeo1K3hjS3uvMADnFjV1yg6E5nVU4kOob&index=3 Popular Playlist: Complete python course: https://www.youtube.com/playlist?list=PLeo1K3hjS3usILfyvQlvUBokXkHPSve6S Data science course: https://www.youtube.com/playlist?list=PLeo1K3hjS3us_ELKYSj_Fth2tIEkdKXvV Machine learning tutorials: https://www.youtube.com/playlist?list=PLeo1K3hjS3uvCeTYTeyfe0-rN5r8zn9rw Pandas tutorials: https://www.youtube.com/playlist?list=PLeo1K3hjS3uuASpe-1LjfG5f14Bnozjwy Git github tutorials: https://www.youtube.com/playlist?list=PLeo1K3hjS3usJuxZZUBdjAcilgfQHkRzW Matplotlib course: https://www.youtube.com/playlist?list=PLeo1K3hjS3uu4Lr8_kro2AqaO6CFYgKOl Data structures course: https://www.youtube.com/playlist?list=PLeo1K3hjS3uu_n_a__MI_KktGTLYopZ12 Website: http://codebasicshub.com/ Facebook: https://www.facebook.com/codebasicshub Twitter: https://twitter.com/codebasicshub	27	Education	PT13M46S	826	2d	hd	false	https://i.ytimg.com/vi/A9c7hGXQ5A8/maxresdefault.jpg	1	43443	492	9	0	40
170	UCh9nVJoWXmFb7sLApWGcLPQ	codebasics	r0s4slGHwzE	2017-07-15T17:25:39Z	2017-07-15 17:25:39	Pandas Time Series Analysis Part 1: DatetimeIndex and Resample	Time series analysis is crucial in financial data analysis space. Pandas has in built support of time series functionality that makes analyzing time serieses extremely efficient. In this tutorial we are going to start time series analysis tutorials with DatetimeIndex and Resample functionality. Topics that are covered in this Python Pandas Video: 0:06 What is time series? 1:35 DatetimeIndex 5:10 Benefits of DatetimeIndex 7:05 Use plot() function for the create chart code: https://github.com/codebasics/py/tree/master/pandas/14_ts_datetimeindex To download csv and code for all tutorials: go to https://github.com/codebasics/py, click on a green button to clone or download the entire repository and then go to relevant folder to get access to that specific file. Next Video: Pandas Time Series Analysis Part 2: date_range: https://www.youtube.com/watch?v=A9c7hGXQ5A8&list=PLeo1K3hjS3uvMADnFjV1yg6E5nVU4kOob&index=2 Popular Playlist: Complete python course: https://www.youtube.com/playlist?list=PLeo1K3hjS3usILfyvQlvUBokXkHPSve6S Data science course: https://www.youtube.com/playlist?list=PLeo1K3hjS3us_ELKYSj_Fth2tIEkdKXvV Machine learning tutorials: https://www.youtube.com/playlist?list=PLeo1K3hjS3uvCeTYTeyfe0-rN5r8zn9rw Pandas tutorials: https://www.youtube.com/playlist?list=PLeo1K3hjS3uuASpe-1LjfG5f14Bnozjwy Git github tutorials: https://www.youtube.com/playlist?list=PLeo1K3hjS3usJuxZZUBdjAcilgfQHkRzW Matplotlib course: https://www.youtube.com/playlist?list=PLeo1K3hjS3uu4Lr8_kro2AqaO6CFYgKOl Data structures course: https://www.youtube.com/playlist?list=PLeo1K3hjS3uu_n_a__MI_KktGTLYopZ12 Website: http://codebasicshub.com/ Facebook: https://www.facebook.com/codebasicshub Twitter: https://twitter.com/codebasicshub	27	Education	PT10M24S	624	2d	hd	false	https://i.ytimg.com/vi/r0s4slGHwzE/maxresdefault.jpg	1	96299	1305	15	0	106
171	UCh9nVJoWXmFb7sLApWGcLPQ	codebasics	I_kUj-MfYys	2017-07-06T11:16:58Z	2017-07-06 11:16:58	Python Pandas Tutorial 13. Crosstab	Crosstab (also known as contingency table or cross tabulation) is a table showing frequency distribution of one variable in rows and another on columns. pandas crosstab method can be used to generate these contingency tables that are extremely useful in survey and business analytics. Topics that are covered in this Python Pandas Video: 0:05 What is crosstab (contingency table)? 1:52 create contingency table with method crosstab() 5:04 Open documentation in jupyter notebook code: https://github.com/codebasics/py/blob/master/pandas/13_crosstab/pandas_crosstab.ipynb To download csv and code for all tutorials: go to https://github.com/codebasics/py, click on a green button to clone or download the entire repository and then go to relevant folder to get access to that specific file. Next Video: Python Pandas Tutorial 14: Read Write Data From Database (read_sql, to_sql): https://www.youtube.com/watch?v=M-4EpNdlSuY&list=PLeo1K3hjS3uuASpe-1LjfG5f14Bnozjwy&index=14 Popular Playlist: Complete python course: https://www.youtube.com/playlist?list=PLeo1K3hjS3usILfyvQlvUBokXkHPSve6S Data science course: https://www.youtube.com/playlist?list=PLeo1K3hjS3us_ELKYSj_Fth2tIEkdKXvV Machine learning tutorials: https://www.youtube.com/playlist?list=PLeo1K3hjS3uvCeTYTeyfe0-rN5r8zn9rw Pandas tutorials: https://www.youtube.com/playlist?list=PLeo1K3hjS3uuASpe-1LjfG5f14Bnozjwy Git github tutorials: https://www.youtube.com/playlist?list=PLeo1K3hjS3usJuxZZUBdjAcilgfQHkRzW Matplotlib course: https://www.youtube.com/playlist?list=PLeo1K3hjS3uu4Lr8_kro2AqaO6CFYgKOl Data structures course: https://www.youtube.com/playlist?list=PLeo1K3hjS3uu_n_a__MI_KktGTLYopZ12 Website: http://codebasicshub.com/ Facebook: https://www.facebook.com/codebasicshub Twitter: https://twitter.com/codebasicshub	27	Education	PT9M35S	575	2d	hd	false	https://i.ytimg.com/vi/I_kUj-MfYys/maxresdefault.jpg	1	47368	790	4	0	31
