position	channelId	channelTitle	videoId	publishedAt	publishedAtSQL	videoTitle	videoDescription	videoCategoryId	videoCategoryLabel	duration	durationSec	dimension	definition	caption	thumbnail_maxres	licensedContent	viewCount	likeCount	dislikeCount	favoriteCount	commentCount
109	UCh9nVJoWXmFb7sLApWGcLPQ	codebasics	qEyEijUDOCA	2019-05-27T17:07:05Z	2019-05-27 17:07:05	Deep Learning Tutorial With Python, Tensorflow & Keras - Neural Network For Image Classification	Learn to build first neural network in keras and python using keras fashion mnist datasset. We will learn keras sequential model and how to add Flatten and Dense layers into it for image classification problem. In the end we have an exercise for you to solve. #DeepLearningTutorial #Tensorflow #Keras https://github.com/codebasics/py/blob/master/DeepLearningML/1_keras_fashion_mnist_neural_net/1_keras_fashion_mnist.ipynb Next Video: 3. Deep Learning Tutorial (Tensorflow2.0, Keras & Python) - Movie Review Classification: https://www.youtube.com/watch?v=xU-ZQSxtGaA&list=PLeo1K3hjS3uvCeTYTeyfe0-rN5r8zn9rw&index=17 Populor Playlist: Data Science Full Course: https://www.youtube.com/playlist?list=PLeo1K3hjS3us_ELKYSj_Fth2tIEkdKXvV Data Science Project: https://www.youtube.com/watch?v=rdfbcdP75KI&list=PLeo1K3hjS3uu7clOTtwsp94PcHbzqpAdg Machine learning tutorials: https://www.youtube.com/watch?v=gmvvaobm7eQ&list=PLeo1K3hjS3uvCeTYTeyfe0-rN5r8zn9rw Pandas: https://www.youtube.com/watch?v=CmorAWRsCAw&list=PLeo1K3hjS3uuASpe-1LjfG5f14Bnozjwy matplotlib: https://www.youtube.com/watch?v=qqwf4Vuj8oM&list=PLeo1K3hjS3uu4Lr8_kro2AqaO6CFYgKOl Python: https://www.youtube.com/watch?v=eykoKxsYtow&list=PLeo1K3hjS3usILfyvQlvUBokXkHPSve6S Jupyter Notebook: https://www.youtube.com/watch?v=q_BzsPxwLOE&list=PLeo1K3hjS3uuZPwzACannnFSn9qHn8to8 Website: http://codebasicshub.com/ Facebook: https://www.facebook.com/codebasicshub Twitter: https://twitter.com/codebasicshub Patreon: https://www.patreon.com/codebasics	27	Education	PT16M19S	979	2d	hd	false	https://i.ytimg.com/vi/qEyEijUDOCA/maxresdefault.jpg	1	36449	537	15	0	210
110	UCh9nVJoWXmFb7sLApWGcLPQ	codebasics	oPa20mUgJi8	2019-05-21T23:10:16Z	2019-05-21 23:10:16	Deep Learning Tutorial Python, Tensorflow And Keras: Introduction and Installation	In this introductory tutorial we will clarify what deep learning and neural networks is. We will also see what python keras library is and instructions on installing it on your computer. This is the first part in our deep learning tutorial series with keras. #DeepLearningTutorial #Tensorflow #Keras Next Video: Deep Learning Tutorial With Python, Tensorflow & Keras - Neural Network For Image Classification: https://www.youtube.com/watch?v=qEyEijUDOCA&list=PLeo1K3hjS3uvCeTYTeyfe0-rN5r8zn9rw&index=16 Populor Playlist: Data Science Full Course: https://www.youtube.com/playlist?list=PLeo1K3hjS3us_ELKYSj_Fth2tIEkdKXvV Data Science Project: https://www.youtube.com/watch?v=rdfbcdP75KI&list=PLeo1K3hjS3uu7clOTtwsp94PcHbzqpAdg Machine learning tutorials: https://www.youtube.com/watch?v=gmvvaobm7eQ&list=PLeo1K3hjS3uvCeTYTeyfe0-rN5r8zn9rw Pandas: https://www.youtube.com/watch?v=CmorAWRsCAw&list=PLeo1K3hjS3uuASpe-1LjfG5f14Bnozjwy matplotlib: https://www.youtube.com/watch?v=qqwf4Vuj8oM&list=PLeo1K3hjS3uu4Lr8_kro2AqaO6CFYgKOl Python: https://www.youtube.com/watch?v=eykoKxsYtow&list=PLeo1K3hjS3usILfyvQlvUBokXkHPSve6S Jupyter Notebook: https://www.youtube.com/watch?v=q_BzsPxwLOE&list=PLeo1K3hjS3uuZPwzACannnFSn9qHn8to8 Website: http://codebasicshub.com/ Facebook: https://www.facebook.com/codebasicshub Twitter: https://twitter.com/codebasicshub Patreon: https://www.patreon.com/codebasics	27	Education	PT6M24S	384	2d	hd	false	https://i.ytimg.com/vi/oPa20mUgJi8/maxresdefault.jpg	1	22899	385	12	0	66
111	UCh9nVJoWXmFb7sLApWGcLPQ	codebasics	zyib_6XZW0g	2019-05-10T04:11:26Z	2019-05-10 04:11:26	Drinking Raw Goat Milk In India	I'm on a trip to India and here I've had some unique experiences including drinking raw (non pasteurized) goat milk. It has several health benefits. It restores gut flora and creates a balance between good and bad bacteria. Drinking this milk was suggested as a remedy for my chronic health condition and I wanted to try it out while I am in my village. My village's name is Narsanda in the state of gujarat, India. This is where I was born and raised, my family still lives here. Website: http://codebasicshub.com/ Facebook: https://www.facebook.com/codebasicshub Twitter: https://twitter.com/codebasicshub Patreon: https://www.patreon.com/codebasics	27	Education	PT8M57S	537	2d	hd	false	https://i.ytimg.com/vi/zyib_6XZW0g/maxresdefault.jpg		4889	93	4	0	67
112	UCh9nVJoWXmFb7sLApWGcLPQ	codebasics	3ykIpmAxdoY	2019-05-08T04:51:06Z	2019-05-08 04:51:06	9. For loop [Python 3 Programming Tutorials]	The topic which I will explain to you today is about “for statement” also known as “loop statement”, “for” loop, “while statement”, how to create “for” loop, why “for” loop is used. Topics that are covered in this Video: 2:55 Create a for loop (Syntax of for loop) 6:53 Why for loop is used? 7:02 Use of range() function 18:51 While statement Visit http://codebasicshub.com/tutorial/pyt... to download answers on exercises. Next Video: 10. Functions [Python 3 Programming Tutorials]: https://www.youtube.com/watch?v=fz_BCnhEQYQ&list=PLeo1K3hjS3uv5U-Lmlnucd7gqF-3ehIh0&index=11 Website: http://codebasicshub.com/ Facebook: https://www.facebook.com/codebasicshub Twitter: https://twitter.com/codebasicshub	27	Education	PT20M41S	1241	2d	hd	false	https://i.ytimg.com/vi/3ykIpmAxdoY/maxresdefault.jpg	1	8144	98	1	0	20
113	UCh9nVJoWXmFb7sLApWGcLPQ	codebasics	66HNCg7_gfE	2019-05-08T04:51:06Z	2019-05-08 04:51:06	21. Generators [Python 3 Programming Tutorials]	Generators are functions that can be used as iterators. Learn more about them in this tutorial. Code used in this tutorial: Next Video: 22. List Set Dict Comprehensions [Python 3 Programming Tutorials]: https://www.youtube.com/watch?v=fz2PKpPdlRo&list=PLeo1K3hjS3uv5U-Lmlnucd7gqF-3ehIh0&index=24 https://github.com/codebasics/py/blob/master/Basics/22_Generators.py Website: http://codebasicshub.com/ Facebook: https://www.facebook.com/codebasicshub Twitter: https://twitter.com/codebasicshub Patreon: https://www.patreon.com/codebasics	27	Education	PT9M19S	559	2d	hd	false	https://i.ytimg.com/vi/66HNCg7_gfE/maxresdefault.jpg	1	1646	33	0	0	3
114	UCh9nVJoWXmFb7sLApWGcLPQ	codebasics	6lBPM-MiGNI	2019-05-08T04:51:06Z	2019-05-08 04:51:06	1. Install python on windows [Python 3 Programming Tutorials]	Step by step process on how to install python on windows. Visit my website (link below) for all tutorials and answers on exercises. Next Video: 2. Variables [Python 3 Programming Tutorials]: https://www.youtube.com/watch?v=8tCe1P_cgoY&list=PLeo1K3hjS3uv5U-Lmlnucd7gqF-3ehIh0&index=3 Website: http://codebasicshub.com/ Facebook: https://www.facebook.com/codebasicshub Twitter: https://twitter.com/codebasicshub	27	Education	PT3M53S	233	2d	hd	false	https://i.ytimg.com/vi/6lBPM-MiGNI/maxresdefault.jpg	1	13765	120	2	0	7
115	UCh9nVJoWXmFb7sLApWGcLPQ	codebasics	7snh_1Hf_TI	2019-05-08T04:51:06Z	2019-05-08 04:51:06	12.1 - Install Python Module (using pip) [Python 3 Programming Tutorials]	This python tutorial will teach us about how to install “python modules” on windows and how to install packages using pip. Next Video: 12. Modules [Python 3 Programming Tutorials]: https://www.youtube.com/watch?v=DdGVBZv46PI&list=PLeo1K3hjS3uv5U-Lmlnucd7gqF-3ehIh0&index=14 Website: http://codebasicshub.com/ Facebook: https://www.facebook.com/codebasicshub Twitter: https://twitter.com/codebasicshub Patreon: https://www.patreon.com/codebasics	27	Education	PT3M7S	187	2d	hd	false	https://i.ytimg.com/vi/7snh_1Hf_TI/maxresdefault.jpg	1	4946	38	3	0	9
116	UCh9nVJoWXmFb7sLApWGcLPQ	codebasics	FNExLliAnZw	2019-05-08T04:51:06Z	2019-05-08 04:51:06	13. Working With JSON [Python 3 Programming Tutorials]	In this python tutorial, we are going to see working with “JSON objects” in python. The topics that we have covered in this video are how to work with “JSON format” in python and how to “import JSON module”. Topics that are covered in this Video: 0:06 What is JSON 2:58 Import json module 3:08 dumps() method Video without background music: https://youtu.be/FNExLliAnZw Visit my website http://codebasicshub.com/ for complete list of programming tutorials. Link for code: https://github.com/codebasics/py/blob/master/Basics/14_json_addressbook.py Next Video: 14. if __name__ == "__main__": https://www.youtube.com/watch?v=2AKJzc-cSj8&list=PLeo1K3hjS3uv5U-Lmlnucd7gqF-3ehIh0&index=16 Website: http://codebasicshub.com/ Facebook: https://www.facebook.com/codebasicshub Twitter: https://twitter.com/codebasicshub Patreon: https://www.patreon.com/codebasics	27	Education	PT8M42S	522	2d	hd	false	https://i.ytimg.com/vi/FNExLliAnZw/maxresdefault.jpg	1	7249	110	4	0	8
117	UCh9nVJoWXmFb7sLApWGcLPQ	codebasics	OxpBMNalsDM	2019-05-08T04:51:06Z	2019-05-08 04:51:06	24. Command line argument processing using argparse [Python 3 Programming Tutorials]	This tutorial shows how to pass command line arguments to python script. Code used in this tutorial: https://github.com/codebasics/py/blob/master/Modules/argparse_tutorial.py Next Video: 25. Decorators [Python 3 Programming Tutorials]: https://www.youtube.com/watch?v=IVWZxr0kOyI&list=PLeo1K3hjS3uv5U-Lmlnucd7gqF-3ehIh0&index=27 Website: http://codebasicshub.com/ Facebook: https://www.facebook.com/codebasicshub Twitter: https://twitter.com/codebasicshub Patreon: https://www.patreon.com/codebasics	27	Education	PT14M45S	885	2d	hd	false	https://i.ytimg.com/vi/OxpBMNalsDM/maxresdefault.jpg	1	2889	64	1	0	10
118	UCh9nVJoWXmFb7sLApWGcLPQ	codebasics	fz_BCnhEQYQ	2019-05-08T04:51:06Z	2019-05-08 04:51:06	10. Functions [Python 3 Programming Tutorials]	In today’s session, we will talk about “functions” in python. The video will explain the introduction of “functions”, why “functions” are needed, encapsulate code in a function, default arguments, the difference between “local and global variables” and “document strings”. Topics that are covered in this Video: 0:05 Functions introduction 0:54 why functions are needed 3:09 encapsulate code in function 3:24 Define function 10:22 Name argument 11:09 Global vs Local Variables 12:47 Default variable 14:14 Document strings Visit http://codebasicshub.com/tutorial/python/functions to download answers on exercises. Next Video: 11. Dictionaries and Tuples [Python 3 Programming Tutorials]: https://www.youtube.com/watch?v=RCM-lVAfXFg&list=PLeo1K3hjS3uv5U-Lmlnucd7gqF-3ehIh0&index=12 Website: http://codebasicshub.com/ Facebook: https://www.facebook.com/codebasicshub Twitter: https://twitter.com/codebasicshub Patreon: https://www.patreon.com/codebasics	27	Education	PT16M10S	970	2d	hd	false	https://i.ytimg.com/vi/fz_BCnhEQYQ/maxresdefault.jpg	1	6973	97	0	0	11
119	UCh9nVJoWXmFb7sLApWGcLPQ	codebasics	hNddJ3_hahk	2019-05-08T04:51:06Z	2019-05-08 04:51:06	8. If Statement [Python 3 Programming Tutorials]	The video will describe “if” statement in python, “if control” statement, the use of “if” statement, how to create “if” statement and the flow of “if” statement. Topics that are covered in this Video: 1:08 input() function 1:48 int() function 5:42 Operators Visit http://codebasicshub.com/tutorial/python/if-statement to download answers on exercises. Next Video: 9. For loop [Python 3 Programming Tutorials]: https://www.youtube.com/watch?v=3ykIpmAxdoY&list=PLeo1K3hjS3uv5U-Lmlnucd7gqF-3ehIh0&index=10 Website: http://codebasicshub.com/ Facebook: https://www.facebook.com/codebasicshub Twitter: https://twitter.com/codebasicshub	27	Education	PT13M19S	799	2d	hd	false	https://i.ytimg.com/vi/hNddJ3_hahk/maxresdefault.jpg	1	7265	75	2	0	10
120	UCh9nVJoWXmFb7sLApWGcLPQ	codebasics	t0UTQ1eOH_g	2019-05-08T04:51:06Z	2019-05-08 04:51:06	5. Lists [Python 3 Programming Tutorials]	This python video answers about lists. It gives information about what is a list, how to create a list, range element, the use of list method and list function. Topics that are covered in this Video: 0:58 create list variable 2:06 How list are stored in computer memory 4:01 How do you access a range of elements 5:01 use append() method 7:04 Join two list 8:24 list concatenation 9:00 len() function 9:27 "in" operator Visit http://codebasicshub.com/tutorial/pyt... to download answers on exercises. Next Video: 6. Install PyCharm on Windows [Python 3 Programming Tutorials]: https://www.youtube.com/watch?v=Vig1IeU2RYk&list=PLeo1K3hjS3uv5U-Lmlnucd7gqF-3ehIh0&index=7 Website: http://codebasicshub.com/ Facebook: https://www.facebook.com/codebasicshub Twitter: https://twitter.com/codebasicshub	27	Education	PT10M24S	624	2d	hd	false	https://i.ytimg.com/vi/t0UTQ1eOH_g/maxresdefault.jpg	1	8622	117	2	0	5
121	UCh9nVJoWXmFb7sLApWGcLPQ	codebasics	0cQj7q8EWxY	2019-05-08T04:51:05Z	2019-05-08 04:51:05	7. Debug Python code using PyCharm [Python 3 Programming Tutorials]	The python video covers how to debug code in Pycharm, what are the elements of PyCharm, basic concepts of debugging, how to set a breakpoint, use of watches and when to use step over function. Topics that are covered in this Video: 0:15 Create new project 2:42 Elements of PyCharm editor 3:52 menu(Dashboard) 4:05 Project panel 4:16 Core editor 4:25 Console output 5:00 Debugging 5:46 Set breakpoint 7:04 Watches 7:20 Step over function Next Video: 8. If Statement [Python 3 Programming Tutorials]: https://www.youtube.com/watch?v=hNddJ3_hahk&list=PLeo1K3hjS3uv5U-Lmlnucd7gqF-3ehIh0&index=9 Website: http://codebasicshub.com/ Facebook: https://www.facebook.com/codebasicshub Twitter: https://twitter.com/codebasicshub	27	Education	PT9M39S	579	2d	hd	false	https://i.ytimg.com/vi/0cQj7q8EWxY/maxresdefault.jpg	1	7490	79	0	0	9
122	UCh9nVJoWXmFb7sLApWGcLPQ	codebasics	2AKJzc-cSj8	2019-05-08T04:51:05Z	2019-05-08 04:51:05	14. if __name__ == "__main__"	The python tutorial guides us about if “ __name__”==”__main__”. It will teach us what is “__name__” in python, how it is executed and how to execute python file from a command prompt. Topics that are covered in this Python Video: 0:17 what is __name__ 2:42 Execute python file from a command prompt Next Video: 15. Exception Handling [Python 3 Programming Tutorials]: https://www.youtube.com/watch?v=kqVQDXfc9hU&list=PLeo1K3hjS3uv5U-Lmlnucd7gqF-3ehIh0&index=17 Website: http://codebasicshub.com/ Facebook: https://www.facebook.com/codebasicshub Twitter: https://twitter.com/codebasicshub Patreon: https://www.patreon.com/codebasics	27	Education	PT4M25S	265	2d	hd	false	https://i.ytimg.com/vi/2AKJzc-cSj8/maxresdefault.jpg	1	6205	78	5	0	4
123	UCh9nVJoWXmFb7sLApWGcLPQ	codebasics	6XWeeEg6d3s	2019-05-08T04:51:05Z	2019-05-08 04:51:05	16. Class and Objects [Python 3 Programming Tutorials]	This video python tutorial will explain about “class” and “objects”. It has covered what is a class, how to create a class in python, how to create a method in the class and how to create an instance of a class. Topics that are covered in this Python Video: 0:05 what is a class 2:16 create a class in python 5:00 create method in class 6:54 create an instance of a class Code used in this tutorial: https://github.com/codebasics/py/blob/master/Basics/17_class.py Next Video: 17. Inheritance [Python 3 Programming Tutorials]: https://www.youtube.com/watch?v=Z7D9yv21tig&list=PLeo1K3hjS3uv5U-Lmlnucd7gqF-3ehIh0&index=19 Website: http://codebasicshub.com/ Facebook: https://www.facebook.com/codebasicshub Twitter: https://twitter.com/codebasicshub Patreon: https://www.patreon.com/codebasics	27	Education	PT9M50S	590	2d	hd	false	https://i.ytimg.com/vi/6XWeeEg6d3s/maxresdefault.jpg	1	5919	111	1	0	10
124	UCh9nVJoWXmFb7sLApWGcLPQ	codebasics	8tCe1P_cgoY	2019-05-08T04:51:05Z	2019-05-08 04:51:05	2. Variables [Python 3 Programming Tutorials]	In this python programming tutorial for beginners, we will cover variable basics. Then we look at different data types in python such as string, integer, boolean and numbers. Exercise: https://github.com/codebasics/py/blob/master/Basics/Hindi/1_Variables/1_variables_exercise.md Topics that are covered in this Video: 0:33 Create variables to store numbers 2:13 Create variables to store text data 2:53 Rules of variable naming convention Visit http://codebasicshub.com/tutorial/python/variables to download answers on exercises. Next Video: 3. Numbers [Python 3 Programming Tutorials]: https://www.youtube.com/watch?v=pd2_ZbhFT38&list=PLeo1K3hjS3uv5U-Lmlnucd7gqF-3ehIh0&index=4 Website: http://codebasicshub.com/ Facebook: https://www.facebook.com/codebasicshub Twitter: https://twitter.com/codebasicshub	27	Education	PT3M43S	223	2d	hd	false	https://i.ytimg.com/vi/8tCe1P_cgoY/maxresdefault.jpg	1	13572	106	2	0	6
125	UCh9nVJoWXmFb7sLApWGcLPQ	codebasics	DdGVBZv46PI	2019-05-08T04:51:05Z	2019-05-08 04:51:05	12. Modules [Python 3 Programming Tutorials]	In this python tutorial, we will cover “modules”. We will learn what are “modules”, how to use it, find the list of all modules and how to write a “custom module”. Topics that are covered in this Video: 0:05 Introduction of modules 1:13 Math module 1:47 Find functions in the module 3:34 calendar module 5:06 List of all python modules 5:58 write a custom python module 9:24 sys module Next Video: 13. Working With JSON [Python 3 Programming Tutorials]: https://www.youtube.com/watch?v=FNExLliAnZw&list=PLeo1K3hjS3uv5U-Lmlnucd7gqF-3ehIh0&index=15 Website: http://codebasicshub.com/ Facebook: https://www.facebook.com/codebasicshub Twitter: https://twitter.com/codebasicshub Patreon: https://www.patreon.com/codebasics	27	Education	PT11M3S	663	2d	hd	false	https://i.ytimg.com/vi/DdGVBZv46PI/maxresdefault.jpg	1	5750	67	1	0	3
126	UCh9nVJoWXmFb7sLApWGcLPQ	codebasics	IVWZxr0kOyI	2019-05-08T04:51:05Z	2019-05-08 04:51:05	25. Decorators [Python 3 Programming Tutorials]	In this tutorial, I explain decorators in a very simple way by going over how to measure execution time of function using decorators. They serve as a wrapper to original function but does a wonderful job of avoiding code duplication and not cluttering original code with additional logic. Code in this tutorial is available here: https://github.com/codebasics/py/blob/master/Advanced/decorators.py Website: http://codebasicshub.com/ Facebook: https://www.facebook.com/codebasicshub Twitter: https://twitter.com/codebasicshub Patreon: https://www.patreon.com/codebasics	27	Education	PT9M7S	547	2d	hd	false	https://i.ytimg.com/vi/IVWZxr0kOyI/maxresdefault.jpg	1	1332	38	1	0	16
127	UCh9nVJoWXmFb7sLApWGcLPQ	codebasics	RCM-lVAfXFg	2019-05-08T04:51:05Z	2019-05-08 04:51:05	11. Dictionaries and Tuples [Python 3 Programming Tutorials]	In this python tutorial, we will understand the concept of “dictionaries and tuples”. We will understand what are dictionaries, “order in a dictionary”, how to access dictionary element, what is “tuples” and the difference between “list and tuple”. Topics that are covered in this Video: 0:07 What is the dictionary 1:20 Access dictionary element 2:33 Order in the dictionary 2:56 delete from the dictionary 5:00 in operator in the dictionary 6:00 What are tuples? 7:00 Difference between list and tuple 8:18 Tuples are immutable Visit http://codebasicshub.com/tutorial/python/dictionaries-and-tuples to download answers on exercises. Next Video: 12.1 - Install Python Module (using pip) [Python 3 Programming Tutorials]: https://www.youtube.com/watch?v=7snh_1Hf_TI&list=PLeo1K3hjS3uv5U-Lmlnucd7gqF-3ehIh0&index=13 Website: http://codebasicshub.com/ Facebook: https://www.facebook.com/codebasicshub Twitter: https://twitter.com/codebasicshub Patreon: https://www.patreon.com/codebasics	27	Education	PT8M46S	526	2d	hd	false	https://i.ytimg.com/vi/RCM-lVAfXFg/maxresdefault.jpg	1	5199	59	0	0	17
128	UCh9nVJoWXmFb7sLApWGcLPQ	codebasics	RD6JionMlXM	2019-05-08T04:51:05Z	2019-05-08 04:51:05	23. Sets and Frozen Sets [Python 3 Programming Tutorials]	Learn how to use sets and frozen sets in python. Set is basically mathematical set and could be really useful in programming. Frozen sets are same as set except you can not change them (immutable). Next Video: 24. Command line argument processing using argparse [Python 3 Programming Tutorials]: https://www.youtube.com/watch?v=OxpBMNalsDM&list=PLeo1K3hjS3uv5U-Lmlnucd7gqF-3ehIh0&index=26 Website: http://codebasicshub.com/ Facebook: https://www.facebook.com/codebasicshub Twitter: https://twitter.com/codebasicshub Patreon: https://www.patreon.com/codebasics	27	Education	PT7M51S	471	2d	hd	false	https://i.ytimg.com/vi/RD6JionMlXM/maxresdefault.jpg	1	914	21	1	0	1
129	UCh9nVJoWXmFb7sLApWGcLPQ	codebasics	Vig1IeU2RYk	2019-05-08T04:51:05Z	2019-05-08 04:51:05	6. Install PyCharm on Windows [Python 3 Programming Tutorials]	The python tutorial explains how to install PyCharm on windows, what is PyCharm and how to set up the editor. Next Video: 7. Debug Python code using PyCharm [Python 3 Programming Tutorials]: https://www.youtube.com/watch?v=0cQj7q8EWxY&list=PLeo1K3hjS3uv5U-Lmlnucd7gqF-3ehIh0&index=8 Website: http://codebasicshub.com/ Facebook: https://www.facebook.com/codebasicshub Twitter: https://twitter.com/codebasicshub	27	Education	PT6M33S	393	2d	hd	false	https://i.ytimg.com/vi/Vig1IeU2RYk/maxresdefault.jpg	1	7126	52	1	0	7
130	UCh9nVJoWXmFb7sLApWGcLPQ	codebasics	WIqX3kDxDKE	2019-05-08T04:51:05Z	2019-05-08 04:51:05	19. Raise Exception And Finally [Python 3 Programming Tutorials]	Next Video: 20. Iterators [Python 3 Programming Tutorials]: https://www.youtube.com/watch?v=ffFRuB03qLE&list=PLeo1K3hjS3uv5U-Lmlnucd7gqF-3ehIh0&index=22 Website: http://codebasicshub.com/ Facebook: https://www.facebook.com/codebasicshub Twitter: https://twitter.com/codebasicshub Patreon: https://www.patreon.com/codebasics	27	Education	PT8M58S	538	2d	hd	false	https://i.ytimg.com/vi/WIqX3kDxDKE/maxresdefault.jpg	1	1093	11	0	0	1
131	UCh9nVJoWXmFb7sLApWGcLPQ	codebasics	Z7D9yv21tig	2019-05-08T04:51:05Z	2019-05-08 04:51:05	17. Inheritance [Python 3 Programming Tutorials]	In today’s python tutorial we will discuss “inheritance”. The video will give insights regarding what is an inheritance, how to implement inheritance in python, how to derive a class from another class, how to create objects of class and the benefits of inheritance. Topics that are covered in this Python Video: 0:05 What is Inheritance? 1:44 Implement Inheritance in python 2:33 Derive a class from another class 4:42 Create objects of class 8:24 Benefits of inheritance (code reuse, extensibility, readability ) Code used in this tutorial: https://github.com/codebasics/py/blob/master/Basics/18_inheritance.py Next Video: 18. Multiple Inheritance [Python 3 Programming Tutorials]: https://www.youtube.com/watch?v=ttMX3Ns_0oY&list=PLeo1K3hjS3uv5U-Lmlnucd7gqF-3ehIh0&index=20 Website: http://codebasicshub.com/ Facebook: https://www.facebook.com/codebasicshub Twitter: https://twitter.com/codebasicshub Patreon: https://www.patreon.com/codebasics	27	Education	PT11M47S	707	2d	hd	false	https://i.ytimg.com/vi/Z7D9yv21tig/maxresdefault.jpg	1	1802	35	1	0	6
132	UCh9nVJoWXmFb7sLApWGcLPQ	codebasics	ez2N-hcwvcQ	2019-05-08T04:51:05Z	2019-05-08 04:51:05	4. Strings [Python 3 Programming Tutorials]	This python 3 programming tutorial covers basics of strings. We will talk about newly introduced f-string concept in python 3.6. Also after covering string basics we will see index and strign slicing. Exercise: https://github.com/codebasics/py/blob/master/Basics/Hindi/3_strings/3_strings_exercise.md This tutorial's Code: https://github.com/codebasics/py/blob/master/Basics/Hindi/3_strings/3_strings.ipynb Topics that are covered in this Video: 0:00 String introduction and index operator 0:48 String slicing 4:35 multiline string using tripple quotes (''') 5:14 \n and \t characters 5:28 + operator to join two strings 6:21 str() function Next Video: 5. Lists [Python 3 Programming Tutorials]: https://www.youtube.com/watch?v=t0UTQ1eOH_g&list=PLeo1K3hjS3uv5U-Lmlnucd7gqF-3ehIh0&index=6 Exercise: http://codebasicshub.com/tutorial/python/strings to download answers on exercises. Website: http://codebasicshub.com/ Facebook: https://www.facebook.com/codebasicshub Twitter: https://twitter.com/codebasicshub	27	Education	PT7M12S	432	2d	hd	false	https://i.ytimg.com/vi/ez2N-hcwvcQ/maxresdefault.jpg	1	8669	95	2	0	6
133	UCh9nVJoWXmFb7sLApWGcLPQ	codebasics	ffFRuB03qLE	2019-05-08T04:51:05Z	2019-05-08 04:51:05	20. Iterators [Python 3 Programming Tutorials]	Next Video: 21. Generators [Python 3 Programming Tutorials]: https://www.youtube.com/watch?v=66HNCg7_gfE&list=PLeo1K3hjS3uv5U-Lmlnucd7gqF-3ehIh0&index=23 Code used in this tutorial: https://github.com/codebasics/py/blob/master/Basics/21_iterators.py Website: http://codebasicshub.com/ Facebook: https://www.facebook.com/codebasicshub Twitter: https://twitter.com/codebasicshub Patreon: https://www.patreon.com/codebasics	27	Education	PT11M28S	688	2d	hd	false	https://i.ytimg.com/vi/ffFRuB03qLE/maxresdefault.jpg	1	1162	18	1	0	1
134	UCh9nVJoWXmFb7sLApWGcLPQ	codebasics	fz2PKpPdlRo	2019-05-08T04:51:05Z	2019-05-08 04:51:05	22. List Set Dict Comprehensions [Python 3 Programming Tutorials]	This tutorial covers list (and set/dict) comprehensions which can be used to construct a list, set or dict in a dynamic mathematical way. Next Video: 23. Sets and Frozen Sets [Python 3 Programming Tutorials]: https://www.youtube.com/watch?v=RD6JionMlXM&list=PLeo1K3hjS3uv5U-Lmlnucd7gqF-3ehIh0&index=25 Website: http://codebasicshub.com/ Facebook: https://www.facebook.com/codebasicshub Twitter: https://twitter.com/codebasicshub Patreon: https://www.patreon.com/codebasics	27	Education	PT6M	360	2d	hd	false	https://i.ytimg.com/vi/fz2PKpPdlRo/maxresdefault.jpg	1	621	18	0	0	1
