position	channelId	channelTitle	videoId	publishedAt	publishedAtSQL	videoTitle	videoDescription	videoCategoryId	videoCategoryLabel	duration	durationSec	dimension	definition	caption	thumbnail_maxres	licensedContent	viewCount	likeCount	dislikeCount	favoriteCount	commentCount
100	UCCezIgC97PvUuR4_gbFUs5g	Corey Schafer	qE77MbDnljA	2017-10-10T16:30:06Z	2017-10-10 16:30:06	Linux/Mac Terminal Tutorial: How To Use The rsync Command - Sync Files Locally and Remotely	In this Linux/Mac terminal tutorial, we will be learning how to use the rsync command. The rsync command will allow you to sync file and directories on your local machine or even over a network between servers. This is a great tool for running back ups, for only copying diffs, or even for deploying segments of code. Let's get started. VirtualBox Network with SSH: https://youtu.be/S7jD6nnYJy0 Key-Based Authentication: https://youtu.be/vpk_1gldOAE Cron Jobs: https://youtu.be/QZJ1drMQz1A ✅ Support My Channel Through Patreon: https://www.patreon.com/coreyms ✅ Become a Channel Member: https://www.youtube.com/channel/UCCezIgC97PvUuR4_gbFUs5g/join ✅ One-Time Contribution Through PayPal: https://goo.gl/649HFY ✅ Cryptocurrency Donations: Bitcoin Wallet - 3MPH8oY2EAgbLVy7RBMinwcBntggi7qeG3 Ethereum Wallet - 0x151649418616068fB46C3598083817101d3bCD33 Litecoin Wallet - MPvEBY5fxGkmPQgocfJbxP6EmTo5UUXMot ✅ Corey's Public Amazon Wishlist http://a.co/inIyro1 ✅ Equipment I Use and Books I Recommend: https://www.amazon.com/shop/coreyschafer ▶️ You Can Find Me On: My Website - http://coreyms.com/ My Second Channel - https://www.youtube.com/c/coreymschafer Facebook - https://www.facebook.com/CoreyMSchafer Twitter - https://twitter.com/CoreyMSchafer Instagram - https://www.instagram.com/coreymschafer/ #Linux #Mac	27	Education	PT17M55S	1075	2d	hd	false	https://i.ytimg.com/vi/qE77MbDnljA/maxresdefault.jpg	1	78188	2482	15	0	114
101	UCCezIgC97PvUuR4_gbFUs5g	Corey Schafer	sa-TUpSx1JA	2017-10-05T16:30:01Z	2017-10-05 16:30:01	Regular Expressions (Regex) Tutorial: How to Match Any Pattern of Text	In this regular expressions (regex) tutorial, we're going to be learning how to match patterns of text. Regular expressions are extremely useful for matching common patterns of text such as email addresses, phone numbers, URLs, etc. Almost every programming language has a regular expression library, so learning regular expressions with not only help you with finding patterns in your text editors, but also you'll be able to use these programming libraries to search for patterns programmatically as well. Let's get started... The code from this video can be found at: https://github.com/CoreyMSchafer/code_snippets/tree/master/Regular-Expressions Python Regex Tutorial: https://youtu.be/K8L6KVGG-7o ✅ Support My Channel Through Patreon: https://www.patreon.com/coreyms ✅ Become a Channel Member: https://www.youtube.com/channel/UCCezIgC97PvUuR4_gbFUs5g/join ✅ One-Time Contribution Through PayPal: https://goo.gl/649HFY ✅ Cryptocurrency Donations: Bitcoin Wallet - 3MPH8oY2EAgbLVy7RBMinwcBntggi7qeG3 Ethereum Wallet - 0x151649418616068fB46C3598083817101d3bCD33 Litecoin Wallet - MPvEBY5fxGkmPQgocfJbxP6EmTo5UUXMot ✅ Corey's Public Amazon Wishlist http://a.co/inIyro1 ✅ Equipment I Use and Books I Recommend: https://www.amazon.com/shop/coreyschafer ▶️ You Can Find Me On: My Website - http://coreyms.com/ My Second Channel - https://www.youtube.com/c/coreymschafer Facebook - https://www.facebook.com/CoreyMSchafer Twitter - https://twitter.com/CoreyMSchafer Instagram - https://www.instagram.com/coreymschafer/	27	Education	PT37M55S	2275	2d	hd	true	https://i.ytimg.com/vi/sa-TUpSx1JA/maxresdefault.jpg	1	576895	18420	140	0	1302
102	UCCezIgC97PvUuR4_gbFUs5g	Corey Schafer	TtIJEQ6D9DE	2017-09-19T16:30:00Z	2017-09-19 16:30:00	5 Essential Skills Every Well-Rounded Programmer Should Know	In this video, we will be looking at 5 skills that you can learn on top of your main programming language to make you a well-rounded programmer. These skills will make you more marketable when looking for a job, and can sometimes be the deciding factor when choosing between candidates. TLDR (TLDW?): 1. Version Control (Git) 2. Databases (SQL) 3. Command Line (Terminal) 4. Unit Testing (continuous integration) 5. Multiple languages Git Tutorial for Beginners: https://youtu.be/HVsySz-h9r4 SQL Tutorial for Beginners: https://youtu.be/xaWlS9HtWYw Terminal Tutorial Playlist: https://www.youtube.com/playlist?list=PL-osiE80TeTvGhHkpvfmKWOiIPF8UVy6c Unit Testing in Python: https://youtu.be/6tNS--WetLI ✅ Support My Channel Through Patreon: https://www.patreon.com/coreyms ✅ Become a Channel Member: https://www.youtube.com/channel/UCCezIgC97PvUuR4_gbFUs5g/join ✅ One-Time Contribution Through PayPal: https://goo.gl/649HFY ✅ Cryptocurrency Donations: Bitcoin Wallet - 3MPH8oY2EAgbLVy7RBMinwcBntggi7qeG3 Ethereum Wallet - 0x151649418616068fB46C3598083817101d3bCD33 Litecoin Wallet - MPvEBY5fxGkmPQgocfJbxP6EmTo5UUXMot ✅ Corey's Public Amazon Wishlist http://a.co/inIyro1 ✅ Equipment I Use and Books I Recommend: https://www.amazon.com/shop/coreyschafer ▶️ You Can Find Me On: My Website - http://coreyms.com/ My Second Channel - https://www.youtube.com/c/coreymschafer Facebook - https://www.facebook.com/CoreyMSchafer Twitter - https://twitter.com/CoreyMSchafer Instagram - https://www.instagram.com/coreymschafer/	27	Education	PT11M4S	664	2d	hd	false	https://i.ytimg.com/vi/TtIJEQ6D9DE/maxresdefault.jpg	1	173370	6370	93	0	178
103	UCCezIgC97PvUuR4_gbFUs5g	Corey Schafer	cY2NXB_Tqq0	2017-09-06T16:30:01Z	2017-09-06 16:30:01	Python Tutorial: How I Manage Multiple Projects, Virtual Environments, and Environment Variables	In this Python Programming Tutorial, I will be showing how I personally manage multiple projects, virtual environments, and environment variables. If you have ever worked on multiple projects, you probably know that it can be a hassle to keep all of your dependencies and project information separate. The strategy I have adopted over the years allows me to easily separate out my environments in such a way that they can be easily exported, activated, and also automatically activate the correct environment variables. Let's get started... The workflow I follow: https://conda.io/docs/user-guide/tasks/manage-environments.html Anaconda Intro Video: https://youtu.be/YJC6ldI3hWk The original conda_auto_env code I modified can be found here: https://github.com/chdoig/conda-auto-env/blob/master/conda_auto_env.sh My modified version of conda_auto_env: https://github.com/CoreyMSchafer/code_snippets/blob/master/conda_auto_env.sh ✅ Support My Channel Through Patreon: https://www.patreon.com/coreyms ✅ Become a Channel Member: https://www.youtube.com/channel/UCCezIgC97PvUuR4_gbFUs5g/join ✅ One-Time Contribution Through PayPal: https://goo.gl/649HFY ✅ Cryptocurrency Donations: Bitcoin Wallet - 3MPH8oY2EAgbLVy7RBMinwcBntggi7qeG3 Ethereum Wallet - 0x151649418616068fB46C3598083817101d3bCD33 Litecoin Wallet - MPvEBY5fxGkmPQgocfJbxP6EmTo5UUXMot ✅ Corey's Public Amazon Wishlist http://a.co/inIyro1 ✅ Equipment I Use and Books I Recommend: https://www.amazon.com/shop/coreyschafer ▶️ You Can Find Me On: My Website - http://coreyms.com/ My Second Channel - https://www.youtube.com/c/coreymschafer Facebook - https://www.facebook.com/CoreyMSchafer Twitter - https://twitter.com/CoreyMSchafer Instagram - https://www.instagram.com/coreymschafer/ #Python	27	Education	PT20M49S	1249	2d	hd	false	https://i.ytimg.com/vi/cY2NXB_Tqq0/maxresdefault.jpg	1	79182	1312	11	0	60
104	UCCezIgC97PvUuR4_gbFUs5g	Corey Schafer	KzqSDvzOFNA	2017-08-29T17:00:01Z	2017-08-29 17:00:01	Python Tutorial: Generate Random Numbers and Data Using the random Module	In this Python Programming Tutorial, we will be learning how to generate random numbers and choose random data from lists using the random module. I personally use the random module pretty often in my tutorials to generate random data. This can also be used be games, simulations, and plenty of other useful tasks. Let's get started. The code from this video can be found at: https://github.com/CoreyMSchafer/code_snippets/tree/master/Python-Random ✅ Support My Channel Through Patreon: https://www.patreon.com/coreyms ✅ Become a Channel Member: https://www.youtube.com/channel/UCCezIgC97PvUuR4_gbFUs5g/join ✅ One-Time Contribution Through PayPal: https://goo.gl/649HFY ✅ Cryptocurrency Donations: Bitcoin Wallet - 3MPH8oY2EAgbLVy7RBMinwcBntggi7qeG3 Ethereum Wallet - 0x151649418616068fB46C3598083817101d3bCD33 Litecoin Wallet - MPvEBY5fxGkmPQgocfJbxP6EmTo5UUXMot ✅ Corey's Public Amazon Wishlist http://a.co/inIyro1 ✅ Equipment I Use and Books I Recommend: https://www.amazon.com/shop/coreyschafer ▶️ You Can Find Me On: My Website - http://coreyms.com/ My Second Channel - https://www.youtube.com/c/coreymschafer Facebook - https://www.facebook.com/CoreyMSchafer Twitter - https://twitter.com/CoreyMSchafer Instagram - https://www.instagram.com/coreymschafer/ #Python	27	Education	PT13M37S	817	2d	hd	false	https://i.ytimg.com/vi/KzqSDvzOFNA/maxresdefault.jpg	1	190089	4306	47	0	278
105	UCCezIgC97PvUuR4_gbFUs5g	Corey Schafer	QZJ1drMQz1A	2017-08-23T16:00:03Z	2017-08-23 16:00:03	Linux/Mac Tutorial: Cron Jobs - How to Schedule Commands with crontab	In this Linux/Mac terminal tutorial, we will be learning about cron jobs and how to schedule commands with crontab. The will allow you to run commands on a repetitive schedule. So if you want to run a job daily, weekly, or at a certain time of day, this video will show you how you can get this set up. This helps a ton with system administration type of tasks and can automate a lot of work. Let's get started. The snippets from this video can be found at: https://github.com/CoreyMSchafer/code_snippets/tree/master/Cron-Tasks ✅ Support My Channel Through Patreon: https://www.patreon.com/coreyms ✅ Become a Channel Member: https://www.youtube.com/channel/UCCezIgC97PvUuR4_gbFUs5g/join ✅ One-Time Contribution Through PayPal: https://goo.gl/649HFY ✅ Cryptocurrency Donations: Bitcoin Wallet - 3MPH8oY2EAgbLVy7RBMinwcBntggi7qeG3 Ethereum Wallet - 0x151649418616068fB46C3598083817101d3bCD33 Litecoin Wallet - MPvEBY5fxGkmPQgocfJbxP6EmTo5UUXMot ✅ Corey's Public Amazon Wishlist http://a.co/inIyro1 ✅ Equipment I Use and Books I Recommend: https://www.amazon.com/shop/coreyschafer ▶️ You Can Find Me On: My Website - http://coreyms.com/ My Second Channel - https://www.youtube.com/c/coreymschafer Facebook - https://www.facebook.com/CoreyMSchafer Twitter - https://twitter.com/CoreyMSchafer Instagram - https://www.instagram.com/coreymschafer/ #Linux #Mac	27	Education	PT18M51S	1131	2d	hd	false	https://i.ytimg.com/vi/QZJ1drMQz1A/maxresdefault.jpg	1	99461	2644	16	0	154
106	UCCezIgC97PvUuR4_gbFUs5g	Corey Schafer	6tNS--WetLI	2017-08-16T16:00:01Z	2017-08-16 16:00:01	Python Tutorial: Unit Testing Your Code with the unittest Module	In this Python Programming Tutorial, we will be learning how to unit-test our code using the unittest module. Unit testing will allow you to be more comfortable with refactoring and knowing whether or not your updates broke any of your existing code. Unit testing is a must on any large projects and is used by all major companies. Not only that, but it will greatly improve your personal code as well. Let's get started. The code from this video can be found at: https://github.com/CoreyMSchafer/code_snippets/tree/master/Python-Unit-Testing Unittest assert methods: https://docs.python.org/3/library/unittest.html#unittest.TestCase.debug if __name__ == '__main__' video: https://www.youtube.com/watch?v=sugvnHA7ElY OOP Series: https://www.youtube.com/playlist?list=PL-osiE80TeTsqhIuOqKhwlXsIBIdSeYtc ✅ Support My Channel Through Patreon: https://www.patreon.com/coreyms ✅ Become a Channel Member: https://www.youtube.com/channel/UCCezIgC97PvUuR4_gbFUs5g/join ✅ One-Time Contribution Through PayPal: https://goo.gl/649HFY ✅ Cryptocurrency Donations: Bitcoin Wallet - 3MPH8oY2EAgbLVy7RBMinwcBntggi7qeG3 Ethereum Wallet - 0x151649418616068fB46C3598083817101d3bCD33 Litecoin Wallet - MPvEBY5fxGkmPQgocfJbxP6EmTo5UUXMot ✅ Corey's Public Amazon Wishlist http://a.co/inIyro1 ✅ Equipment I Use and Books I Recommend: https://www.amazon.com/shop/coreyschafer ▶️ You Can Find Me On: My Website - http://coreyms.com/ My Second Channel - https://www.youtube.com/c/coreymschafer Facebook - https://www.facebook.com/CoreyMSchafer Twitter - https://twitter.com/CoreyMSchafer Instagram - https://www.instagram.com/coreymschafer/ #Python	27	Education	PT39M13S	2353	2d	hd	false	https://i.ytimg.com/vi/6tNS--WetLI/maxresdefault.jpg	1	418054	8903	50	0	421
107	UCCezIgC97PvUuR4_gbFUs5g	Corey Schafer	q5uM4VKywbA	2017-08-09T16:00:06Z	2017-08-09 16:00:06	Python Tutorial: CSV Module - How to Read, Parse, and Write CSV Files	In this Python Programming Tutorial, we will be learning how to work with csv files using the csv module. We will learn how to read, parse, and write to csv files. CSV stands for "Comma-Separated Values". It is a common format for storing information. Knowing how to read, parse, and write this information to files will open the door to working with a lot of data throughout the world. Let's get started. The code from this video can be found at: https://github.com/CoreyMSchafer/code_snippets/tree/master/Python-CSV ✅ Support My Channel Through Patreon: https://www.patreon.com/coreyms ✅ Become a Channel Member: https://www.youtube.com/channel/UCCezIgC97PvUuR4_gbFUs5g/join ✅ One-Time Contribution Through PayPal: https://goo.gl/649HFY ✅ Cryptocurrency Donations: Bitcoin Wallet - 3MPH8oY2EAgbLVy7RBMinwcBntggi7qeG3 Ethereum Wallet - 0x151649418616068fB46C3598083817101d3bCD33 Litecoin Wallet - MPvEBY5fxGkmPQgocfJbxP6EmTo5UUXMot ✅ Corey's Public Amazon Wishlist http://a.co/inIyro1 ✅ Equipment I Use and Books I Recommend: https://www.amazon.com/shop/coreyschafer ▶️ You Can Find Me On: My Website - http://coreyms.com/ My Second Channel - https://www.youtube.com/c/coreymschafer Facebook - https://www.facebook.com/CoreyMSchafer Twitter - https://twitter.com/CoreyMSchafer Instagram - https://www.instagram.com/coreymschafer/ #Python	27	Education	PT16M12S	972	2d	hd	true	https://i.ytimg.com/vi/q5uM4VKywbA/maxresdefault.jpg	1	543184	8846	87	0	494
108	UCCezIgC97PvUuR4_gbFUs5g	Corey Schafer	vpk_1gldOAE	2017-08-02T16:00:07Z	2017-08-02 16:00:07	Linux/Mac Tutorial: SSH Key-Based Authentication - How to SSH Without a Password	In this Linux/Mac terminal tutorial, we will be learning how to configure ssh keys so that we can login to our servers without a password. Not only is this more convenient, but it is also more secure. This also allows us to write automated scripts to talk to our servers without the need of putting in passwords constantly. Let's get started. How to Create a Network of Machines in VirtualBox with SSH Access: https://youtu.be/S7jD6nnYJy0 ✅ Support My Channel Through Patreon: https://www.patreon.com/coreyms ✅ Become a Channel Member: https://www.youtube.com/channel/UCCezIgC97PvUuR4_gbFUs5g/join ✅ One-Time Contribution Through PayPal: https://goo.gl/649HFY ✅ Cryptocurrency Donations: Bitcoin Wallet - 3MPH8oY2EAgbLVy7RBMinwcBntggi7qeG3 Ethereum Wallet - 0x151649418616068fB46C3598083817101d3bCD33 Litecoin Wallet - MPvEBY5fxGkmPQgocfJbxP6EmTo5UUXMot ✅ Corey's Public Amazon Wishlist http://a.co/inIyro1 ✅ Equipment I Use and Books I Recommend: https://www.amazon.com/shop/coreyschafer ▶️ You Can Find Me On: My Website - http://coreyms.com/ My Second Channel - https://www.youtube.com/c/coreymschafer Facebook - https://www.facebook.com/CoreyMSchafer Twitter - https://twitter.com/CoreyMSchafer Instagram - https://www.instagram.com/coreymschafer/ #Linux #Mac	27	Education	PT15M46S	946	2d	hd	false	https://i.ytimg.com/vi/vpk_1gldOAE/maxresdefault.jpg	1	102817	2354	19	0	144
109	UCCezIgC97PvUuR4_gbFUs5g	Corey Schafer	bkpLhQd6YQM	2017-07-26T16:00:05Z	2017-07-26 16:00:05	Python Tutorial: Real World Example - Parsing Names From a CSV to an HTML List	In this Python Programming Tutorial, we'll be learning how to parse a CSV file and output the data to an HTML unordered list. This is a real world problem I ran into with my website. The list was becoming too large for me to maintain manually, so writing a Python script to automate this process saved me a lot of time in the future. Let's get started. The code from this video can be found at: https://github.com/CoreyMSchafer/code_snippets/tree/master/Python-Patreon-CSV ✅ Support My Channel Through Patreon: https://www.patreon.com/coreyms ✅ Become a Channel Member: https://www.youtube.com/channel/UCCezIgC97PvUuR4_gbFUs5g/join ✅ One-Time Contribution Through PayPal: https://goo.gl/649HFY ✅ Cryptocurrency Donations: Bitcoin Wallet - 3MPH8oY2EAgbLVy7RBMinwcBntggi7qeG3 Ethereum Wallet - 0x151649418616068fB46C3598083817101d3bCD33 Litecoin Wallet - MPvEBY5fxGkmPQgocfJbxP6EmTo5UUXMot ✅ Corey's Public Amazon Wishlist http://a.co/inIyro1 ✅ Equipment I Use and Books I Recommend: https://www.amazon.com/shop/coreyschafer ▶️ You Can Find Me On: My Website - http://coreyms.com/ My Second Channel - https://www.youtube.com/c/coreymschafer Facebook - https://www.facebook.com/CoreyMSchafer Twitter - https://twitter.com/CoreyMSchafer Instagram - https://www.instagram.com/coreymschafer/ #Python	27	Education	PT18M48S	1128	2d	hd	false	https://i.ytimg.com/vi/bkpLhQd6YQM/maxresdefault.jpg	1	96032	2156	11	0	121
110	UCCezIgC97PvUuR4_gbFUs5g	Corey Schafer	S7jD6nnYJy0	2017-07-20T16:00:03Z	2017-07-20 16:00:03	How to Create a Network of Machines in VirtualBox with SSH Access	In this video, we'll be learning how to clone Virtual Machines, add these machines to a network so they can communicate with each other, make sure they have internet access, and also set up SSH so that we are able to SSH into these machines from our host machine. This will allow us to pretty much build an entire virtual lab that we can use to test all kinds of different software. So after we're done, this will give us the ability to quickly spin up a new VM that behaves just like a real machine on our network. Let's get started. VirtualBox Snapshots: https://www.youtube.com/watch?v=Qte4X-rdr2Q Ubuntu Install: https://www.youtube.com/watch?v=-2x-5DN-caM VirtualBox Networking Docs: https://www.virtualbox.org/manual/ch06.html ✅ Support My Channel Through Patreon: https://www.patreon.com/coreyms ✅ Become a Channel Member: https://www.youtube.com/channel/UCCezIgC97PvUuR4_gbFUs5g/join ✅ One-Time Contribution Through PayPal: https://goo.gl/649HFY ✅ Cryptocurrency Donations: Bitcoin Wallet - 3MPH8oY2EAgbLVy7RBMinwcBntggi7qeG3 Ethereum Wallet - 0x151649418616068fB46C3598083817101d3bCD33 Litecoin Wallet - MPvEBY5fxGkmPQgocfJbxP6EmTo5UUXMot ✅ Corey's Public Amazon Wishlist http://a.co/inIyro1 ✅ Equipment I Use and Books I Recommend: https://www.amazon.com/shop/coreyschafer ▶️ You Can Find Me On: My Website - http://coreyms.com/ My Second Channel - https://www.youtube.com/c/coreymschafer Facebook - https://www.facebook.com/CoreyMSchafer Twitter - https://twitter.com/CoreyMSchafer Instagram - https://www.instagram.com/coreymschafer/	27	Education	PT24M14S	1454	2d	hd	false	https://i.ytimg.com/vi/S7jD6nnYJy0/maxresdefault.jpg	1	66747	1017	13	0	80
111	UCCezIgC97PvUuR4_gbFUs5g	Corey Schafer	Qte4X-rdr2Q	2017-07-12T16:00:05Z	2017-07-12 16:00:05	VirtualBox: How to Use Snapshots	In this video, we will be learning how to use snapshots within VirtualBox. Snapshots are great for saving a machine state and being able to revert back to a previous time. Let's get started. ✅ Support My Channel Through Patreon: https://www.patreon.com/coreyms ✅ Become a Channel Member: https://www.youtube.com/channel/UCCezIgC97PvUuR4_gbFUs5g/join ✅ One-Time Contribution Through PayPal: https://goo.gl/649HFY ✅ Cryptocurrency Donations: Bitcoin Wallet - 3MPH8oY2EAgbLVy7RBMinwcBntggi7qeG3 Ethereum Wallet - 0x151649418616068fB46C3598083817101d3bCD33 Litecoin Wallet - MPvEBY5fxGkmPQgocfJbxP6EmTo5UUXMot ✅ Corey's Public Amazon Wishlist http://a.co/inIyro1 ✅ Equipment I Use and Books I Recommend: https://www.amazon.com/shop/coreyschafer ▶️ You Can Find Me On: My Website - http://coreyms.com/ My Second Channel - https://www.youtube.com/c/coreymschafer Facebook - https://www.facebook.com/CoreyMSchafer Twitter - https://twitter.com/CoreyMSchafer Instagram - https://www.instagram.com/coreymschafer/	27	Education	PT14M40S	880	2d	hd	false	https://i.ytimg.com/vi/Qte4X-rdr2Q/maxresdefault.jpg	1	28476	527	10	0	30
112	UCCezIgC97PvUuR4_gbFUs5g	Corey Schafer	CqvZ3vGoGs0	2017-05-17T19:30:00Z	2017-05-17 19:30:00	Python Tutorial for Beginners 9: Import Modules and Exploring The Standard Library	In this Python Beginner Tutorial, we will begin learning how to import modules in Python. We will learn how to import modules we have written, as well as modules from the Standard Library. We will also explore sys.path and how imported modules are found. Let's get started. The code from this video can be found at: https://github.com/CoreyMSchafer/code_snippets/tree/master/Python-Imports Watch the full Python Beginner Series here: https://www.youtube.com/playlist?list=PL-osiE80TeTskrapNbzXhwoFUiLCjGgY7 ✅ Support My Channel Through Patreon: https://www.patreon.com/coreyms ✅ Become a Channel Member: https://www.youtube.com/channel/UCCezIgC97PvUuR4_gbFUs5g/join ✅ One-Time Contribution Through PayPal: https://goo.gl/649HFY ✅ Cryptocurrency Donations: Bitcoin Wallet - 3MPH8oY2EAgbLVy7RBMinwcBntggi7qeG3 Ethereum Wallet - 0x151649418616068fB46C3598083817101d3bCD33 Litecoin Wallet - MPvEBY5fxGkmPQgocfJbxP6EmTo5UUXMot ✅ Corey's Public Amazon Wishlist http://a.co/inIyro1 ✅ Equipment I Use and Books I Recommend: https://www.amazon.com/shop/coreyschafer ▶️ You Can Find Me On: My Website - http://coreyms.com/ My Second Channel - https://www.youtube.com/c/coreymschafer Facebook - https://www.facebook.com/CoreyMSchafer Twitter - https://twitter.com/CoreyMSchafer Instagram - https://www.instagram.com/coreymschafer/ #Python	27	Education	PT21M57S	1317	2d	hd	false	https://i.ytimg.com/vi/CqvZ3vGoGs0/maxresdefault.jpg	1	398763	8540	68	0	418
113	UCCezIgC97PvUuR4_gbFUs5g	Corey Schafer	9Os0o3wzS_I	2017-05-17T19:00:01Z	2017-05-17 19:00:01	Python Tutorial for Beginners 8: Functions	In this Python Beginner Tutorial, we will begin learning how to write functions. Functions are one of the most important things to learn in Python Programming and will take us to the next level. We will learn how to create/define functions, how to pass in arguments, and also how to return values. Let's get started. The code from this video can be found at: https://github.com/CoreyMSchafer/code_snippets/tree/master/Python-Functions Watch the full Python Beginner Series here: https://www.youtube.com/playlist?list=PL-osiE80TeTskrapNbzXhwoFUiLCjGgY7 Scope Video: https://youtu.be/QVdf0LgmICw ✅ Support My Channel Through Patreon: https://www.patreon.com/coreyms ✅ Become a Channel Member: https://www.youtube.com/channel/UCCezIgC97PvUuR4_gbFUs5g/join ✅ One-Time Contribution Through PayPal: https://goo.gl/649HFY ✅ Cryptocurrency Donations: Bitcoin Wallet - 3MPH8oY2EAgbLVy7RBMinwcBntggi7qeG3 Ethereum Wallet - 0x151649418616068fB46C3598083817101d3bCD33 Litecoin Wallet - MPvEBY5fxGkmPQgocfJbxP6EmTo5UUXMot ✅ Corey's Public Amazon Wishlist http://a.co/inIyro1 ✅ Equipment I Use and Books I Recommend: https://www.amazon.com/shop/coreyschafer ▶️ You Can Find Me On: My Website - http://coreyms.com/ My Second Channel - https://www.youtube.com/c/coreymschafer Facebook - https://www.facebook.com/CoreyMSchafer Twitter - https://twitter.com/CoreyMSchafer Instagram - https://www.instagram.com/coreymschafer/ #Python	27	Education	PT21M48S	1308	2d	hd	false	https://i.ytimg.com/vi/9Os0o3wzS_I/maxresdefault.jpg	1	579178	10764	165	0	586
114	UCCezIgC97PvUuR4_gbFUs5g	Corey Schafer	6iF8Xb7Z3wQ	2017-05-17T18:30:00Z	2017-05-17 18:30:00	Python Tutorial for Beginners 7: Loops and Iterations - For/While Loops	In this Python Beginner Tutorial, we will begin learning about Loops and Iterations. Specifically, we will be looking at the for/while loops. We will learn about iteration and also how to break out of the loops using the break and continue keywords. Let's get started. The code from this video can be found at: https://github.com/CoreyMSchafer/code_snippets/tree/master/Python-Loops Watch the full Python Beginner Series here: https://www.youtube.com/playlist?list=PL-osiE80TeTskrapNbzXhwoFUiLCjGgY7 ✅ Support My Channel Through Patreon: https://www.patreon.com/coreyms ✅ Become a Channel Member: https://www.youtube.com/channel/UCCezIgC97PvUuR4_gbFUs5g/join ✅ One-Time Contribution Through PayPal: https://goo.gl/649HFY ✅ Cryptocurrency Donations: Bitcoin Wallet - 3MPH8oY2EAgbLVy7RBMinwcBntggi7qeG3 Ethereum Wallet - 0x151649418616068fB46C3598083817101d3bCD33 Litecoin Wallet - MPvEBY5fxGkmPQgocfJbxP6EmTo5UUXMot ✅ Corey's Public Amazon Wishlist http://a.co/inIyro1 ✅ Equipment I Use and Books I Recommend: https://www.amazon.com/shop/coreyschafer ▶️ You Can Find Me On: My Website - http://coreyms.com/ My Second Channel - https://www.youtube.com/c/coreymschafer Facebook - https://www.facebook.com/CoreyMSchafer Twitter - https://twitter.com/CoreyMSchafer Instagram - https://www.instagram.com/coreymschafer/ #Python	27	Education	PT10M14S	614	2d	hd	false	https://i.ytimg.com/vi/6iF8Xb7Z3wQ/maxresdefault.jpg	1	338213	8263	70	0	304
