position	channelId	channelTitle	videoId	publishedAt	publishedAtSQL	videoTitle	videoDescription	videoCategoryId	videoCategoryLabel	duration	durationSec	dimension	definition	caption	thumbnail_maxres	licensedContent	viewCount	likeCount	dislikeCount	favoriteCount	commentCount
32	UCg5UINpJgS4uqWZkv2Qh1Mw	Springboard India	vSN5Tn38ZIc	2020-05-30T13:40:19Z	2020-05-30 13:40:19	Deep Learning Project: Text Generation using Recurrent Neural Networks (RNNs) & Transformers in NLP	In this session, Raghav Bali, United Health Senior Data Scientist, will take you through a live hands-on of a deep learning project on text generation using recurrent neural networks (RNNs). He will explain the basics of understanding the language along with its general introduction and go on to explain how RNNs work and how we can leverage them for text generation. He will also cover different decoding strategies and supplement it with a hands-on demo using different transformers to generate better quality text. This session is your one-stop guide for text generation in NLP, involving: - Understanding Language - Understanding RNNs - Sequence to Sequence Modelling - Language Modeling - Training a Text Generator from Scratch (RNN) - Decoding Strategies like Greedy, Beam Search, Sampling, Top-k Sampling, Top-p Sampling/Nucleus Sampling - Encoder-Decoder Architecture If you're interested in receiving the access to the stepwise analysis done in this video, please share your email address in this google form https://docs.google.com/forms/d/e/1FAIpQLSdCCMofPhYZyVOGOGCwSwp1lFLOt5x9G3VdEOuqoJjO1Yn1rA/viewform and we will send it to you within 48 hours. Here are a few related blogs: Data Modelling & Analysing Coronavirus (COVID19) Spread https://bit.ly/2KzRS7a Top 10 Data Science Projects: Learn to Solve Real-World Problems with Data https://bit.ly/3aD1Q2j Top 15 Open-Source Data Science Tools to Learn in 2020 https://bit.ly/2KxoEG7 How to Build a Secure AI Chatbot Using RASA & Python https://bit.ly/3euQD61 Top 13 Data Science Interview Questions and How to Prepare for an Interview https://bit.ly/2XE5vbG Who are we? Springboard is an online learning platform that helps you master in-demand skills through a personal 1:1 mentor-led model and a project-driven curriculum. Over the last 6+ years, we have served 10K+ learners in 100+ countries. We are now in India and are offering Career Track programs in Data Science, Data Analytics and AI/ML along with job guarantee. Apply here: http://bit.ly/34JJt9D For more information, please write to us at india@springboard.com or call us at +91 8098866488 or +91 7483024694 Follow Springboard: Facebook: https://www.facebook.com/springboardind/ LinkedIn: https://www.linkedin.com/company/spri Twitter: https://twitter.com/springboard_ind Medium: https://medium.com/@springboard_ind #DeepLearning #TextGeneration #RecurrentNeuralNetworks #RNNs #YoutubeLive #LanguageModelling #Greedy #BreamSearch	27	Education	PT1H3M31S	211	2d	hd	false	https://i.ytimg.com/vi/vSN5Tn38ZIc/maxresdefault.jpg		2113	85	0	0	9
33	UCg5UINpJgS4uqWZkv2Qh1Mw	Springboard India	3agmfWNEkqc	2020-05-27T14:31:34Z	2020-05-27 14:31:34	AMA with Springboard Data Science Career Track Learner | Career Transition Journey into Data Science	Considering a level upgrade into data science field and have questions about career transition? In this AMA session, Nupanch Analytics Consultant (Data Scientist) and Springboard Alumni, Aritra Chattaraj shares his data science journey. He will share how he went from a liberal arts background to becoming a data scientist. He will touch upon his experience with Springboard's online program and will go on to explain how a 1:1 mentoring-led and project-driven course played a vital role in helping him craft a career path to data science. He is here today to answer all your questions about how you can career transition into data science in addition to sharing data science career transition tips and tricks. Please leave your questions in the comments section below and we will try our level best to answer them. Here are a few related blogs: Springboard Success Story: Testimonial by Data Science Learner Aritra Chattaraj https://bit.ly/2XCyYTn Top 13 Data Science Interview Questions and How to Prepare for an Interview https://bit.ly/2TJ2VQf How to Become a Data Scientist? https://bit.ly/2TFVxoI Data Science Career Trends in 2020 https://bit.ly/2AYB2x4 Top 10 Data Science Projects: Learn to Solve Real-World Problems with Data https://bit.ly/3gr09ZQ Which Industry Pays the Highest Data Scientist Salary? https://bit.ly/3gr0ls2 Who are we? Springboard is an online learning platform that helps you master in-demand skills through a personal 1:1 mentor-led model and a project-driven curriculum. Over the last 6+ years, we have served 10K+ learners in 100+ countries. We are now in India and are offering Career Track programs in Data Science, Data Analytics and AI/ML along with job guarantee. Apply here: http://bit.ly/34JJt9D For more information, please write to us at india@springboard.com or call us at +91 8098866488 or +91 7483024694 Follow Springboard: Facebook: https://www.facebook.com/springboardind/ LinkedIn: https://www.linkedin.com/company/spri... Twitter: https://twitter.com/springboard_ind Medium: https://medium.com/@springboard_ind #AMA #DataScience #DataScientist #DataScientistJobs #DataScienceLearner #FutureTechnologies #DataScienceResume #DataScienceInterview #CareerTransition #CareerAdvice	27	Education	PT1H24M5S	1445	2d	hd	false	https://i.ytimg.com/vi/3agmfWNEkqc/maxresdefault.jpg		1174	34	0	0	5
34	UCg5UINpJgS4uqWZkv2Qh1Mw	Springboard India	0LwB41-dKOA	2020-05-23T13:44:06Z	2020-05-23 13:44:06	Technical AMA: How to get Machine Learning Jobs | How to Become a ML Engineer -By Unilever ML Leader	Wish to become an ML Engineer? Then this YouTube live is for you. In this much-awaited technical AMA, Unilever ML Leader, Devesh Raj will explain how to get machine learning jobs in addition to sharing valuable interview & resume building tips. He will answer your burning career change questions such as 'who should opt for machine learning', 'can freshers can get into machine learning', 'What are the various machine learning roles one can apply to' and 'how can one make a career transition into machine learning'. He will also take you through machine learning career transition tips and tricks in addition to answering commonly asked questions. Please leave your questions in the comments section below and we will try our level best to answer them. Here are a few blogs related to the topic: How to Get Machine Learning Jobs? http://bit.ly/32AX42J How to make a resume for machine learning jobs? http://bit.ly/399xg0c How to Become a Machine Learning Engineer? http://bit.ly/39bhgL5 Entry Level Machine Learning Jobs for Freshers http://bit.ly/2wj0mLR Machine Learning Jobs Description For ML Engineers http://bit.ly/39aOp9A Who are we? Springboard is an online learning platform that helps you master in-demand skills through a personal 1:1 mentor-led model and a project-driven curriculum. Over the last 6+ years, we have served 10K+ learners in 100+ countries. We are now in India and are offering Career Track programs in Data Science, Data Analytics and AI/ML along with job guarantee.Apply here: http://bit.ly/34JJt9DFor more information, please write to us at india@springboard.com or call us at +91 8098866488 or +91 7483024694 Follow Springboard: Facebook: https://www.facebook.com/springboardind/ LinkedIn: https://www.linkedin.com/company/spri... Twitter: https://twitter.com/springboard_indMedium: https://medium.com/@springboard_ind #AMA #TechnicalAMA #MachineLearning #MachineLearningJobs #MachineLearningCareer #FutureTechnologies #MachineLearningResume #MachineLearningInterview #CareerTransition #CareerAdvice	27	Education	PT1H24S	24	2d	hd	false	https://i.ytimg.com/vi/0LwB41-dKOA/maxresdefault.jpg		1462	48	1	0	3
35	UCg5UINpJgS4uqWZkv2Qh1Mw	Springboard India	9-HKxxgbsJ8	2020-05-23T01:44:36Z	2020-05-23 01:44:36	Recommender System with Python: Collaborative filtering for Movie Recommendation System	Working from home and binge-watching Netflix but have you ever wondered how Netflix makes these recommendations? How does an e-commerce website display options such as "Frequently Bought Together"? In this session, by Joveo Data Scientist, Batul Bombaywala, find out what are recommender systems and how we can build a simple recommender system in Python. She also explains how collaborative filtering works for movie recommendation systems. Website recommendations may look relatively simple but behind the scenes, a complex statistical algorithm executes in order to predict these recommendations. If you're interested in receiving the stepwise analysis explained in this session please share your email address in this google form https://docs.google.com/forms/d/e/1FAIpQLScMV_yzgH5LwMF7kW1i16IuCvvqZ4T01I45c68svzrdfSi3YA/viewform and we will send it to you in 48 hours. Most big tech companies use a Recommender System in one way or another. You can find them anywhere from Amazon (product recommendations) to YouTube (video recommendations) to Facebook (friend recommendations). The ability to recommend relevant products or services to users can be a huge boost for a company, which is why it's so common to find this technique employed on so many sites. Learning about these systems will help you gain an advantage and help you work on hands-on projects that can make your data science resume attractive. Here are a few related blogs on the topic: How Netflix’s Recommendation Engine Works? https://bit.ly/2ZrOgwt Top 10 Machine Learning Applications https://bit.ly/3edf9sr Data Modelling & Analysing Coronavirus (COVID19) Spread https://bit.ly/2KzRS7a Top 10 Data Science Projects: Learn to Solve Real-World Problems with Data https://bit.ly/3aD1Q2j Top 15 Open-Source Data Science Tools to Learn in 2020 https://bit.ly/2KxoEG7 Who are we? Springboard is an online learning platform that helps you master in-demand skills through a personal 1:1 mentor-led model and a project-driven curriculum. Over the last 6+ years, we have served 10K+ learners in 100+ countries. We are now in India and are offering Career Track programs in Data Science, Data Analytics and AI/ML along with job guarantee. Apply here: http://bit.ly/34JJt9D For more information, please write to us at india@springboard.com or call us at +91 8098866488 or +91 7483024694 Follow Springboard: Facebook: https://www.facebook.com/springboardind/ LinkedIn: https://www.linkedin.com/company/springboard-india/ Twitter: https://twitter.com/springboard_ind Medium: https://medium.com/@springboard_ind #DataScience #RecommenderSystem #CollaborativeFiltering #MovieRecommenderSystem #DataScienceProject #DataScienceCaseStudy #Python #Netflix #Amazon #Walmart #RecommendationEngine	27	Education	PT1H9M6S	546	2d	hd	false	https://i.ytimg.com/vi/9-HKxxgbsJ8/maxresdefault.jpg		4632	122	3	0	24
36	UCg5UINpJgS4uqWZkv2Qh1Mw	Springboard India	V366fyOAnRk	2020-05-21T01:48:33Z	2020-05-21 01:48:33	Career Coaching AMA #3: How to Apply for AI Jobs & Machine Learning Jobs During Coronavirus Outbreak	Wondering how COVID 19 is going to affect the AI and machine learning field? Get all your AI and machine learning job-related questions answered by a renowned industry expert along with interview & resume building tips! In this much-awaited AMA session, Springboard Career Coach, Sreehari Ravindranath will explain how AI and machine learning industry will change post COVID 19 and how to build your career path to AI and machine learning jobs. He will answer burning questions such as 'who should opt for AI and machine learning', if 'AI engineer' or 'machine learning engineer' are considered as good job profiles in India and 'how can one make a career transition into AI and machine learning'. He will also take you through AI and machine learning career transition tips and tricks in addition to answering commonly asked questions. Please leave your questions in the comment section below and we will try our level best to answer them. How to Get Machine Learning Jobs? http://bit.ly/32AX42J How to make a resume for machine learning jobs? http://bit.ly/399xg0c How to Become a Machine Learning Engineer? http://bit.ly/39bhgL5 Entry Level Machine Learning Jobs for Freshers http://bit.ly/2wj0mLR Machine Learning Jobs Description For ML Engineers http://bit.ly/39aOp9A Who are we? Springboard is an online learning platform that helps you master in-demand skills through a personal 1:1 mentor-led model and a project-driven curriculum. Over the last 6+ years, we have served 10K+ learners in 100+ countries. We are now in India and are offering Career Track programs in Data Science, Data Analytics and AI/ML along with job guarantee.Apply here: http://bit.ly/34JJt9DFor more information, please write to us at india@springboard.com or call us at +91 8098866488 or +91 7483024694 Follow Springboard: Facebook: https://www.facebook.com/springboardind/ LinkedIn: https://www.linkedin.com/company/springboard-india/ Twitter: https://twitter.com/springboard_ind Medium: https://medium.com/@springboard_ind#AMA #MachineLearning #ArtificialIntelligence #MachineLearningJobs #ArtificialIntelligenceJobs #AIJobs #FutureTechnologies #MachineLearningResume #ArtificialIntelligenceResume #MachineLearningInterview #CareerTransition #CareerAdvice	27	Education	PT1H10M	600	2d	hd	false	https://i.ytimg.com/vi/V366fyOAnRk/maxresdefault.jpg		1188	45	1	0	4
37	UCg5UINpJgS4uqWZkv2Qh1Mw	Springboard India	2NZiRh16TrY	2020-05-17T02:01:02Z	2020-05-17 02:01:02	Data Science Interview Questions & Best Way to Answer Them #2: How to Crack a Data Science Interview	Preparing for your next data science interview? Here's your one-stop guide to the top data science interview questions that might come your way and the best way to answer them. In this session, Mitesh Gupta, Senior Data Scientist at Digite & mentor at Springboard, brings you a list of 15 most asked data science interview questions and the best answers for them. He will also discuss crucial interview tips such as 'what do interviewers expect from you', 'what exactly do you need to prepare for' along with a few tips and tricks on 'how to crack a data science interview'. Getting a data scientist job is neither a herculean task nor a cakewalk; all you need is the right approach. Acing your data science interview is the first step to rewarding and lucrative data scientist jobs and this session prepares you for it. This video is suitable both for technology professionals who are just starting off with data science tutorials and also for those who are preparing for data science jobs. You will also find expert tips on building a data scientist resume in this live session. How to Become a Data Scientist? http://bit.ly/2tW1nZy Top 13 Data Science Interview Questions and How to Prepare for an Interview: https://bit.ly/2Z9XiOD What are the required skills for data science? http://bit.ly/2SkS9iX What Does a Data Scientist Do? http://bit.ly/2Hi15PL Data Scientist Job Descriptions: How to write an effective Data Scientist resume? http://bit.ly/2SipGKB Top 15 Open-Source Data Science Tools to Learn in 2020 http://bit.ly/2HpWkDL Who are we? Springboard is an online learning platform that helps you master in-demand skills through a personal 1:1 mentor-led model and a project-driven curriculum. Over the last 6+ years, we have served 10K+ learners in 100+ countries. We are now in India and are offering Career Track programs in Data Science, Data Analytics, AI/ML and UI/UX Design along with job guarantee. Apply here: http://bit.ly/34JJt9D For more information, please write to us at india@springboard.com or call us at +91 8098866488 or +91 7483024694 Follow Springboard: Facebook: https://www.facebook.com/springboardind/ LinkedIn: https://www.linkedin.com/company/spri Twitter: https://twitter.com/springboard_ind Medium: https://medium.com/@springboard_ind #DataScience #DataScientist #DataScientistJobs #DataScientistSalary #DataScienceResume #ResumeBuilding #DataScienceJobs #CareerAdvice #CareerTransition #CareerPath #Digite	27	Education	PT1H22M33S	1353	2d	hd	false	https://i.ytimg.com/vi/2NZiRh16TrY/maxresdefault.jpg		2495	103	6	0	5
38	UCg5UINpJgS4uqWZkv2Qh1Mw	Springboard India	h9AEJkc8OTw	2020-05-14T01:35:19Z	2020-05-14 01:35:19	Career Coaching AMA #2: Career Path to Data Analytics Jobs - By Springboard Career Coach	Get all your data analytics job-related questions answered by a renowned industry expert along with interview & resume building tips! In this much-awaited AMA session, Springboard Career Coach, Suma Koralgundi will explain how to build your career path to data analytics jobs. She will answer burning questions such as 'who should opt for data analytics', 'if "data analyst" is considered a good job profile in India' and 'how one can one career transition into the data analytics field'. She will also take you through data analytics career transition tips and tricks in addition to answering commonly asked questions. Please leave your questions in the comment section below and we will try our level best to get them answered. How To Take Your Data Analytics Skills Up A Notch By Learning Soft Skills https://bit.ly/2AoEhha How to Become a Freelance Data Analyst? https://bit.ly/3fLxHBq A Guide to Entry Level Data Analyst Salary And How to Negotiate https://bit.ly/3fJpwWw Appraisal 2020: Top Success Tips for IT Professionals https://bit.ly/2Lntx51 Top 6 Tips to Crack a Data Analytics Interview https://bit.ly/3dS5rvt Who are we? Springboard is an online learning platform that helps you master in-demand skills through a personal 1:1 mentor-led model and a project-driven curriculum. Over the last 6+ years, we have served 10K+ learners in 100+ countries. We are now in India and are offering Career Track programs in Data Science, Data Analytics and AI/ML along with job guarantee. Apply here: http://bit.ly/34JJt9D For more information, please write to us at india@springboard.com or call us at +91 8098866488 or +91 7483024694 Follow Springboard: Facebook: https://www.facebook.com/springboardind/ LinkedIn: https://www.linkedin.com/company/spri Twitter: https://twitter.com/springboard_ind Medium: https://medium.com/@springboard_ind #AMA #DataAnalytics #DataAnalyticsJobs #DataAnalyticsCareer #DataAnalyticsResume #DataAnalyticsInterview #DataAnalyticsPortfolio #CareerTransition #CareerAdvice	27	Education	PT1H1M5S	65	2d	hd	false	https://i.ytimg.com/vi/h9AEJkc8OTw/maxresdefault.jpg		1336	33	1	0	3
39	UCg5UINpJgS4uqWZkv2Qh1Mw	Springboard India	Nk9K4s8g9yQ	2020-05-09T02:08:46Z	2020-05-09 02:08:46	How to Create Conversational AI Chatbot using RASA (Python) by Cisco Data Scientist	Wishing for a machine learning project that requires minimal coding? Look no further, in this session, find out how to create a conversational AI chatbot using the RASA framework from a live demo by a Cisco Data Scientist. We will understand the basic components and concepts of chatbot creation through a real-world example. We will be covering concepts like Intents, Entities, Stories, Domain, Actions, etc. We will further learn how to deploy a chatbot on a popular messaging platform like Slack. If you're interested in receiving the stepwise analysis explained in this session please share your email address in this google form https://docs.google.com/forms/d/e/1FAIpQLScvGMCqVlQFioDAuilACfTwvyC5dIYVGkVcag7fswmmbVsD7w/viewform and we will send it to you in 24 hours. We have published a series of detailed blogs on the topic. Below are the links 1. https://in.springboard.com/blog/chatbot-using-rasa/ 2. https://in.springboard.com/blog/ai-chatbot-using-rasa/ 3. https://in.springboard.com/blog/best-ai-chatbot-using-rasa/ Who are we? Springboard is an online learning platform that helps you master in-demand skills through a personal 1:1 mentor-led model and a project-driven curriculum. Over the last 6+ years, we have served 10K+ learners in 100+ countries. We are now in India and are offering Career Track programs in Data Science, Data Analytics and AI/ML along with job guarantee. Apply here: http://bit.ly/34JJt9D For more information, please write to us at india@springboard.com or call us at +91 8098866488 or +91 7483024694 Follow Springboard: Facebook: https://www.facebook.com/springboardind/ LinkedIn: https://www.linkedin.com/company/springboard-india/ Twitter: https://twitter.com/springboard_ind Medium: https://medium.com/@springboard_ind #MachineLearningProject #Chatbot #RASA #AIChatbot #NaturalLangugeProcessing #RasaFramework #MachineLearningProject #CareerAdvice #YoutubeLive	27	Education	PT1H26M27S	1587	2d	hd	false			4673	107	2	0	6
40	UCg5UINpJgS4uqWZkv2Qh1Mw	Springboard India	gvz-FbWXIGg	2020-05-06T13:41:51Z	2020-05-06 13:41:51	Exploratory Data Analysis Using Python: Hands-On Live Demo by Flipkart Data Scientist	In this session, master data analysis using Python from a live demo by a Flipkart ML Decision Scientist. He will help you understand Exploratory Data Analysis by taking a problem, exploring each variable in the problem along with their meaning and importance using Python. We will do univariate analysis by understanding the target / dependent variable that is ('SalePrice') and multivariate analysis in order to understand how the target/dependent variable and independent variables interact. We will further do basic cleaning of the dataset and handle the missing data, outliers, and transform the categorical variable. We will also have test assumptions to check if data is meeting the assumptions that are required by most multivariate techniques. We will be using the following data science libraries - NumPy, Matplotlib, Seaborn, SciPy, and Scikit-Learn. Here is the dataset that we are using in this session: https://www.kaggle.com/c/house-prices-advanced-regression-techniques/ If you're interested in receiving the access to stepwise analysis of exploratory data analysis, please share your email address in this google form https://docs.google.com/forms/d/e/1FAIpQLSefNve_39AFrP9esmFLR-48hIC_Bn8UpAsIPmHncm3yODp0uw/viewform and we will send it to you within 24 hours. Who are we? Springboard is an online learning platform that helps you master in-demand skills through a personal 1:1 mentor-led model and a project-driven curriculum. Over the last 6+ years, we have served 10K+ learners in 100+ countries. We are now in India and are offering Career Track programs in Data Science, Data Analytics and AI/ML along with job guarantee. Apply here: http://bit.ly/34JJt9D For more information, please write to us at india@springboard.com or call us at +91 8098866488 or +91 7483024694 Follow Springboard: Facebook: https://www.facebook.com/springboardind/ LinkedIn: https://www.linkedin.com/company/spri Twitter: https://twitter.com/springboard_ind Medium: https://medium.com/@springboard_ind #DataScience #ExploratoryDataAnalysis #DataScienceTutorial #DataScientistJobs #DataScienceCareer #CareerAdvice #YoutubeLive	27	Education	PT1H3M51S	231	2d	hd	false	https://i.ytimg.com/vi/gvz-FbWXIGg/maxresdefault.jpg		4574	178	6	0	31
41	UCg5UINpJgS4uqWZkv2Qh1Mw	Springboard India	ZxR38An5TQE	2020-05-01T13:47:49Z	2020-05-01 13:47:49	NLP Project: Automated Question Answering from FAQs Using Word-Embeddings	In this session we will build a question answering system to automatically answer questions by the end user through looking up the FAQs and retrieving the closest question and answer as appropriate. In this NLP python task, you will learn basic text processing and ways to compute sentence similarity. We will start with simple representations of a sentence like the bag of words and move on to more sophisticated text embeddings such as word2vec and glove. If time permits, we might also examine more state of the art embedding techniques in NLP for this task. If you're interested in receiving the access to stepwise analysis done in this video, please share your email address in this google form https://docs.google.com/forms/d/e/1FAIpQLSftPocVKOMqioOK66wl0Zo7kyA_jCXmiQWZ-rLtliGYxcvNKQ/viewform and we will send it to you within 48 hours. Data Modelling & Analysing Coronavirus (COVID19) Spread https://bit.ly/2KzRS7a Top 10 Data Science Projects: Learn to Solve Real-World Problems with Data https://bit.ly/3aD1Q2j Top 15 Open-Source Data Science Tools to Learn in 2020 https://bit.ly/2KxoEG7 Who are we? Springboard is an online learning platform that helps you master in-demand skills through a personal 1:1 mentor-led model and a project-driven curriculum. Over the last 6+ years, we have served 10K+ learners in 100+ countries. We are now in India and are offering Career Track programs in Data Science, Data Analytics and AI/ML along with job guarantee. Apply here: http://bit.ly/34JJt9D For more information, please write to us at india@springboard.com or call us at +91 8098866488 or +91 7483024694 Follow Springboard: Facebook: https://www.facebook.com/springboardind/ LinkedIn: https://www.linkedin.com/company/spri Twitter: https://twitter.com/springboard_ind Medium: https://medium.com/@springboard_ind #NaturalLangaugeProcessing #NLPProject #Word2vec #Glove #MachineLearning #NLP #YoutubeLive	27	Education	PT57M51S	3471	2d	hd	false			4573	144	3	0	82
