position	channelId	channelTitle	videoId	publishedAt	publishedAtSQL	videoTitle	videoDescription	videoCategoryId	videoCategoryLabel	duration	durationSec	dimension	definition	caption	thumbnail_maxres	licensedContent	viewCount	likeCount	dislikeCount	favoriteCount	commentCount
65	UCg5UINpJgS4uqWZkv2Qh1Mw	Springboard India	SRaVsOl-kYc	2020-01-24T13:26:42Z	2020-01-24 13:26:42	Artificial Intelligence and Data Science Jobs Explained by real-life Data Scientists	Wondering what's the best way to prepare for Artificial Intelligence or Data Science jobs? Here is a video with the best job advice from subject matter experts Nayan Gupta and Lavanya Tekumalla. Listen to these data scientists sharing advice on how to get AI and data science jobs. They also explain various career opportunities and roles available in Artificial Intelligence and Data Science fields. This video is a handy expert guide if you are planning to transition into artificial intelligence or data science career track. Subscribe to our channel to get updates on the latest videos. Hit the subscribe button now! http://bit.ly/36DfiCy Data Scientist Job Descriptions: How to write an effective Data Scientist resume http://bit.ly/2RqlZ5k High-paying Tech Jobs for 2020 http://bit.ly/2Gmzcpn How to make a resume for machine learning jobs? http://bit.ly/30QnYCR Who are we? Springboard is an online learning platform that helps you master in-demand skills through a personal 1:1 mentor-led model and a project-driven curriculum. Over the last 6+ years, we have served 10K+ learners in 100+ countries. We are now in India and are offering Career Track programs in Data Science, Data Analytics and AI/ML along with job guarantee. Apply here: http://bit.ly/34JJt9D For more information, please write to us at india@springboard.com or call us at +91 8098866488 or +91 7483024694 Follow Springboard: Facebook: https://www.facebook.com/springboardind/ LinkedIn: https://www.linkedin.com/company/spri Twitter: https://twitter.com/springboard_ind Medium: https://medium.com/@springboard_ind #DataScience #ArtificialIntelligence #MachineLearning #DataScienceCareer #DataScienceJobs #ArtificialIntelligenceCareer #MachineLearningCareer #CareerAdvice So I think there are a lot of different types of career opportunities for people interested in data science. Right from data engineers to ML engineers to data scientists to machine learning scientists to data analysts and even business analysts. And there is often confusing which role to pick. People often say I come from a certain background and not sure which path to take and I think having a mentor really helps in these situations to figure out what opportunities to pursue given a particular background and what is the course of action to be taken to reach there. While a lot of data is available online, in fact, to pick up data science, mentorships even helps to understand you know keep track of progress and get a more high-level idea on what are the kind of project you want to do if you want to land in a certain kind of job and also what are the kind of domains you want to pick based on your experience. So I think having a mentor and having a little bit of that extra advice goes a long way in making the right decision. So there are multiple types of roles in the data science industry and there is a lot of confusion around them, so let me clear that out. Data science is a multidisciplinary field which involves skills from statistics, probability, machine learning, software engineering and combinations of these result in different titles and roles which might confuse people. Broadly there are roles like data engineer, infrastructure engineer, so their roles are not typically data science roles but they are more of a support system around data scientists. They help data scientist do their job. So when it comes to data science there are three categories, even though there is still confusion around them but gradually some clarity is coming up. So data science role, there are three roles. The first role is a data analyst role, the data analyst is a person who is responsible for reporting, summarizing data, using basic statistics in SQL and Python to help business decision-makers take those decisions and also help data scientist do that projects. So typically this role is..companies do hire for these roles, almost every company hire for this kind of role. The second role is more of a data scientist which goes a little deeper into the problem. They work on problems like fraud detection, recommender system where they work with much more scientific rigor than a data analyst. The typical skills which are required to do this thing are statistics, programming languages, machine learning and etc. But these people don’t have a strong background in software engineering so in a product based setup they pair up with a machine learning engineer to put that model into production which brings me to the third part which is the machine learning engineer. Machine learning engineer is a person who has a strong foundation in software engineering but also understands machine learning so that they can put the, in a product based setup these people can put machine learning models into production integrate with the core software. So coming to the companies that hire for these kinds of roles, so companies are hiring for data analysts also, data scientists also, machine learning engineers also.	27	Education	PT4M5S	245	2d	sd	true	https://i.ytimg.com/vi/SRaVsOl-kYc/maxresdefault.jpg		3228	88	1	0	10
66	UCg5UINpJgS4uqWZkv2Qh1Mw	Springboard India	UiBoBEN0HLM	2020-01-22T15:38:38Z	2020-01-22 15:38:38	Artificial Intelligence and Data Science Skills explained by Real-Life Data Scientists	Dreaming to build your career in Data Science and Artificial Intelligence space? Here is a video with the best advice from subject matter experts. Listen to these data scientists who shares the prerequisites and skills required to become a data scientist. This video is a handy expert guide if you are planning to transition into a data science career track. Subscribe to our channel to get updates on the latest videos. Hit the subscribe button now! http://bit.ly/36DfiCy Who is data science for? http://bit.ly/33M0a2T What are the required skills for data science? http://bit.ly/2qnTFFY What does Machine Learning Engineer do? http://bit.ly/2Yeewry Who are we? Springboard is an online learning platform that helps you master in-demand skills through a personal 1:1 mentor-led model and a project-driven curriculum. Over the last 6+ years, we have served 10K+ learners in 100+ countries. We are now in India and are offering Career Track programs in Data Science, Data Analytics and AI/ML along with job guarantee. Apply here: http://bit.ly/34JJt9D For more information, please write to us at india@springboard.com or call us at +91 8098866488 or +91 7483024694 Follow Springboard: Facebook: https://www.facebook.com/springboardind/ LinkedIn: https://www.linkedin.com/company/spri Twitter: https://twitter.com/springboard_ind Medium: https://medium.com/@springboard_ind #DataScience #ArtificialIntelligence #MachineLearning #DataScienceCareer#DataScienceJobs #ArtificialIntelligenceCareer #MachineLearningCareer #CareerAdvice #WednesdayWisdom	27	Education	PT2M46S	166	2d	sd	true			1527	62	0	0	7
67	UCg5UINpJgS4uqWZkv2Qh1Mw	Springboard India	5pzkcZXh5bg	2020-01-17T12:05:19Z	2020-01-17 12:05:19	Women in STEM | Journey into Data Science	What is it like to be a woman data scientist? Why does data science space need more women? In this video, hear real-life data scientists explain how it feels to be women in the data science field. They will also talk about their journey in data science. Find out here how amazing it is to be a part of women in STEM. You can view the full interview here: http://bit.ly/2NCAjoR and http://bit.ly/367N9C9 Subscribe to our channel to get updates on the latest videos. Hit the subscribe button now! http://bit.ly/36DfiCy #DataScience #DataScientist #WomeninDataScience #WomeninTech #STEM #DataScienceJobs #DataScienceSalary #DataScienceCareer Who is data science for? http://bit.ly/332TNrM What are the required skills for data science? http://bit.ly/2XxJL0z What does a data scientist do? http://bit.ly/346YAtp Who are we? Springboard is an online learning platform that helps you master in-demand skills through a personal 1:1 mentor-led model and a project-driven curriculum. Over the last 6+ years, we have served 10K+ learners in 100+ countries. We are now in India and are offering Career Track programs in Data Science, Data Analytics and AI/ML along with job guarantee. Apply here: http://bit.ly/2pzA1pY For more information, please write to us at india@springboard.com or call us at +91 8098866488 or +91 7483024694 Follow Springboard: Facebook: https://www.facebook.com/springboardind/ LinkedIn: https://www.linkedin.com/company/spri Twitter: https://twitter.com/springboard_ind Medium: https://medium.com/@springboard_ind Hi, my name is Indira. I am a senior data scientist with Brillio. I started off my career as an application developer at IBM, a few months in Accenture and then I moved on to Harman. My entry into data science happened in the year 2014. So I still remember the first time that a senior member from my team came and spoke to me about the titanic data set, titanic problem. She said I can predict if you would have survived the Titanic crash. I just laughed it out on her face. She was damn serious but I was like how can you even do that? So that’s when she started explaining to me what machine learning is, about what data science is. So that kind of piqued my interest in this field of machine learning and data science. So I was into .NET back then so I had my deliverables and projects and all that but then I was in my heart I was convinced that I should be doing this. I should have to, even if I don’t succeed it’s fine but I wanted to try this out and find out if it is for me. So that’s the day I decided and I started putting my effort into learning r, I have a pretty good programming background. I am a computer science engineer, so I started learning r. I went back 10 years through my career and I started learning maths and statistics and fundamentals of calculus, algebra, linear algebra and all that. So believe me it was not an overnight thing. I took almost one year to actually start thinking like a data scientist, looking at data like how a data scientist would look at data in order to get things. So slowly it so happens that I was lucky enough to get an opportunity within my own project. They introduced the analytics component into my project and I slowly started getting involved in their team meetings and stuff like that. And at some point when I was able to prove, my manager believed that I could go further in it. So that is my journey into machine learning. To all those people who are aspiring to be data scientists, like I said it’s not an overnight job, you have to work hard, you have to work smart, you will be there one day. Hi this is Chirasmita, I have been working in the field of data science from last 5 years and I started my career with healthcare insurance and moved to people analytics, semiconductor analytics and then healthcare R&D and now I have moved to smaller roles where I am trying to set up teams, data science teams for different start-ups across Bangalore. The journey has been pretty rewarding for me like it basically stemmed out from the fear of missing out, from like I didn’t want to go for an IT role when I was graduating from an engineering background. So that’s when IBM was launching into big data, it was just a catchphrase and it just caught me and I wanted to know more about it. So I just went for a The Grace Hopper Celebration scholarship and then that’s when it really started that I pursued a Yahoo researcher who took me as an intern and we built a recommendation system as part of my internship. And post that I got my first job offer with opera solutions and it was into healthcare consulting and I think I have been challenged to work as day to day in various aspects of problems using tech data, very messy data, noisy data and using lot of imaging problems. So learning to apply and adapt and see where the industry is heading has been pretty challenging. And it’s like you really need to be on your feet all the time so there is this always like.	27	Education	PT4M44S	284	2d	sd	true	https://i.ytimg.com/vi/5pzkcZXh5bg/maxresdefault.jpg		1485	49	0	0	7
68	UCg5UINpJgS4uqWZkv2Qh1Mw	Springboard India	KFQSJeabML0	2020-01-15T13:32:11Z	2020-01-15 13:32:11	Data Science And Artificial Intelligence Career Advice | Volume 6	Wish to build your career in Data Science and Artificial Intelligence space? Here is a video with the best advice from PhonePe Data Scientist. Listen to her share tips on how to become a data scientist and how to crack a data science interview or an artificial intelligence interview along with advice on how to make a career transition into AI, Machine Learning and Data Science. Subscribe to our channel to get updates on the latest videos. Hit the subscribe button now! http://bit.ly/36DfiCy Who is data science for? http://bit.ly/33M0a2T What are the required skills for data science? http://bit.ly/2qnTFFY What does Machine Learning Engineer do? http://bit.ly/2Yeewry Who are we? Springboard is an online learning platform that helps you master in-demand skills through a personal 1:1 mentor-led model and a project-driven curriculum. Over the last 6+ years, we have served 10K+ learners in 100+ countries. We are now in India and are offering Career Track programs in Data Science, Data Analytics and AI/ML along with job guarantee. Apply here: http://bit.ly/34JJt9D For more information, please write to us at india@springboard.com or call us at +91 8098866488 or +91 7483024694 Follow Springboard: Facebook: https://www.facebook.com/springboardind/ LinkedIn: https://www.linkedin.com/company/spri Twitter: https://twitter.com/springboard_ind Medium: https://medium.com/@springboard_ind #DataScience #ArtificialIntelligence #MachineLearning #DataScienceCareer#DataScienceJobs #ArtificialIntelligenceCareer #MachineLearningCareer #CareerAdvice #WednesdayWisdom	27	Education	PT4M33S	273	2d	sd	false			2487	84	0	0	14
69	UCg5UINpJgS4uqWZkv2Qh1Mw	Springboard India	uRtxvOhHpHM	2020-01-08T13:04:36Z	2020-01-08 13:04:36	Data Science And Artificial Intelligence Career Advice | Volume 5	Wish to build your career in Data Science and Artificial Intelligence space? Here is a video with the best advice from subject matter experts. Listen to these data scientists share tips on how to become a data scientist and how to crack a data science interview or an artificial intelligence interview along with advice on how to make a career transition into AI, Machine Learning and Data Science. Subscribe to our channel to get updates on the latest videos. Hit the subscribe button now! http://bit.ly/36DfiCy Who is data science for? http://bit.ly/33M0a2T What are the required skills for data science? http://bit.ly/2qnTFFY What does Machine Learning Engineer do? http://bit.ly/2Yeewry Who are we? Springboard is an online learning platform that helps you master in-demand skills through a personal 1:1 mentor-led model and a project-driven curriculum. Over the last 6+ years, we have served 10K+ learners in 100+ countries. We are now in India and are offering Career Track programs in Data Science, Data Analytics and AI/ML along with job guarantee. Apply here: http://bit.ly/34JJt9D For more information, please write to us at india@springboard.com or call us at +91 8098866488 or +91 7483024694 Follow Springboard: Facebook: https://www.facebook.com/springboardind/ LinkedIn: https://www.linkedin.com/company/spri Twitter: https://twitter.com/springboard_ind Medium: https://medium.com/@springboard_ind #DataScience #ArtificialIntelligence #MachineLearning #DataScienceCareer#DataScienceJobs #ArtificialIntelligenceCareer #MachineLearningCareer #CareerAdvice #WednesdayWisdom	27	Education	PT7M33S	453	2d	sd	true	https://i.ytimg.com/vi/uRtxvOhHpHM/maxresdefault.jpg		2032	65	2	0	18
70	UCg5UINpJgS4uqWZkv2Qh1Mw	Springboard India	GHWiJMwT9s8	2020-01-03T15:02:42Z	2020-01-03 15:02:42	Online learning programs for Data Science, Data Analytics, AI, ML | Which One to Choose	In this video, Sahas Gulati, Program Director at Springboard explains various mentor-led career track courses in Data Science, Data analytics, AI and ML offered by Springboard India. In this video, you will get to learn how to choose which career track is right for you along with the job opportunities these career tracks prepare you for. Subscribe to our channel to get updates on the latest videos. Hit the subscribe button now! http://bit.ly/36DfiCy Why Choose Springboard India Online Learning for Data Science, AI, Machine Learning, Data Analytics? http://bit.ly/2PFGn1m What are the required skills for data science?﻿ http://bit.ly/2PfZA9E How to Get Artificial Intelligence Jobs? http://bit.ly/2FlOJoF Top Data Science Datasets and Ideas for Machine Learning and Analytics Projects: http://bit.ly/2RQL7Tg Who are we? Springboard is an online learning platform that helps you master in-demand skills through a personal 1:1 mentor-led model and a project-driven curriculum. Over the last 6+ years, we have served 10K+ learners in 100+ countries. We are now in India and are offering Career Track programs in Data Science, Data Analytics and AI/ML along with job guarantee. Apply here: http://bit.ly/34JJt9D For more information, please write to us at india@springboard.com or call us at +91 8098866488 or +91 7483024694 Follow Springboard: Facebook: https://www.facebook.com/springboardind/ LinkedIn: https://www.linkedin.com/company/spri Twitter: https://twitter.com/springboard_ind Medium: https://medium.com/@springboard_ind #DataScience #DataAnalytics #MachineLearning #ArtificialIntelligence #CareerTransition #Jobs	27	Education	PT2M55S	175	2d	hd	false	https://i.ytimg.com/vi/GHWiJMwT9s8/maxresdefault.jpg		2451	81	4	0	7
71	UCg5UINpJgS4uqWZkv2Qh1Mw	Springboard India	2Ho6FsmJGdY	2020-01-01T12:01:18Z	2020-01-01 12:01:18	Data Science and Artificial Intelligence Career Advice | Volume 4	Wish to build your career in Data Science and Artificial Intelligence? Here is a video with the best advice from subject matter experts. Listen to these data scientists share tips on how to become a data scientist and how to crack a data science interview or an artificial intelligence interview along with advice on how to make a career transition into AI, Machine Learning and Data Science. 0:33 Data Science Career Advice by Youplus Data Scientist 1:29 Data Science Career Advice by Gramener Data Scientist 4:06 Artificial Intelligence Career Advice by Swiggy VP-Head of Applied Research Subscribe to our channel to get updates on the latest videos. Hit the subscribe button now! http://bit.ly/36DfiCy Who is data science for? http://bit.ly/33M0a2T What are the required skills for data science? http://bit.ly/2qnTFFY What does Machine Learning Engineer do? http://bit.ly/2Yeewry Who are we? Springboard is an online learning platform that helps you master in-demand skills through a personal 1:1 mentor-led model and a project-driven curriculum. Over the last 6+ years, we have served 10K+ learners in 100+ countries. We are now in India and are offering Career Track programs in Data Science, Data Analytics and AI/ML along with job guarantee. Apply here: http://bit.ly/34JJt9D For more information, please write to us at india@springboard.com or call us at +91 8098866488 or +91 7483024694 Follow Springboard: Facebook: https://www.facebook.com/springboardind/ LinkedIn: https://www.linkedin.com/company/spri Twitter: https://twitter.com/springboard_ind Medium: https://medium.com/@springboard_ind #DataScience #ArtificialIntelligence #MachineLearning #DataScienceCareer#DataScienceJobs #ArtificialIntelligenceCareer #MachineLearningCareer #CareerAdvice #WednesdayWisdom Hey everyone, many of you have reached out to us to seek advice on a career transition into the field of data science, artificial intelligence, machine learning, and data analytics. In this video today we bring you the best career and interview advice from the real-life data scientists but before we get started do not forget to subscribe to the Springboard India channel to stay updated on the upcoming interviews with real-life data practitioners. Hi, my name is Shweta, and I am a data scientist at Youplus. I build products using natural language processing and deep learning. A lot of data science aspirants have asked me this question that how can they successfully transition into a data science job if they have started as a data analyst or as a software engineer and once they have decided to pursue data science, what I suggest would be you know you should identify where your strengths are, whether it is machine learning, whether it is inferential statistics or exploratory data analysis that you are interested in and the hone those skills and I think mentor, a good mentor can help the learner identify strengths and in the long run how this helps the learner is that they can build a lifelong relationship with the mentor and they can be available for them for making future career decisions as well. Hi, my name is Jaidev Deshpande. I work as a senior data scientist at Gramener where we build tools and applications that help people narrate stories with data with machine learning and we help people extract insights out of their data. So there is nobody who doesn’t use data science. It’s ubiquitous, it's omnipresent, it’s everywhere and also equally importantly there is no specific skills as such that are inherent in people that make them a good data scientist. So whatever is required to be a good data scientist can be found in anybody and in fact, I don’t think we should even call them skills. Most of the things or the prerequisites that are required for being a good data scientist or for practicing data science, they are more like habits, they are not skills. So the more you practice programming, the more you practice mathematics, the more you practice statistics the better you are at it and all of these things can be learned. There is nothing that can not be taught, there is nothing that can not be learned. I don’t think there is anything inherent about a data scientist that distinguishes them from the remainder of the people. In fact so much so that I believe that people are learning data science at a younger age, soon this is going to become a fairly common skill in a lot of people. So, ya we are definitely on the right path over there. As far as mentorship is concerned I believe that when you are learning data science when you begin to learn data science, you tend to get a little lonely. There are very few people in your friend circle, family, around you in general who are working on the same problems as you are, who are interested in the same problems as you are. So simply having somebody to talk to is more than half the battle won, that helps a lot. And secondly, you can always learn from the mentors’ experience.	27	Education	PT9M19S	559	2d	sd	true	https://i.ytimg.com/vi/2Ho6FsmJGdY/maxresdefault.jpg		2999	105	2	0	26
