position	channelId	channelTitle	videoId	publishedAt	publishedAtSQL	videoTitle	videoDescription	videoCategoryId	videoCategoryLabel	duration	durationSec	dimension	definition	caption	thumbnail_maxres	licensedContent	viewCount	likeCount	dislikeCount	favoriteCount	commentCount
87	UCg5UINpJgS4uqWZkv2Qh1Mw	Springboard India	qwGnrjkQq98	2019-11-04T15:02:13Z	2019-11-04 15:02:13	Data Scientist Salary | How to get a Data Scientist job	This video briefs you about Data Scientist Salary and how to get a Data Scientist job. Hear Walmart Data Scientist, Neeraj Agrawal, explain What is data science, What is a Data Scientist along with tips on industry expectations from aspiring candidates and how you can prepare for a data science interview. Before you begin, don't forget to subscribe to our channel to stay posted on the latest content, interview tips and career advice. Below are the discussed topics: 0:50 What is data science? What is a data scientist? 1:01 Skills required to be data scientist? 1:34 Data Science career opportunities 1:57 Pre-requisities for becoming a data scientist 3:06 How to apply for data science job? 4:36 What does industry look for in a candidate 5:06 Data Scientist salary 7:25 Data Scientist salary based on geographies 8:00 How salary varies acc to experience? 8:45 Data Science applications 10:30 Advice to aspiring data scientists Subscribe to our channel to get updates on the latest videos. Hit the subscribe button now! http://bit.ly/36DfiCy #DataScientist #DataScienceJobs #DataScience #CareerGuide #DataScienceCareer Who is data science for? http://bit.ly/361sSz3 How a Data Science Course Can Help You Become a Data Scientist? http://bit.ly/32LisS5 Who are we? Springboard is an online learning platform that helps you master in-demand skills through a personal 1:1 mentor-led model and a project-driven curriculum. Over the last 6+ years, we have served 10K+ learners in 100+ countries. We are now in India and are offering Career Track programs in Data Science, Data Analytics and AI/ML along with job guarantee. Apply here: http://bit.ly/2kJhGnU For more information, please write to us at india@springboard.com or call us at +91 7483024691 or +91 7483024694 Follow Springboard: Facebook: https://www.facebook.com/springboardind/ LinkedIn: https://www.linkedin.com/company/spri Twitter: https://twitter.com/springboard_ind Medium: https://medium.com/@springboard_ind Hi guys. My name is Neeraj Agrawal. I'm a senior data scientist at Walmart. In today’s video, I'm going to talk about What is data science? What is a data scientist? And then how to get a good job in a great company? And finally I’m going to talk about What is data science salary? How much a data scientist can earn? So, what is data science? In a layman term, something to learn from data is data science. A guy who learns from data can learn from data is a data scientist. What data science comprises of? I think that you need a mathematics background. You should be a good statistician. You should have a good knowledge of statistics. You should be good at machine learning. Other than that, taking data science space as a whole. We have deep learning experts, in deep learning we have experts in NLP(Natural Language Processing) and we have experts in computer vision. company always looks that one should have good programming skills. It can be in python, it can be java or any other language and you should be good at making algorithms. Companies also look for someone who has a good mathematical background If somebody gave you a research paper to read can you read those papers.the reason we need a person who knows a little bit of probability and statistics. And finally, he should be knowing the basics of machine learning algorithms. The question is how to apply for the data scientists’ job?For instance, if you are not getting a project in your company then you have to build your programming skills very strong, work on some of the projects like Kaggle competition or as a part of some courses and then you can bring your potential on the table. Finally, let’s talk about the data scientists’ salaries. This is a hot topic & one thing that I have observed, people are moving into this field because of salary. There are three categories of people, the first one is who is starting from scratch. It's always good to enter into this field as early as possible because definitely you will have to compete with the person who is data scientist for 10 years and you have domain expertise of 10 years in your field then you have a 2 years of experience in a data science field and to match that salary it will be little tough but also data scientist salary depends on other factors like which companies you are targeting like there are some big companies & some startups and also some mid-range companies are there . Based on company you are targeting your salary will depend, so you cannot say that you have 5 years of experience - I should get a certain amount of salary but as a whole if you are a fresher or someone with 2-3 year of experience then you can expect in the range from 10-20 LPA or something like that and if you are really a bright guy and you are really working on data structures algorithms and all the things I am talking about you can expect little more and if you have 5-10 year experience it means you are a gem, so you can expect in the range of 30-40 LPA and more.	27	Education	PT11M44S	704	2d	hd	true	https://i.ytimg.com/vi/qwGnrjkQq98/maxresdefault.jpg		264749	5250	187	0	551
88	UCg5UINpJgS4uqWZkv2Qh1Mw	Springboard India	og-t8D40LjM	2019-10-30T14:24:41Z	2019-10-30 14:24:41	How does Springboard India career coaching help you make a career transition? | Data Science | AI-ML	This video tells you how career coaching at Springboard India helps you become a data scientist or Data Analyst or AI/ML Engineer. You will get to learn about our career coaching curriculum and about our human touch-led career coaching from Pradeep Sharma, one of the career coaches at Springboard India. Subscribe to our channel to get updates on the latest videos. Hit the subscribe button now! #DataScience #DataAnalytics #AI #MachineLearning #CareerGuide #DataScienceCareer Data Science Course http://bit.ly/2ozd7i6 How a Data Science Course Can Help You Become a Data Scientist? http://bit.ly/32LisS5 What does a Machine Learning Engineer do? http://bit.ly/32VTLT8 ______________________________________________ Who are we? Springboard is an online learning platform that helps you master in-demand skills through a personal 1:1 mentor-led model and a project-driven curriculum. Over the last 6+ years, we have served 10K+ learners in 100+ countries. We are now in India and are offering Career Track programs in Data Science, Data Analytics and AI/ML along with job guarantee. Apply here: http://bit.ly/2kJhGnU Our Vision Enable everyone to attain their full potential in the new world order Our Mission Our mission is to bridge the world’s skills gap… by enabling every individual to acquire the skills needed to advance their career How do we make it work? Project-based curriculum Weekly 1:1 calls with mentors who are industry experts Career Services i.e. career curriculum & unlimited 1:1 coaching on personalized job search strategy, networking, resume, salary negotiations, etc. 24X7 online community, alumni network, events The Springboard Experience: What do you get? At Springboard, we offer career track courses that are structured to fit into your life where you can learn at your own pace with 1-on-1 mentorship from industry experts and support from student advisors and career coaches. How do we make it work? Project-based curriculum Weekly 1:1 calls with mentors who are industry experts Career Services i.e. career curriculum & unlimited 1:1 coaching on personalized job search strategy, networking, resume, salary negotiations etc. 24X7 online community, alumni network, events The Springboard experience Learn in-demand job skills without putting your life on hold. We'll support you at every step. Structured to fit into your life. We know how busy you are. Our anytime, anywhere approach lets you decide when and where to study.No commuting to a classroom. You’ll study entirely online. All you need is an Internet connection. Built around human relationships. Studying alone is hard. Work with a personal mentor to drill into concepts, get feedback, and plan your career. Be supported by a team of student advisors and coaches helping you achieve your goals. Designed for workplace success. We design our curriculum with hiring managers and industry experts, not academics, so you learn the real-life skills you need for career success.Our curriculum focuses on hands-on projects and practical advice for job interviews and networking. Graduate with the portfolio and confidence you need to impress recruiters. Our mentors drive results You'll be matched with a mentor uniquely suited to your background and desired skill-set. -Research shows people with mentors earn bigger raises and have more fulfilling careers -Your mentor will show you how to apply concepts you learn to tackle real-world problems on the job. -Your mentor will share career advice and can help expand your professional network. What do you get on a mentor call? You will have 1-on-1 Skype calls with your mentor every week through the entire course. -Accountability: Work with your mentor to set goals and ensure you're on track for completion. -Career advice: Get insights about the latest industry trends, tips for interviews, and job-search advice. -Technical guidance: Get reviews of your project work and exercises, help with execution, and check-ins on progress. -Inspiration: Learn about real-world applications from someone who is talented and passionate about their work. For more information, please write to us at india@springboard.com or call us at +91 7483024691 or +91 7483024694 _______________________________________________ Follow Springboard: Facebook: https://www.facebook.com/springboardind/ LinkedIn: https://www.linkedin.com/company/spri... Twitter: https://twitter.com/springboard_ind Medium: https://medium.com/@springboard_ind	27	Education	PT2M44S	164	2d	hd	false	https://i.ytimg.com/vi/og-t8D40LjM/maxresdefault.jpg		560	18	0	0	2
89	UCg5UINpJgS4uqWZkv2Qh1Mw	Springboard India	_GJ9IDjHaKU	2019-10-25T14:23:33Z	2019-10-25 14:23:33	What is Data Science? | How to become a Data Scientist?	In this video, Chirasmita Mallick, Data Scientist at G2 and Mentor at Springboard explains How to become a data scientist. She also discusses the prerequisites and skills required to become a data scientist. She will walk you through the entire path to becoming a data scientist, from where to start, skills required, tools one should know to data science industry expectations along with tips on resume building and how to crack a data science interview. This video is a handy expert guide if you are planning to transition into a data science career track. Here are the topics that are answered in this video: 1:21 What is Data Science? 2:11 Who is Data Science for? 2:45 What kind of background is necessary to be a data scientist? 5:01 How to become a data scientist? What are the skills required to be a good data scientist? 9:58 How to find a job? 13:04 What does a data scientist do? 17:54 What tools does data scientist work on? 21:53 What do you expect candidates to bring to the table during an interview? 24:16 What advice would you like to give to the aspiring data scientist? Subscribe to our channel to get updates on the latest videos. Hit the subscribe button now! #DataScientist #DataScienceJobs #DataScience #CareerGuide #DataScienceCareer Who is data science for? http://bit.ly/361sSz3 How a Data Science Course Can Help You Become a Data Scientist? http://bit.ly/32LisS5 ______________________________________________ Who are we? Springboard is an online learning platform that helps you master in-demand skills through a personal 1:1 mentor-led model and a project-driven curriculum. Over the last 6+ years, we have served 10K+ learners in 100+ countries. We are now in India and are offering Career Track programs in Data Science, Data Analytics and AI/ML along with job guarantee. Apply here: http://bit.ly/2kJhGnU Our Vision Enable everyone to attain their full potential in the new world order Our Mission Our mission is to bridge the world’s skills gap… by enabling every individual to acquire the skills needed to advance their career How do we make it work? Project-based curriculum Weekly 1:1 calls with mentors who are industry experts Career Services i.e. career curriculum & unlimited 1:1 coaching on personalized job search strategy, networking, resume, salary negotiations, etc. 24X7 online community, alumni network, events The Springboard Experience: What do you get? At Springboard, we offer career track courses that are structured to fit into your life where you can learn at your own pace with 1-on-1 mentorship from industry experts and support from student advisors and career coaches. Data Science Career Track: Program Overview: -Course Structured for Working Professionals -15 Case Studies and Assignments -Weekly 1:1 Mentoring Sessions with Industry Experts -Student Advisor to help you complete the course -Job Guarantee* -450+ Hours of Learning -Hands-on Assignments -Teaching Associate for Code Reviews -No Cost EMI Option -Weekly Office Hours with AI Experts Top Skills You Will Learn in the career track course: Python Data Science Stack, Data Wrangling, Exploratory Data Analysis, Data Visualisation, Statistical Inference, Data Science at Scale, Machine Learning Specialisation. Tools Covered in the career track course: Python data science toolbox, Scikit Learn, Spark/PySpark, Pandas, SQL/NoSQL, Keras/TensorFlow, SparkML. Projects and Case Studies: -JSON Bases data exercises -API Mini Project -SQL Mini Project -Human Body Temperature using EDA -Examine racial discrimination using EDA -Reduce hospital readmission using EDA -Linear regression using Boston housing data set -Heights and weights using logistic regression -Predictive movie ratings and reviews using Naive Bayes -Segmentation using Clustering -MapReduce with Spark Job Opportunities available post the course completion: Data Scientist, Data Analyst, Data Engineer, Machine Learning Engineer, and others. For more information, please write to us at india@springboard.com or call us at +91 7483024691 or +91 7483024694 _______________________________________________ Follow Springboard: Facebook: https://www.facebook.com/springboardind/ LinkedIn: https://www.linkedin.com/company/spri... Twitter: https://twitter.com/springboard_ind Medium: https://medium.com/@springboard_ind	27	Education	PT26M4S	1564	2d	hd	false	https://i.ytimg.com/vi/_GJ9IDjHaKU/maxresdefault.jpg		54229	1740	26	0	149
90	UCg5UINpJgS4uqWZkv2Qh1Mw	Springboard India	zTR76d7F0Bo	2019-10-23T12:28:28Z	2019-10-23 12:28:28	Launching Data Analytics Career Track in partnership with Microsoft | Data Analytics Courses	Springboard India is excited to launch the Data Analytics Career Track developed in partnership with Microsoft to help learners transition into the field of Data Analytics. This course has been packaged to enable anyone across any functional role to be able to make sense of data. In this video, you will get to learn about the DAC course details and how our human touch led mentoring and job guarantee works from Prashant Sharma, Springboard India’s Head of Growth. Watch this video to know how we can help you make a career transition into Data Analytics. Who are we? Springboard is an online learning platform that helps technology professionals master in-demand skills through a game-changing 1:1 mentor-led model and a project-driven curriculum. Over the last 6+ years, we have served 10K+ learners in 100+ countries. We have now entered India and launched career-track programs in Data Science, Data Analytics and AI/ML. A feature that differentiates us from other players is our highly successful job guarantee feature which is designed to help our learners make career transitions. Our Vision Enable everyone to attain their full potential in the new world order Our Mission Our mission is to bridge the world’s skills gap… by enabling every individual to acquire the skills needed to advance their career The Springboard Experience: What do you get? At Springboard, we offer career track courses that are structured to fit into your life where you can learn at your own pace with 1-on-1 mentorship from industry experts and support from student advisors and career coaches. Data Analytics Career Track: Program Overview: -Course Structured for Working Professionals -15 Case Studies and Assignments -Weekly 1:1 Mentoring Sessions with Industry Experts -Student Advisor to help you complete the course -Job Guarantee* -400+ Hours of Learning -Hands-on Assignments -Teaching Associate for Code Reviews -No Cost EMI Option -Weekly Office Hours with Data Analyst Experts Top Skills You Will Learn in the career track course: -Framing Structured Thinking -Analyzing Business Problems -Data Visualization -Connecting Data Using SQL -Tableau -Capstone Projects Tools Covered in the career track course: Excel, SQL, Python, Tableau, Power BI Projects and Case Studies: Case Studies Case Study 1 : Problem Statement - Southern Water Corp Case Study 2 : Revenue Focussed Value Driver Tree Case Study 3 : Cost Focussed Value Driver Tree Case Study 4 : EBIT Focussed Value Driver Tree Case Study 5 : Economics Case Study Case Study 6 : Statistics Case Study Case Study 7 : Inferential Statistics - Southern Water Corp Case Study 8 : Chem Corp Case Study Case Study 9 : Executive presentation Case Study 10 : Technical Presentation Case Study 11 : Non - Technical Presentation Projects Create your own Problem Statement: Monalco Mining Building Your Own Issue Tree Create Your Value Driver Tree Job Opportunities available post the course completion: -Data Analyst -Business Analyst -Data Insight Business Analyst -Data Intelligence Engineer -Data Analyst(Forecasting) -Data Visualization Analyst -IT System Analyst -Operations Analyst -Quantitative Analyst -Digital Marketing Manager For more information, please write to us at india@springboard.com or call us at +91 7483024691 or +91 7483024694 _______________________________________________ Follow Springboard: Facebook: https://www.facebook.com/springboardind/ LinkedIn: https://www.linkedin.com/company/spri... Twitter: https://twitter.com/springboard_ind Medium: https://medium.com/@springboard_ind Background music credits: https://soundcloud.com/musicformedia-...	27	Education	PT2M17S	137	2d	hd	false	https://i.ytimg.com/vi/zTR76d7F0Bo/maxresdefault.jpg		200013	158	2	0	14
91	UCg5UINpJgS4uqWZkv2Qh1Mw	Springboard India	s1DcPux24gQ	2019-10-14T12:49:24Z	2019-10-14 12:49:24	What does a Machine Learning Engineer do? | Intro to Machine Learning Engineer Jobs	In this video, Farhat Habib, Director of Data Science at InMobi, and Mentor at Springboard explains What does a Machine Learning Engineer Do. He also briefs about the job responsibilities of a Machine Learning Engineer. If you have been considering becoming a machine learning engineer, this video will give you an understanding of what are the prerequisite skills to become one along with expert advice. Check out this video to find out whether machine learning could be your future job. Here are the topics that are answered in this video: Subscribe to our channel to get updates on the latest videos. Hit the subscribe button now! #MachineLearningEngineer #MachineLearningEngineer #MachineLearningEngineerJobs ______________________________________________ Who are we? Springboard is an online learning platform that helps you master in-demand skills through a personal 1:1 mentor-led model and a project-driven curriculum. Over the last 6+ years, we have served 10K+ learners in 100+ countries. We are now in India and are offering Career Track programs in Data Science, Data Analytics and AI/ML along with job guarantee. Apply here: http://bit.ly/2kJhGnU Our Vision Enable everyone to attain their full potential in the new world order Our Mission Our mission is to bridge the world’s skills gap… by enabling every individual to acquire the skills needed to advance their career How do we make it work? -Project-based curriculum -Weekly 1:1 calls with mentors who are industry experts -Career Services i.e. career curriculum & unlimited 1:1 coaching on personalized job search strategy, networking, resume, salary negotiations, etc. -24X7 online community, alumni network, events -Lifetime Access to resources The Springboard Experience: What do you get? At Springboard, we offer career track courses that are structured to fit into your life where you can learn at your own pace with 1-on-1 mentorship from industry experts and support from student advisors and career coaches. AI/Machine Learning Career Track: Program Overview: -Course Structured For Working Professionals Only -15 Case Studies and Assignments -Weekly 1:1 Mentoring Sessions with Industry Experts -Student Advisor To Help You Complete The Course -Job Guarantee * -450+ Hours Of Learning -Hands-On Assignments -Teaching Associate For Code Reviews -No Cost EMI Option -Weekly Office Hours with AI/ML Experts Top Skills You Will Learn in the career track course: Advanced ML Algorithms, NLP, Deep Learning, Image Processing, and Computer Vision, Mathematics and Statistics for AI, Data Wrangling, Deploying Scalable ML Models. Tools Covered in the career track course: Scikit Learn, Pytorch, Hadoop, Luigi, Spark/PySpark, Docker and Containers, Terraform, NumPy, Pandas, Python, Dask, SQL/NoSQL, Keras/TensorFlow, SparkML, CuPy(L) Projects included in the Career Track -API -Data Wrangling With Pandas -JSON Based Data Exercises -SQL at Scale With Spark -Data Wrangling at Scale With Spark -Linear Regression -Logistic Regression -Tree-Based Algorithms -Clustering -Spark ML Case Studies part of the Career Track Case Study 1 : Apache Spark @Scale : A 60 TB+ Use Case at Facebook Case Study 2 : Explainable AI/ML Case Study 3 : Natural Language Processing - Finding Duplicate Questions on Quora Case Study 4 : Computer Vision - Medical Images Case Study 5 : Computer Vision - Fashion Images Job Opportunities available post the course completion: ML Engineer, Data Scientist, Deep Learning Engineer, Data Analyst, Data Engineer, NLP Engineer, NLP ANalyst, Research Opportunities, etc. For more information, please write to us at india@springboard.com or call us at +91 7483024691 or +91 7483024694 _______________________________________________ Follow Springboard: Facebook: https://www.facebook.com/springboardind/ LinkedIn: https://www.linkedin.com/company/spri... Twitter: https://twitter.com/springboard_ind Medium: https://medium.com/@springboard_ind	27	Education	PT13M6S	786	2d	sd	false	https://i.ytimg.com/vi/s1DcPux24gQ/maxresdefault.jpg		3381	106	0	0	8
